Great Price for a phone in great condition,It works as expected.,2020年1月21日 在美国审核
"Great buy, but had to return it.","The phone was in excellent condition, minor hairline scratches along the edges of the shell but not really a big thing. Screen was excellent, battery capacity at 95%. Box came with a charger and usb lightning cable. Everything ok until i had a software issue, had to return the phone. Seller was very responsible and had very good customer service. No problem dealing with the process of receiving the device or issuing a refund (Replacement was offered too). I bought it from WeDeliverWireless. Great service and devices.",2020年10月14日 在美国审核
It works fine,We have owned it for a while now and while it works fine and looks fine battery life is now well below 80%.I think it was about 84 when it arrived.I think phone is good for about a year and then needs battery replaced or buy newer phone.,2022年6月5日 在美国审核
DO NOT BUY A USED PHONE FROM AMAZON,"I must start with ""I'm a huge Amazon fan and a (very) regular customer.On this item though?Bottom line:DO NOT BUY A REFURBISHED PHONE iFROM AMAZON.In the third month of ownership, my contacts begin saying, ""you're breaking up.""I, of course, thought it was them or the cell coverage, because I have a ""new"" phone.At the four month mark, on just about every call, after about 3 minutes, my contact reports my sound is dropping intermittently until finally they can hear nothing.I reached out to the seller, Refone.No response.I reach out to Amazon, ""we'll try to get an approval return.""Ultimately, the response from both Amazon and the seller?""Too bad, so sad.""$450 for 3.5 months?Save your money.Buy from a trusted, local source.",2021年6月9日 在美国审核
I like the phone but.... it has issues,The phone run hot I’m almost tempted to return it seriously,2020年10月2日 在美国审核
Great,"The phone is great. Came in a standard white box with a charger, was easy to transfer everything from my old phone to this one, although when i deleted everything from the other phone i had, i lost some contacts. Opened it up, the phone felt sticky but nothing a little disinfectant couldn’t fix. Everything else is great. No complaints.",2021年1月18日 在美国审核
Fair enough for the price,"Although the phone runs smoothly most of the time, it lags and has some glitches here and there. The battery has 84% battery life, which is part of the deal, but I can really tell that it isn’t the best condition for it and it gets really hot when charging. When it comes to aesthetics, there a few tiny scratches mostly in the sides that you can only see up close. Overall for the price, I think it’s a good deal.",2021年9月30日 在美国审核
Amazing new technology,Love my new phone!,2020年12月6日 在美国审核
Good,"Tiny scratches under the phone (unseen to be honest). Face recognition sometimes have problems, but it's great. Phone condition in general is working as intended and battery life it's in great condition too. Really great!",2020年4月18日 在美国审核
Almost excelent,"The cellphone I bought is a renewed one, it came almost perfect, screen and back pannel PERFECT not a single scratch, BUT the bumper really showed it was a used device, not new and clearly used, however, cellphone works just fine, nor a single problem and battery status is at 86%, once again, not new but not bad.",2021年3月15日 在美国审核
"Doesn't turn on, and odd shaking noise","I got the phone in a odd box with bubble wrap around the phone, not a great start. That doesn't matter much to me so i continued to stay positive, its also worth to note i got the last one in stock at the time, but i thought that wouldn't mean much. When i got it the phone has a fairly loud rattling noise when i move it, and while i charge it it's in a continuous off and on loop. I have tried force/hard restarting it and letting it charge for a while now, this sucks because i don't understand how you can ship out a phone that fails to even boot up. Its also fairly scratched up and i'm honestly scared to even try to fix it at this point in fear of being more disappoint about battery health because at this point i do NOT have high expectations. Sorry for the long paragraph but it needed to be said.",2020年5月9日 在美国审核
Good phone short battery life,The phone performs well was in nice condition however it was not renewedJust cleaned they arrive with a used batteryThis being said I can’t recommend them or would I purchase anotherI asked for a partial refund and was told I could return the phone rather rudely,2021年8月23日 在美国审核
Great Condition,Perfect.Only a few light scratches at bottom of screen which you can’t see with screen protector on it.Sides and back were perfect.Camera lens was perfect.Battery at 94%.Saved a lot of money and got the phone I wanted.,2020年2月14日 在美国审核
Apple iPhone XS screen too small for my liking,"Apple iPhone XS is a great phone and the seller kept his side of the deal.However, when I received the phone, I was not impressed due to the small screen size.I have shipped it back through UPS; and ordered Apple iPhone XS Max, 6.5"", 512GB instead.",2019年11月2日 在美国审核
Recommended purchase!,Shipped expeditiously. Facial recognition is amazing and works like a charm. Came with 85% battery health (could be better but I’m not usually one to complain). Glass on the back and the screen are in amazing condition. Extremely small scuffs here and there but an over all great buy for the price. Thank you! :)- A satisfied customer,2021年1月21日 在美国审核
Battery life is not as mentioned. It has not cleaned poperly.,I got a device with 77%battery life even though the seller has mentioned that the product has atleat 80%battery life..Also the device has not cleaned properly.I dont have time to go for a replacement because I bought this to gift someone..,2022年4月26日 在美国审核
Making a fast review befor christmas for them,I gave them 4 stars only because this is a fast review for them but phone looks brand new now im not sure if its unlocked or not and i wont till Christmas but so far doing a quick scan over the phonelooks good and works but ill know more after he opens it on Christmas,2021年12月3日 在美国审核
"Work flawlessly, but low battery life (80%)","The phone works flawlessly. No issue. It came without the original box. There were a charger and cord in the box, but they were not original. Few tiny negligible scratches on the screen. battery life was a bit low (80%)",2022年6月24日 在美国审核
Best IPhone deal on the web,I spent $400 on this Xs with 256gb<br>You can’t get that deal anywhere else</br>,2021年3月23日 在美国审核
i dont like the fact i receive the phone i picked .,"i received a great phone honestly, just not the right phone i specifically put Xs Max but just receive a Xs. nothing wrong with it if your into smaller phones. but with a case it’s a decent size .it’s been about a month since having it and it working just fine . face recognition is goodyou could even add an alternative. the battery life was decent it was 86% but it is what it is . phone came in good condition minor with minor scratches . other than that great phone",2021年2月11日 在美国审核
Buenas alternativa,"Debe entenderse que no tendrás una batería nueva cuando compras un teléfono de Segunda, pero cuando usan cargadores que no son originales o que no son certificados hacen que la batería y otros componentes se deterioren.",2021年4月11日 在美国审核
Almost a good deal,"Phone had minor superficial scratches on the screen but they weren’t terrible. Overall the physical appearance of the phone was fine. However, once I set up the phone I could not set up the Face ID and it was glitchy. Wether I was trying to surf the internet, change a setting, or in an app, the phone would jump back to the previous page and then forward to the page I was on, then back, then forward and it wouldn’t stop doing it. It would also open apps on its own. Very disappointed because it looked decent for a used phone and had a battery health of 90% but it was unusable.",2020年12月31日 在美国审核
A couple of marks but good for the price,"It works perfectly fine. The screen had two dents in it, so it's not perfect, but if you're buying a refurbished phone, that's what you get.",2021年2月8日 在美国审核
phone crapped out in less than 6 months,phone crapped out in less than 6 months,2021年6月29日 在美国审核
You may Ned t contact Apple to finish clearing your phone before activating with your carrier,"I wish it came with instructions, and when setting it up I had some concerns .I had to work with Apple to clean the the phone before it could activated.",2021年4月5日 在美国审核
Exactly As Advertised,It arrived a full day sooner than expected and it was in pristine condition.,2020年4月22日 在美国审核
Unusable product,"This was the worst experience I've had buying a phone on amazon. This was going to be a gift. Thank god i checked it out. Besides the obvious flaws shown on pictures, the speaker does not work at all. So no talking on the phone, making videos etc. Every corner of the phone is extremely scratched and scuffed. Scratches all along the sides of the phone. The back of the phone has scratches &amp; cracks near the camera &amp; the screen has a black spot on it. The worst part is, they have made it difficult to send back. Often times they will have an option to have the post office print the shipping label but I have to print it so I had to go buy ink &amp; get my printer out to print the label to send it back. I absolutely hate dealing with returns so if they are minor/cosmetic issues, I'll try to just deal with it but this item looks like I was sent someones broken phone. I cant believe I spent $300 on this phone &amp; it's completely unusable. The battery life is non existent. It dies within a couple hours without use. I cant make phone calls without a speaker that works. I cant use a phone that's always dead. Just no. Unacceptable.",2021年5月3日 在美国审核
Happy with my phone,"Been super excited and impressed with my phone so far! Little to no scratches, battery life over 85%z",2020年6月18日 在美国审核
Some scratches on the glass and a dirty speaker hole with someone’s face oils built up in it.,"Screen has a bit scratched up very superficially but facial oils built up in ear speaker area. Battery charges very quick but battery life isn’t the best, I do use it for work though. Facial recognition is great and even catches the up-chin version of me and if I’m wearing glasses, much better than Galaxy s10 in that respect.",2021年11月6日 在美国审核
Like New!,Phones was in great condition. No issues.,2020年3月2日 在美国审核
Nice phone.  No manual,The phone is very good. There is only one complaint:There was no owner’s manual.Thank God for search engines. I still wouldn’t know how to use the phone without it.,2020年9月8日 在美国审核
First iPhone and I love it,Loving the phone I just got it today and it’s my first iPhone. The phone came with 83% battery life but that’s ok. True Tone works as well as Face ID I’m glad I got the phone from hybrid it. I’ll update this in a few months but for now I’m loving it,2022年5月7日 在美国审核
"I loved it, at first!","Phone is practically brand new! No scratches at all! Works great so far! 86% battery life, but that’s ok. Had no problem switching my number over. Was unlocked as it said, was able to switch over the phone! I love it!!Update: the phone is starting to malfunction. It has run hot, and I’m unable to do anything with it! I can not see who’s calling, can’t answer a call, none of my apps are opening! Nothing else works! I can make calls, by using Siri only. I can use the swipe down screen, to put on airplane mold, dnd, etc. I can’t even turn it off to allow it to cool down! Prior to this, sometimes I’d have a difficult time getting it to turn back on, when turned off! I sometimes have trouble pushing 1,2,3etc.. when prompted on a phone call. I’m sending it back! That’s if I can get it to function right so I can erase my iCloud!",2020年4月28日 在美国审核
This is the WORST Amazon Purchase I have EVER made,"Listen, I know your reading other reviews before you buy this phone. Some reviews are saying they got a near MINT condition iphone, or a iphone that's in""not so bad"" condition.But then there are ones like the one I received. This screen had the most amount of scuffs, scratches, and cracks i've ever seen. It's so bad. Also, the battery was at a frightening low 85%. The phone was not even factory reset either!! In fact, the last person who used this even left their call history on here AND a picture. Are you serious? You actually got to be joking sending out a product like this given the listing description the seller is providing. This literally feels like someone else's return.Oh ALSO, I spent $15 EXTRA dollars for FASTER shipping.......and it ended up arriving 4 DAYS LATER than standard shipping would cost. ANDthe seller shipped this in a jiffy envelope. I repeat, the seller sent a iPhone in a JIFFY envelope. This is beyond unacceptable. And I have pictures to prove all of this. Its such a tight fit in this envelope that I can’t even get it back inside to send it back!So currently, I have reached out to the seller because I would like to receive a replacement iPhone XS Space Gray Unlocked in good condition like in the other positive reviews you see here as well as a refund on my shipping costs so we'll see what happens. However, if that does not work out I am returning, getting a full refund and never looking back.TLDR: The amount of stress this purchase has caused me is not worth the price in the slightest. Don't bother. Seller takes DAYS to respond. This is truly the worst purchase I have EVER made on Amazon. Never Again. Seriously...This was a nightmare of an experience...buyer beware.",2021年2月5日 在美国审核
Fast shipping and phone in good condition.,"Very fast shipping, came days before eta. Screen, body, &amp; battery showed minimal amount wear and tear, for the amount of time this model has been on the market. Overall very happy with purchase.",2021年3月9日 在美国审核
Honestly not a bad deal,"This came in perfect condition aside from the low battery health (87%) which was to be expected. I did hope to receive a phone with better battery life but I can’t really complain considering there are no other issues. Scratches and scuffs are minor, to the point where it looks new. Good buy.",2021年2月4日 在美国审核
like new,This is a great phone,2021年1月11日 在美国审核
Just perfect!,Sorry it has a case on. Anyway I think this is cheaper than most and it’s perfect! It comes with a screen cover and a helpful guide! I really enjoy it and I’m very excited that I got it. It came 4 -5 days earlier than expected!,2020年11月30日 在美国审核
The battery life is less then 80% and the fone is in Africa/Angola.,"The battery Life is less then 80%, is 78 and the amazon information says that exceed 80%.<br>Now the phone is here in my country, i have and is too expensive to send it back...Im very sad with this...</br>",2021年11月26日 在美国审核
Good price and mostly works,"Overall in good condition and everything except the phone speaker works. After not having a phone for 8 days, I was not in the mood to send this back for a replacement and decided to pay for the speaker replacement myself. Battery life came at 85%, which isn't bad.",2021年9月8日 在美国审核
great phone but poor bundle,"Phone comes with only cable, not even an wall adapter.Description of what is in box is misleading in my opinion.",2020年1月20日 在美国审核
Could be better,"Until now, woks great. Face recognition ok! Battery 85 . Im using the phone the whole day. I thought it would be at least 90. When putting tempered glass, screen is not responding. Ill update the review soon if there’s other changes.",2022年3月2日 在美国审核
Awesome Phone,"After looking at some of the reviews i was kind of worried, but when i got my phone it was perfect and everything is fine.",2020年4月28日 在美国审核
good seller decent product quality,Got the phone when expected and came in good quality although it also had two little scratches on the screen that was kinda annoying but didn’t bother me too much. Battery life was also great out the box at 92% battery health. All in all happy with purchase.,2020年1月15日 在美国审核
Good,"It’s a good deal but the battery doesn’t work so fine, but I’m in Ecuador and the celular is unlocked",2022年4月14日 在美国审核
Low quality aftermarket screen,"I ordered an iPhone XS for my wife since I have the same model and really like it. Unfortunately, the phone they sent me came with what looks like a much lower quality aftermarket LED screen as opposed to an original AMOLED screen. The side-by-side comparison to my phone was night and day. I just couldn't accept that they would try to market this as good as the original, so I returned it.Also, the aftermarket charger they included was overheating after less than 5 minutes of charging.",2020年5月13日 在美国审核
"Great, but battery life low","So far everything works great, but I noticed the battery wasn’t lasting that long. I checked the battery quality in the settings and it’s at 84% which my wife has had her phone for over 2 years and it’s at 88%. Checking the battery life is extremely easy and a no brainer so not sure how it was sent with that low a battery health. If it wasn’t for the battery it is a 5 star rating, but now I’ll have to replace the battery at some point.",2022年4月10日 在美国审核
Fantastic!,"Outstanding product, customer service, communication, and commitment.",2020年8月18日 在美国审核
Good phone; great deal,"The phone works very well. Everything about the phone was equal to an Apple Refurb. Battery life is good; screen and body of the phone like new.The only bad side is the charging cable and adapter. Both are off brand junk.Lastly, when the product description says “May not come in original packaging”, they aren’t kidding. The XS arrived (in good time I might add) in a box designed for a larger iPhone. No big deal. Just an observation.Overall, I’m very satisfied with the purchase.",2019年12月31日 在美国审核
Would recommend,Phone works great have had over a month.,2021年4月10日 在美国审核
Don’t waste your time,"This was the second renewed item I have purchased. The first one was heavily scratched and dirty and I returned it for a refund. I thought I would give it a second chance thinking that maybe it was just bad luck the first time around. However the second phone was probably worse. The screen was also so scratched and so dirty, I put it right back in the box as soon as I opened it. I will not be purchasing any renewed phones from here again. 2 stars given for easy returns.",2021年11月18日 在美国审核
Battery health is low,Im overall satisfied with the phone I received the only down side was that i got it with 79% battery health. Its degraded quite a bit but everything else is great no scratches or nothing!,2020年12月28日 在美国审核
Heavily used and nonfunctional so far,"Mine came dead, and the generic charger in the box doesn't fit this phone so I can't charge it to see if it works. The description says ""like new"" but the phone has noticeable scratches on both the front and back of the phone. All in, this is not at all what I was spending this amount of money to get, so I have requested a return. So far the seller hasn't responded, so I continue to have money tied up in a heavily used and nonfunctional phone.",2020年2月22日 在美国审核
Rattling nose,"Over all pretty good, no Damage on it visually but the one problem is when u shake it you can hear a rattling nose coming form it like something wasn’t put in correctly I hope I won’t have any problems with it in the future but for now it works it’s just something wasn’t put in correctly inside of the phone.",2022年3月12日 在美国审核
4 Months to realize some sensors doesn't work,"The iphone XS came in great condition. Everything worked, so I thought. I found out 4 months after purchase (Jan '21)that the compass and some other sensors in the phone don't work. I downloaded an app called Sensor Kinetics to test what is working and what isn't. Accelerometer works (which does portrait/landscape switching or I would of noticed sooner) but Gyroscope, Magnetometer (compass), Linear accelerator sensor, Gravity sensor, and Attitude Sensor all don't work.I'm out of the return window by about 30 days, so I'm stuck with it. I'm going to try and repair it myself. I would purchase again but download that App and make sure everything works.",2021年5月27日 在美国审核
Worked fine up until a few days before the warranty expired,"My iPhone Xs 256gb functioned fine until right when the return period ended. Now it has an inoperable FACE ID as well as a non functioning receiver speaker.Attempted a full factory reset on the phone as to what many trouble shooting websites suggested along with what Apple suggested as well.Ive emailed the seller of this product and will update my review of the product accordingly, until then I am not impressed with Amazon refurbished products &amp; would advise anyone not to purchase though that program.",2022年6月8日 在美国审核
Freezes up constantly. Have hard set it several times a week.,"The phone came in great shape but it freezes up constantly. It started like once a month, then moved to doing it every few weeks and now it’s not quite a daily thing but almost. So frustrating. I have had it only about six months now",2022年6月7日 在美国审核
Minimal packaging,"The IPhone XS came in a bubble wrapped envelope, phone wrapped in bubble wrap and a sheet of padding. I was surprised it showed up in the minimal packaging. The phone cord is really short (2-3 inches long) with the normal power cube. I feel like the seller did the minimum amount of work to get the phone to me safely. The phone is working great. Battery life came at 88%.",2021年3月10日 在美国审核
Cellular Services stopped working just a few weeks after the return window,"The phone came in great condition and still works well with the exception of the cellular signal not working after the first few months. I took it to get it fixed and the technicians told me there was a 50% chance of destroying the phone completely to try to fix it. After further research, this seems to be a common issue with the new update of iPhone X. Everything else about the phone is great so it's a shame that I can no longer use it as a primary phone and am now having to invest money again into a new phone only a few months later. Usually phones last me 2+ years.",2021年8月30日 在美国审核
Face ID Software Issues,"Couldn’t set up Face ID. Had the same problem on a previous XS I owned. Always tells you to hold phone higher or lower and hold closer or further away. Apparently it’s a software issue and apple wants a good amount to fix it. Unfortunately I returned this one. Woot accepted the return, I’m just waiting for my refund now. I wouldn’t buy another XS.",2021年4月14日 在美国审核
Very visibly cracked screen,"While the description said there may be very small imperfections or scratches with this being a refurbished iphone, I was very disappointed that mine arrived with a very large, visible crack across the entire upper right section of the screen. Phone works fine, but the appearance not at all as described.",2021年9月7日 在美国审核
value and finish,liked it. looks good . well refurbished. sending to family overseas.,2021年6月24日 在美国审核
An excellent buy,"I am using this phone for just one week now.It is working excellent so far.Phone was received on time and in excellent condition.If I say nothing, most people will believe that it is new",2020年10月27日 在美国审核
Broken charger.,The charger it came with was split in half but it’s amazing otherwise. If it wasn’t for the broken charger I would’ve given that full 5 stars.,2020年7月29日 在美国审核
iphone XS,"i was worried that i wouldn't get my phone in good condition but i did...it came on time and it came with a charger. not the original, it still works though. the battery life was 89% which is okay. and it works with my sim. i definitely recommend.",2021年6月26日 在美国审核
Like New,"The product is like new and I am satisfied. My only complaint regards the charging cable, which does not work for transferring data from your computer to your iPhone.",2020年6月14日 在美国审核
Adorei o meu iPhone,I liked it very much arrived on time the iPhone is like new without scratches I'll even buy another,2020年2月13日 在美国审核
Great customer service!,This is the not so great because the phone quality was bad. I wouldn’t advise anyone to buy their refurbish products but I gave them a 4 star because the seller was very responsive and understanding and agreed to give me my refund. I like the seller’s attitude. Great customer service!,2021年4月13日 在美国审核
Renewed previously owned iPhone,"Battery is less reliable than it should be, other than that I’d give it 5 stars!",2021年2月27日 在美国审核
It’s a good phone,I love the phone,2021年5月11日 在美国审核
Defective,Received the item for my son and it had a broken speaker,2022年1月23日 在美国审核
