"Honestly, it was worth it","I was very hesitant about buying an iPhone off of Amazon, but I did it and was not disappointed. It came with 100% battery life, so it basically was brand new. It came with a charger and cube (plug), but that's it. Sorry to disappoint those who into that airpod life.No scratches and shipped fairly quickly. The only complaint I have for the iPhone XS, in general, is that I really liked the fingerprint scan, sometimes the face recognition doesn't work when you're looking down. But what it lacks in that feature, the iPhone delivers in the portrait camera mode, I seriously am in love with the blur feature.Sincerely,A very satisfied Amazon customer",2019年6月22日 在美国审核
"Beautiful, lovely, practically brand new iPhone XS!","I absolutely love my new iPhone XS! It arrived on time and practically brand new. The battery health is at 95% so it’s practically a brand new battery in here. It’s a very beautiful looking phone and is very responsive especially with the face recognition. That works very well even in low light settings, or if you have sunglasses and a hat on. I was surprised at how accurate that was. The battery lasts all day easily and I’ve hardly had any issues with apps crashing or anything like that.The phone itself was flawless and came with a protective film over it. There’s no scratches or signs of wear or anything to be found on the phone which I thought was great especially since it is an Amazon renewed item!I would definitely recommend this for anybody that is looking to upgrade their phone. The one I got is fully unlocked to GSM and CDMA networks so you can use it for any cell phone provider as long as you have a SIM card which it does not come with. It does come with a SIM tool as well as a generic charger and short cable which I just have tucked away as spares.",2020年2月4日 在美国审核
Eh wouldn’t buy again,One - It comes in a weird boxTwo it had more scuffs and scratches than I’d like for the price3 - I had to return it because of how over all lame it came and how it showed up/ battery was pretty warn/scratches/ and I didn’t get the awesome feeling of unboxing it..,2019年6月30日 在美国审核
Phone not working,The phone is froze up and unable to use. Very poor product*Edit* within five minutes of talking with Amazon tech support the started working just fine,2018年12月25日 在美国审核
Its not expensive when you compare with other brand and operating systems. Thks.,"Thanks , i feeling very nice satisfacción with a new cellphone. Look like brand new.",2019年5月27日 在美国审核
Did not come with EarPods and Adapter,"Phone was in perfect condition and works great but came without EarPods and the the lightning to earphone jack adapter that is pictured with “what’s in the box”.If you must replace these, the $20 open box discount is not worth it. If I did not already have Bluetooth headphones, and received Amazon Visa discount points, I would have returned.",2018年11月21日 在美国审核
May be defective one,Suddenly Wifi is not working properly and i could see phone feels hot with calls dropping abruptly . I am really not sure of what to do .,2019年7月2日 在美国审核
WISH I COULD GIVE THEM ZERO,WISH I COULD GIVE THEM ZERO! NEGATIVE EXPERIENCE,2018年12月12日 在美国审核
"I recieved the xs MAX, not the xs like advertised.","First off I’m going to say that I recieved and iPhone xs MAX, not the standard xs like it’s advertised. Not a big deal to me, but it might be to some people. Also as the other review states, it comes with a charger but not the headphones or the headphone adapter.Other than that it looks brand new and came very quickly! Overall very satisfied. Honestly though, since this is the same price as a new xs, I would probably recommend just buying a brand new one instead.",2018年12月8日 在美国审核
NOT LEGIT IPHONE. CHEAP KNOCKOFF According to Apple Store,"To my dismay, my phone started getting VERY hot for no reason, then my screen started going out. I took it to Apple and they asked me ""Where did you get this fixed?"". I was confused. They said that BOTH the SCREEN and BATTERY were NOT APPLE, and instead were cheap replacement parts, and that they wouldn't service it. I'm not out $500 that I paid for a cheap knockoff. I suspected this might be the case because the screen was... bland, and the XS is supposed to have a magnificent ""OLED"" screen.This is 3.5 months after purchase.Pros: It did come with a nice screen protector on it. It also worked with my ATT sim card.I don't know if this is an Amazon wide problem, or if it's just this seller, but I feel like I've been scammed. All I know is I paid for something and got a cheap knockoff that died. I'm actually a law student and you can bet as soon as I pass the bar, I'm filing an ""implied warranty"" suit out of principal; look it up if you've ever been told something is ""out of warranty"" but feel like it was 'supposed' to last at least that long.",2020年7月16日 在美国审核
I love it so much!!!!!!,"It's compatible with my carrier (metro by t-mobile) all I had to do was ask. It doesn't appear to have any preexisting problems. I switched over from android and to my surprise it didn't take long to get fully acclimated to iOS (maybe a day or two). I forget what shipping option I chose (I think 1 day or something) but it arrived pretty quickly (within US i believe), definitely worth the extra bucks.",2019年7月6日 在美国审核
Refurbished but near perfect condition.,"Was nervous ordering refurbished but I cannot see any evidence it was ever touched. Battery shows 100% capacity, no scratches or marks anywhere and fully unlocked, tried sprint, att, and cricket Sim and all register and operate without issue.",2019年8月24日 在美国审核
Love the iPhone XS,"My husband has a bad habit of dropping his phone. He’s broken so many androids. Finally got him the iPhone XS and a case. Has dropped it many times and it’s still kicking. Over 6 months and still holding up!<br>iPhones have a great reputation for being tough.My son has had androids for years. I would always get him the cheapest ones because he would constantly break them. Case or no case. I finally upgraded my iPhone 5S to an iPhone XS and passed my old one to him and it lasted for 2 years. iPhone 5S is no longer compatible with our cell company so I had to upgrade his phone. I got him an iPhone XS as well (wasn’t giving up mine).First day I got my iPhone XS, we went to the water park. I didn’t want to leave it in the car or on the side lines, so I tried being careful as I carried it with me in the pool (stupid, I know). It fell in and was at the 4 foot depth for about 30 seconds before I could pull it out. No case. Still works great!We all have the 256gb size and none of us have used more than 60gb yet. I’ve had mine for 3 1/2 years, my son has had his for almost 2 years and my husband has had his for 6 months.</br>",2021年6月7日 在美国审核
The Phone is not in EXCELLENT CONDITION,"Mine had a cracked camera flash in the back side. I returned it immediately as I received it. Absolute waste of time and energy. why would Amazon allow these kind of low quality stuff.And you need to pay for the return, of a faulty product",2019年12月26日 在美国审核
Overall Very Happy With My Purchase from buySPRY,"I was skeptical about this at first, but I’m glad I bought the phone in the end. I read a lot of reviews that said the phone didn’t work or had varying things wrong with it, but I think most people go into this expecting a new phone with no damage whatsoever to the outside. However, if you read the product description carefully, it’ll tell you everything you need to know. I got lucky because there are no scratches or dents anywhere on the phone I received, but even if there had been some, I don’t think I would care. You’re paying $400 for a flagship phone, so expecting some minimal cosmetic damage is not a bad idea.I love this phone. Face recognition works great, the screen is vibrant and I can see a stark contrast in the colors when compared to my old iPhone 7+. I was hoping to get a newer battery, but I only got 83%. However, I don’t have an issue with that, because worst case scenario, I get the battery replaced for $70 at the Apple store, and I’m still paying less for this phone than I would pay for a new Xs or other newer iPhone.Overall, I can really only speak for buySPRY, but I really recommend buying from them. It’s a great phone, and I plan on having it for a long time.",2020年12月24日 在美国审核
Battery not 100%,"I’m content with what I got, but I think it should be more obvious that Amazon’s definition of refurbished is not the same as Apple’s definition. This item came with a battery at 88% of max capacity. I asked the vendor about their policy toward batteries in refurbished iPhone and they stated anything greater than 80% of max capacity is within Amazon’s guidelines.I am content with that for an iPhone XS 256gb at the $567 price point. I see the 256 GB model is now up to $599 which makes the battery comprise just a bit harder to swallow.The XS is a huge upgrade from my 7 and my wife’s 8 Plus. It was worth the price. Just beware of the battery consideration and make an informed choice. The screen is gorgeous!",2020年1月28日 在美国审核
Exactly What I Wanted,"I received my iPhone a few weeks ago and wanted to wait some time to use the phone before iI posted my review. I generally don't post reviews, but I felt this one needed a 'thumbs up'. My iPhone was delivered pretty quickly in a white box - not an official Apple iPhone box. They even provided the necessary tool to change sim-cards from phone to phone, which was useful. Battery life is fairly good and lasts me most of the day in the office (I'm always listening to music and on my phone for work)Overall, I love it and I'm glad I went through Amazon instead of Facebook Marketplace.",2020年3月7日 在美国审核
Premium Apple product without the premium price,"I switched to this phone from a Samsung galaxy S8+.As an iPad user, I was attracted to the continuous ecosphere Apple offered.There was a mild hiccup in transfer, as all my sorted photos transferred into a single album on the iPhone. After some sorting, though, I have no regrets whatsoever.The capability of this phone, despite it being one model year old, is striking (Many of its features are superior even to the current iPhone 11, including the OLED screen).The battery life has been better than expected for a renewed device, likely because it is only one model year old.I have larger hands, but I prefer the 5.8 inch size for one-handed use.If you are looking for a foray into the Apple ecosphere, this opportunity is hard to beat.",2020年1月2日 在美国审核
iPhone XS flawless case. Great hardware,So happy with my iPhone XS Battery is at a 90% screen is flawless. Back glass is flawless. Face ID works. So far I’m happy. You get 90 Day with amazon and also from the seller.happy Happy Happy.,2019年12月20日 在美国审核
Amazing! Perfect condition!,"Screen is amazing. Had to have OLED. It’s the only reason I didn’t want the XR.<br>Feels premium in every way.Wasn’t sure if I was going to keep it but it took about a day to know I could never give it up.It came well packaged with off brand charger. But the cord is really nice considering.Minor scuffs on metal and tiny scuff on bottom back glass. I was really really happy it was in such great condition. 89% battery.I hate that I love apple so much now. I had a Mac as a kid and kinda forgot how beautiful their OS and build quality is. But damn the cult of Mac entry fee is intimidating. And tbh it doesn’t replace windows for everything. But I’m slowly but surely going to own the entire ecosystem. And felt like and iPhone 7 wasn’t going to cut it. I’m really grateful my bf let me buy this. I hope you experience buying a refurbished iOS device is as great as mine was!Also be sure to order from an amazon endorsed seller, they give you more time to decide/be sure the device isn’t faulty.</br>",2020年5月14日 在美国审核
Great quality and price,"Really nice quality. If you’re looking for a basically new phone, but don’t need the latest and greatest model, don’t hesitate to get this as it’s well worth the price. The phone looks almost new upon arrival, there were only very small scuffs on the edge of the screen. They were too small for me to even consider them scratches. And once I put a screen protector on, I don’t even see them. Obviously, if you want an absolutely perfect phone, maybe this isn’t for you. The battery health was at 92% when it arrived; I’m upgrading from an iPhone 6, so both the battery life and phone overall are a huge upgrade. If you’re new to buying a phone on Amazon like I was, I can confirm that the fully unlocked version of this phone does work with a Verizon SIM (I was a bit worried about that, the whole CDMA vs GSM thing goes well over my head). Anyway, overall really happy with this purchase thus far, I’ll update this review if anything happens.",2021年5月30日 在美国审核
Same as new,"This renewed iPhone XS arrived from the seller Buy SPRY in perfect condition with 93% battery health. Included aftermarket box, compatible wall charger and cable with instructions.I spoke to associate before purchase and asked if this is fully unlocked and if will work with Sprint(Boost Mobile) since the description and details were contradicting each other. I was reinsured that it will work with Sprint CDMA network since is fully unlocked. When I received the phone, read included instructions there was a part in the bottom stating that this device is only compatible with GSM network for T MOBILE and ATT. Went step further and verified using devices sn# on network provider’s website and came back with the same massage stating this device is NOT compatible.Make the story short, it took a call to network provider customer service, explain the story that this is fully unlocked phone and pleading that it should work. Took the service rep about 5 min to make it compatible but could not use my existing SIM card nor other two spare ones. Had to wait few days for new SIM card to be sent. Once I got the new SIM card and went thru easy on-line activation, I was making phone calls with in 5 minutes.I recommend the renewed phone to any one who doesn’t want to pay ridicules price of new device and has little patience if same issue happens.",2020年4月15日 在美国审核
Love it!,"I purchased the iphone xs 256 gb in silver gray from the seller called:Verizon Pre-OwnedThe item was shipped fedex. In a box. With a aftermarket charger. The charger is acceptable. Delivered before estimated delivery date. Phone is in excellent shape. No signs of wear. Everything works. I had no problem having service hooked up. I was super nervous ordering a preowned phone through amazon. Some of the reviews can be scary. This was my 1st time. I will probably do it again. Just make sure you look up the seller and their reviews.The phone itself was for my daughter. Upgrading from the 7. The face id, battery life, lack of a home button, are all wonderfull to her. The screen is nice but big to her. The camera is amazing. She can not stop talking about the camera. I hope this review helps anyone on the fence about ordering pre-owned on amazon. Or the iphone xs itself.",2021年3月20日 在美国审核
Buying Renewed--Totally Worth It!,"I bought this phone back in December of 2019 and intentionally waited a few months to write a review to see how the phone behaved over time.Before buying the renewed iPhone XS off of Amazon, I had only bought brand new apple products from the Apple store. I would have never considered using an alternative site, until Apple raised it's prices on Apple Care. I have needed repairs on most of my Apple Products due to dropping my devices. I have no hate for Apple, but charging $250 for Apple care on phones is just not an option for me.I took a leap of faith and bought this version from Amazon. My XS came in the mail a few days later than expected (originally giving me the ""oh-crap-I-just-got-scammed"" feeling). Besides a few smudges which came off with some rubbing alcohol and the world's tiniest scratch--keep in mind, the renewed iPhones on amazon have to look like new from an arm's length away-- this phone is perfect.I genuinely have 0 complaints. The phone's battery has been consistent, I charge it for about 2-3 hours every 24-36 hours if I'm using the phone heavily throughout the day, and every 48 if not. It works flawlessly--it hasn't crashed, given me error messages, or refused to update (I've heard some horror stories about refurbished phones). Best of all, Amazon offers their own version of repair care for only $88.99 (comparable to Apple's old policy).Overall, if you're like me and you don't need the latest version of smartphones, but know you need an accident protection plan, then just get the Amazon renewed iPhones. It will save you hundreds of dollars and is absolutely worth it!",2020年4月5日 在美国审核
I definitely do not regret this purchase!,"If you want to buy an iPhone and you don't mind being a couple generations behind, or have to purchase a 2nd hand one, I have absolutely no problems with my purchase and completely recommend this purchase. The iPhone arrived without any visible scratches, scuffs, dings or dents. It honestly looked like a brand new iPhone XS.Battery Health was at 81%.I did not see any SIM removal tool in my box but that does not affect my rating. it works with my SIM (I'm sure you see the, 'LTE,' in some of the photos.)I don't know who these 1 star guys are here but you have seen my proof. Check out the photos to see what I got and what you too can also own!",2021年11月18日 在美国审核
"Great product, great customer service","This is the third iPhone we have purchased from Hybrid IT. Each one arrived in perfect condition and were flawless in appearance. We have had no issues from the first two but this iPhone XS battery dipped down under 80% on the battery health meter within the first month. I contacted them and received a prompt response (on a holiday weekend). They offered me the choice of refund, exchange, or replace the battery and receive a refund. No hassles. I cannot speak for other sellers, but Hybrid IT definitely cares about satisfied customers.",2021年12月1日 在美国审核
Worth the money,"The battery arrived at 92% capacity. I wish it had a better battery as I have to charge it twice a day. The Face ID Works, it came in a 3rd party box, with a 3rd party charger. I don’t mind that too much as I am gonna go out and buy a braided cable charger and also I mostly use wireless charging anyways. It has an original display as True Tone works, the camera is great, and this is the phone that I switched from Samsung to Apple with becaus the price was just so damn great!",2020年3月6日 在美国审核
Highly  highly recommended Iphone XS silver.,"Highly recommended.It was my first purchase of a renewed cell phone from amazon and I can only tell you it was worth it. I recommend it especially to all people who do not have the budget to buy a new one.I have read the most comments from seller ""BuySPRY"" and buyers to make the decision to buythis cell phone. Most of the negative comments readed, in my opinion, are from very demanding people and they HAVEN'T read the policy and / or product description.The article arrived without any detail and with 92% battery life which in my opinion very good for a Renewed cell phone. Everything is working so far.",2020年6月8日 在美国审核
Excellent 10/10 Conditon,"Bought the unlocked iphone xs from BuySPRY (just included sellers name if others are less consistent).the phone was in perfect condition, couldn't tell it apart from new. Battery health was 91%. No issues at all.The box it came in was in some box for another chinese phone. But im just mentioning that, its a non issue",2020年2月13日 在美国审核
Clearing Way the Unknown,"I received my renewed iPhone XS quickly after ordering it (24 hours) and it arrived in a dinky little box. Amongst the poor reviews were those who had too purchased a renewed/refurbished iPhones and were let down with very poor phone conditions and battery life.Much to my delight I was happy to see that the phone I purchased was in great condition. No noticeable scratches on the screen or back-glass. It felt brand-new. What reminded me it was not brand new was the 85% maximum battery life. Apart from that small downside, the phone works great with my existing SIM card from my old phone and it transfered all of my data and apps flawlessly.Great purchase from someone who was nervous about buying a $350 phone renewed.",2021年10月21日 在美国审核
"Works Great, Good Value","Worked flawlessly after charging. I thought it would come with some battery life so I had a mini heart attack when it didn’t turn on but once charged everything worked great and I transitioned everything from my old phone with no problems. I upgraded from the X because I had a messed up screen and the battery life sucked. So far the battery life on the xs seems to be slightly better which is okay given that it’s basically the same exact model as the X internally. The only thing I’ve had come up is that the flashlight seems to be a slightly cooler tone and dimmer than before? It could be a trick of the mind, maybe I had a dirty flashlight before, or it has to do with it being refurbished but it just feels a little different than the one on the X I had. Not a big issue just something I noticed. I haven’t taken too many photos that needed flash so idk if it effects the tone of the photos, but even if it does that’s fixable in editing.",2021年4月12日 在美国审核
Two thumbs up.,"I ordered a 256GB iPhone XS on a Thursday to replace my 64GB iPhone 8. I received the “Renewed” iPhone on Monday.Cosmetically, there is a very slight scuff on the back which is barely noticeable. There was a small sticker with a barcode on the back that was very easily removed. The screen already had a glass screen protector installed. Long story, short, someone loved this phone.Battery life was 84%, and it holds a charge.I backed up my iPhone 8 through iTunes, then updated iOS on the new phone before restoring. Seamless. I’d very much recommend buying one of these vs. full price.",2020年2月11日 在美国审核
Good deal at this price.,"Reasonable delivery time:ordered on 1/4, delivered on 1/9.Phone received in excellent condition.No case scratches, scuffs, or dings.Screen had one very small, very light swirl scuff that isn’t noticeable unless held in a certain position with the device turned off.When device is on and screen is displaying the scuff is not visible.Should also note that the scuff totally disappeared when I placed the tempered glass screen protector on the unit.Most importantly, phone is fully functional.Phone received with an indicated battery life of 87% maximum capacity, which I find acceptable for a “refreshed” phone.Considering a “refurbished” unit from Apple’s site was considerably more than this unit’s cost, I think this phone was a good deal.Also, the fact that this purchase falls under the Amazon Renewed Guarantee (check it out) provided me with enough confidence to take a chance on buying a renewed product from Amazon.This phone was an upgrade for me from an iPhone 6, and after using the content transfer process to get the iPhone 6 content to the new phone, simply taking the micro-SIM chip out of the iPhone 6 and installing it in the iPhone XS completed upgrade process since I was staying with Verizon.This worked flawlessly and I was immediately using the new phone with the content exactly as it was on the old phone.Bottom line:This purchase of an Amazon Renewed iPhone worked out well for me.I would consider going this route again for a phone and/or other items I might need.Also, I would purchase again from the CellCow vendor as they delivered the product as advertised.",2020年2月3日 在美国审核
Great purchase!!,"I unboxed the phone and it looked like a brand new one. I think I made a great purchase. The phone activated flawlessly, apps loaded easily, my Apple Watch connected and the watch activated to cellular with no problems. The battery health is at 80 percent full capacity so I will need to get the battery replaced soon but as of now, I haven’t had a problem with the battery totally depleting yet. I amRetired so I’m not on the go and using it 90 percent of the day the way I would have been while working.Overall, I am super happy with my purchase.",2022年1月8日 在美国审核
Great Purchase!,"I waited just about a year to leave a review so I could fully get a feel for the quality and life of the phone. Overall, I’m impressed! A year later and my phone functions just as well as it did when I first got it. The battery life is fine, the camera is outstanding, and I have no problems with functionality. Super impressed with this phone",2022年1月29日 在美国审核
