DO NOT BUY IPHONE,I brought this iPhone XS When I got it I tried to put a SIMCarrier in it and it didn't Worked. I knew something was wrong with it I tried to contact the seller By Email They did not answer BACK I then Search up if my Phone is Blacklisted And It was. DO NOT BUY,2020年11月11日 在美国审核
Mal dispositivo,"Al principio parecía estar todo bien con el dispositivo, pero después me di cuenta que la batería estaba mal y ahora ni siquiera enciende y solo tengo aproximadamente un mes con el",2021年9月24日 在美国审核
Very sad. Bag experience,I wish I could given 0 star. It’s not working good. I have to spend 250 dollars to repair the screen. Won’t comeback again. That’s it.,2021年4月6日 在美国审核
Que desepcion,Es una lástima está muy ilusionado con este teléfono para mi madre y en cuanto llego y lo probamos nos dimos cuanta que no se escucha el altavoz que desepcion,2021年11月21日 在美国审核
Don't buy!!!,"Don't buy phone to this seller!!!, I purchased an iPhone xs 4 months later it's started to turn off and turn on alone. When I bring it to a apple repair, the guy said It's a scam and the processor had problems.",2021年9月11日 在美国审核
Not happy,The battery life isn’t like a new phone like it is supposed to,2020年10月29日 在美国审核
complete crap,"It worked well for about a week, then it randomly started dying and restarting while being fully charged. It was completely useless and I had to send it back. I do not recommend buying from here.",2021年10月1日 在美国审核
wouldn't work,received the product. took it sprint and they stated that it wouldn't work. Had bought one for my wife and works just fine.,2020年11月14日 在美国审核
Phone stopped working after a month,29 days of having this phone and it kept flashing the apple symbol would not let you go a master reset terrible phone,2022年4月19日 在美国审核
Not worth it,after only 4 months the screen stopped working. The facial recognition was never able to be applied. Now i can’t use the phone. I can’t even shut it off and power it on again. This was a total rip off.,2021年9月29日 在美国审核
The  facial recognition is not functioning. Not a as advertised!,I dislike that I have a broken phone. I paid for a phone in full working condition. The inconvenience of shipping the item back a waiting for another phone can’t be rated.,2021年11月22日 在美国审核
No sirve para nada,"Compre este articulo, asegurándome que este funcione en Ecuador. Sin embargo, no funciono aquí, vino daada la parte de la tarjeta sim. Además el altavoz vino daado no se escucha. No recomiendo este teléfono jamás!!!!",2021年7月13日 在美国审核
Always check product throughly before usage,The front camera is blurry,2020年1月1日 在美国审核
Don’t recommend,"This product looked fine but it was of course horrible.. the battery life was really bad, and it overheated",2022年4月29日 在美国审核
face ID was not working,The face ID was not working due to an issue with the true depth sensor. They do not check their products correctly while being refurbished.,2022年1月29日 在美国审核
Charger doesn't work! refused to send me a replacement,Charger doesn't work! refused to send me a replacement.Worse customer care.Don't buy their phones.,2021年1月22日 在美国审核
Not real impressed,"I can’t hear the other person when receiving or making a call. And I contacted the seller, they messaged me back. But have not done anything to resolve the problem",2021年3月27日 在美国审核
Phone wasnt unlocked,Phone wasn’t unlocked,2020年1月26日 在美国审核
The phone is smaller then I thought,The item was not what I was expecting,2020年8月5日 在美国审核
Phone Doesn’t Work,This product has not worked since the first day i got it. The phone continually glitches and freezes every couple of minutes and it makes it hard to use in general. I’ve shut it off and on many different times and nothing is working,2021年3月28日 在美国审核
Fully work for its price,"The phone was not working from the beginning, it keeps turn off, the screen keepsgoing on my contact, dialing several number by itself randomly. I need it a phone, I hand up stay without a phone for two eek until I order my new phone from Apple store.",2020年11月30日 在美国审核
Bad purchase,phone frozed before i could complete activation process.Never got a chance to use it.Very unhappy,2021年3月25日 在美国审核
no refund given!! do not buy!!!!,I bought this device and the screen suddenly stopped working in a week as the screen went black for no reason. I returned the device in hopes for a refund but the seller says that there is physical damage which the phone had been shipped with. This is absolute nonsense as I paid $620 for this phone and i’m not at all satisfied.,2020年2月11日 在美国审核
My experience was horrible,I bought this phone Friday. Today is now Sunday and the screen touches random spots whenever I turn it on. Ig doesnt charge anymore. Ive contacted the seller and am in the process of a refund.,2021年1月31日 在美国审核
el parlante de audio esta roto,hola escribo esto porque soy de Uruguay y un amigo me trajo el teléfono que vino con el parlante roto completamente suena saturado.,2020年11月25日 在美国审核
Low battery,"I was looking for at least withstanding battery, the phone goes down to 0 percentage immediately after pulling from charger",2022年6月6日 在美国审核
Visible water marks,The left side of the screen would not respond to touch half the time and it had a Huge illuminated semicircle from water damages.,2021年12月13日 在美国审核
“GHOST MODE”,When I first got the phone it was fine but after the 3rd day the screen started bugging out really bad. After I went online and did some research I saw that other people with the same model were having the same problem . Basically I returned the phone and got my money back,2020年8月14日 在美国审核
Doesn't work with Straight Talk,Works with everything?BS,2021年4月25日 在美国审核
Many scratches in screen,"Many scratches in screen and battery life is also not good. Also, phone is getting very hot during video calls.",2022年4月12日 在美国审核
Stolen phone,This phone was MDM locked and reported lost or stolen several months ago,2020年5月16日 在美国审核
"Phone is Not working, 4 months after I bought it","I cannot even turn it on at all, now I am left without a phone.",2022年3月26日 在美国审核
Bad PHONE,The phone was already use and was scratched on screen and on charger too.Apple ID was use a lot on that phone and didn’t allow me to set another Apple ID.,2021年5月7日 在美国审核
unhappy,"not happy,i had this phone for only a month and now everything i get on starts automaticaly scrolling up by it self. 400 hundred dollars latter and only get a months use out of it.",2021年9月3日 在美国审核
Fraud,Sent me a fake phone!!!,2020年4月17日 在美国审核
Phone came in terrible condition.,Every time youcharge the phone it overheats in 10 min and I get a Temperature warning sign. Also it start to work very slow.,2021年11月7日 在美国审核
Broken screen,The screen had a very fine crack in it and the speaker had staticI returned and ordered a iPhone 12,2022年4月19日 在美国审核
unlocked?,This product was advertised as unlocked. I just put a sim card in and this is what came up. Sim unsupported request unlock by carrier.,2022年3月20日 在美国审核
Worst purchase ever (so disappointed),The phone is BROKEN. It has a very weird noise and it has lots of scratches everywhere. The screen is not sensitive to the touch. I definitely regret doing this purchase.,2021年9月27日 在美国审核
ridiculous,"can’t believe i got sold a stolen phone off of amazon, can’t even activate it because it’s black listed, really confused as to how that could even happen",2021年12月2日 在美国审核
Mala calidad! No lo recomiendo,"Teléfono me llegó bloqueado, no me brindaron opciones de solución, y la devolución me salió un gran trámite. Muy mala experiencia.",2022年2月7日 在美国审核
PSIMO SERVICIO,"MALISIMO, ME MANDARON AL QUE NI SIQUIERA PEDI, Y NI EL COLOR QUE MOSTRARON, TOTAL PERDIDA DE PLATA Y TIEMPO.<br><br>PSIMO SERVICIO.Perdida de tiempo.</br></br>",2020年4月29日 在美国审核
Drops calls due to an unfixable hardware issue,This telephone is not functional as it drops calls due to a hardware issue. it is a disgrace that this is sold here,2022年3月19日 在美国审核
trash,Iphone came cracked and it took a month to get a refund,2021年5月11日 在美国审核
Does not work,Don't buy it; you will just waste an extraordinary amount of time troubleshooting a defective item,2021年2月11日 在美国审核
Not great,I accidentally ordered two of these phones only needing one . I returned one of them stuff haven’t received a refund over two weeks ago. The phone I did keep shut down and screen went black a week after having it.,2021年1月15日 在美国审核
Face ID is not working and the battery is 78% and battery service is displayed.,Face ID is not working and the battery is 78% and battery service is displayed. Screen ok.,2022年3月6日 在美国审核
Do not buy!,"Don't waste your money on this renewed phone.They say it is renewed but when I received the phone, it's got a lot of scratches. More than I can't accept.Please do not buy!",2021年1月9日 在美国审核
Busted Phone awaiting refund !,"Gave me a a renewed which is fine but very bad taken care of, a busted speaker,and Siri is as tripping out . I am now awaiting for my refund and I have been approved, what’s taking so long?",2021年3月1日 在美国审核
Phone broke after 6 months,The phone was working fine but with distorted sound like 2 weeks ago. 6 months after I got the phone it does not turn on and apple said it cannot be fixed,2021年10月3日 在美国审核
Bad condition.,A lot of deep scratches on screen. Battery 82%. A lot of scratches on body of phone. The price is high for this quality. Not satisfied.,2021年9月22日 在美国审核
Fake phone .and broken screen,"No Headphones, broken screen. What Amazon is showing in the picture the customer is not getting that. Sending the fake phone to customers.",2020年2月13日 在美国审核
They lying false information,Let’s just say I want my money back all of it I bought this phone and I couldn’t even use it thru any company I would recommend this Bc it’s not compatible with no service!!!,2020年11月22日 在美国审核
I was unlucky and got a defected one,I was waiting unpatiently for my new iPhone after 6 years of using my old one. I received this defected one which has a thick white line in the right side as you see. I am so sad and disappointed,2020年6月15日 在美国审核
"no headphone fake charger, but its greatful",camera is not good,2020年8月3日 在美国审核
Screen started glitching consistantly day after arrival,"I opened the box and the phone worked great, but the day after, I woke up, and the screen was glitching uncontrollably and I couldn't use it at all. I'm returning for a refund.",2021年5月16日 在美国审核
Battery was faulty,The phone arrived with a battery which was shown 78% effective instead of 95-100%.,2022年5月5日 在美国审核
Poor purchase,"It would not do face recognition, when received only had 87% battery life. Do not purchase from this supplier for refurbished phone!!",2021年5月1日 在美国审核
Shuts down and restarts randomly.,Phone randomly shutsdown and restarts.,2020年1月27日 在美国审核
Previous owners Home Screen burned into the OLED,"Icons from the previous owner are overlaying the screen , almost burned into the screen, becomes very noticeable and annoying",2021年12月25日 在美国审核
Horrible,The phone freezes and get hot really quick and using your phone during FaceTime is the worse DONT BUY ~2022!!,2022年2月3日 在美国审核
Defective and no exchange option.,"The refurbished iPhone is already showing deficiencies (message notifications not appearing), but the only option is for a refund not an exchange. Not what I’m paying for a prime membership for.",2020年11月27日 在美国审核
Sim won't work,"Phone was in pretty good condition and worked ok, but my sim card won't work. It has to be locked, would not recommend.",2021年12月5日 在美国审核
Restarts while using camera,"Always restarts while using camera, bettery life is low",2021年8月23日 在美国审核
Phone keeps saying invalid Sim,Phone is not fully unlocked. I put my cricket SIM card in and keeps saying sim not valid. AT&amp;T can’t unlock the phone and the seller stopped communicating.... highly disappointed.,2021年3月17日 在美国审核
Damn,AT&amp;T my SIM card would work and was told the phone sim slot was bad.Either way smashed the $380 waste of phone.Always buy NEW!!!!!!!,2021年5月8日 在美国审核
Do Not Buy!!!!!,My back camera does not work at all. My front camera works sometimes. Save your money and do not buy your phone from here.,2021年12月15日 在美国审核
Iphone xs,"The speaker of the iPhone doesn’t work at all, I didn’t feel comfortable that’s why I wanted to retun it.",2022年1月20日 在美国审核
The phone did not work,The phone goes off on it's own after 4 or 5 minutes (even with a full battery) - very disappointed!,2021年12月15日 在美国审核
"scratches all over, not worth the price","scratches all over, battert life 81%, not worth the price.",2022年5月20日 在美国审核
Equipo en mala condiciones,"El producto me vino daado, lamentablemente tuve que viajar a mi país de origen y no pude hacer la devolución! Tuve problema con la pantalla tuve que cambiarla.",2021年5月5日 在美国审核
The screen only lasted two weeks,"The phone was fine but two weeks of normal use, without falling or any hits the screen got color lines and colors weren’t doing right",2020年8月18日 在美国审核
Damaged,"No Face ID.<br>Battery Health 79%.Speakers without sound.This not true: ""UL-Certified Charger, Mfi-Certified Cable"". This is a poor quality charger</br>",2021年3月17日 在美国审核
You might get luckier than me,"I received the phone and was really excited, but I got a defective one, so I'm shipping it back, I wanted the Xs Max anyways (missing pixels, slow responses, and unable to read battery warning)",2020年10月27日 在美国审核
The screen stopped working,After a week of using it the scree stopped working and it was really hard to reset my phone bc the screen and face password wouldn't work,2021年3月31日 在美国审核
Buyer Beware!,*SCAM Alert* If I could leave no stars I would bought phone and could not set up because previous owner did not pay it off. We will see how they refund my money!,2020年4月13日 在美国审核
Lo devolví y no he recibido el dinero de vuelta,Lo devolvi. Pq no cumplia con la descripcion del producto No he recibido el dinero de vuelta. Espero respuesta.Gracias.,2021年8月9日 在美国审核
Not worth it,"Uhm so the mic barley works, battery life is horrible. When i plug it in to charge it wont charge in a angle.",2021年11月20日 在美国审核
Literally Broken?,The phone is in alright physics condition. Minor scrapes. Unfortunately though THE EARPIECE IS BROKEN SO YOU CANT HEAR ANYONE ON THE PHONE.,2021年4月8日 在美国审核
"Damaged screen, no Face ID available",The screen was damaged and the iphone does not recognizes the face ID,2022年6月15日 在美国审核
Do not BUY THIS ITEM!!,Phone stopped working. purchased in March stopped working already!! trash,2021年6月29日 在美国审核
phone started going black and purple like it was glitching,"this phone has bugged out since the day i got it which was today. and all day it has been bugging out, not letting me open apps, randomly turning off, and then most newly, the screen literally turned black and purple like it was glitching.",2020年5月20日 在美国审核
Bad quality,Let it charge for 48 hours and yet it didn't turn on despite doing everything the manual told me to and giving it the benefit of the doubt. I suggest to not buy from this vendor,2020年12月10日 在美国审核
Sooo disappointed....!!!!!,Spend lot of money for a phone that didn't work right..!!! They weren't able to send me another one or my money back..!!Never ordering from them again..!,2020年9月16日 在美国审核
Son unos mentirosos faltos de etica,La peor compra que hice me llego usado con golpes sin cargador un gran engao,2021年4月17日 在美国审核
Screen doesn’t work properly,Bad product. Touch screen is a headache because it activares apps and calls on its own,2021年9月30日 在美国审核
Don’t waste your money.,"Within a month the phone started to malfunction, phone isn’t charging anymore, face recognition isn't work.Have to return.",2021年2月17日 在美国审核
Fatal,Ni siquiera iniciaba el tlf. Se reiniciaba solo una y otra vez,2022年1月12日 在美国审核
DO NOT BUY,"The phone starting acting weird, the screen has A pitch black area and I’m unable to use it properly, this was a waste of money because the seller isn’t responding",2020年9月11日 在美国审核
BAD PRODUCT,I couldnt use it because it was completly damage. It was refubrished but terrible work inside!!I need my moneny back but i couldnt shipping it to USA.,2021年3月16日 在美国审核
Would not recommend,Item received earlier than stated. Came in a weird box. No headphones. Cheap adapter and cable. After the first hour started getting warm. Had less than 30% battery life.,2020年5月6日 在美国审核
Useless,This phone was not able to read a SIM card.Took it to both Apple and my service provider Sprint/T-Mobile and neither was able to get it going.Not able to use as a phone.,2020年12月29日 在美国审核
Bad,The Face ID dosent even work and the camera seems off and not only that the phone is in a good damaged condition too,2021年9月7日 在美国审核
Mal,El teléfono no estaba desbloqueado y en la descripción decía desbloqueado tengo que dar un dinero extra ,2021年10月29日 在美国审核
Bad Phone Quality,Phone glitches/freezes and won’t allow you to make a call without making noise and then hanging up on its own.,2021年7月29日 在美国审核
Mala calidad del producto display daado en mal estado,"La pantalla vino con falla de táctil y muy rayada, mandaron puesto mica para que no se note el dao",2021年2月10日 在美国审核
Not as advertised!,This product is NOT fully unlocked!!!! Buyer beware!!!! Not as advertised!!!,2020年11月13日 在美国审核
Not good,"Didn’t work, returned it.",2021年5月25日 在美国审核
When buying electronics make sure you read every detail in description.,"Product works . It’s just not unlocked like the description said. I can’t get any service, and I tried 4 different carriers. I wasted my money.",2021年4月27日 在美国审核
The phone battery doesn't work perfectly.,"The phone battery doesn't work perfectly. There is a message on the iPhone settings, like a photo above, showing that the battery isn't original.",2021年3月22日 在美国审核
Producto defectuoso,El producto llegó con defectos en el sonido no se escucha,2021年1月27日 在美国审核
Not worth it,Battery life was 80% and you can tell it was used,2022年5月17日 在美国审核
Phone keeps restarting in a loop for no reason Don’t buy!,The phone keeps restarting and powering off Do not buy this,2022年4月2日 在美国审核
Incorrect description,It is LOCKED! Not unlocked!,2022年3月15日 在美国审核
It has bad quality.,It doesn’t keep the charge for long time.,2022年6月21日 在美国审核
Was not unlocked like it said,Didn’t work when I put my SIM card in had to return it,2022年6月24日 在美国审核
"IT IS NOT 256Gb, THEY SEND 64GB versions","The phone is not 256Gb, don't trust them. It is a 64Gb version!",2022年1月15日 在美国审核
I ordered the wrong phone.,I ordered the iphone xs and i wanted the iPhone XS Max,2022年3月23日 在美国审核
This phone is reported as stolen,This phone was said to be “fully unlocked “ and it wasnt it was reported as a stolen phone!!! I want my money back,2020年5月9日 在美国审核
"Battery is not OEM, it is not charging properly, it is asking for Apple to check it.",Product arrive on time but stop working properly.,2020年2月11日 在美国审核
Rip off,Phone was not usable and was on another line,2022年3月28日 在美国审核
No me escucho cuando respondo,Problemas en el audio de salida no me escuchan,2022年3月20日 在美国审核
Unlocked but not good,I was sent a phone that was unable to be activated per my carrier Spectrum Mobile.,2021年5月8日 在美国审核
Terrible renewed,"Camera was unusable, screen was unresponsive, and multiple deep scratches with scuffs on the side. Would not recommend",2021年3月4日 在美国审核
Phone speakers blown up,"The cellphone looked as it was in great condition but after setting all up I noticed a weird sound on the speakers, they sound blown up and it is pretty annoying",2020年11月16日 在美国审核
Never send a phone without checking first,Very disappointed! They sent me a damaged phone. Couldn’t even setup. Key board doesn’t work.,2021年6月9日 在美国审核
Useless,The battery health come on 76% in a month,2022年3月27日 在美国审核
It's not original I paid more money for that and it's not like what they said in Amazon,It's not original and I paid more than original I don't know what to say els,2019年9月29日 在美国审核
Not a good phone,It wasn’t workingwhen I got it,2021年1月28日 在美国审核
Phone is Freezing,FaceTime is freezing and I’m unable to answer.,2021年12月28日 在美国审核
Mobile problem,This mobile isnot good.always switch off problem.the seller never return money back.Amazon didn't help.both combine and eat my money,2020年10月12日 在美国审核
battery,poor battery capacity within 1 hour finished after full charge. Not working blutooth. Poor quality cell phone.,2021年6月8日 在美国审核
Phone was not unlocked!,Was not able to get this phone connected to my phone service..,2021年12月30日 在美国审核
Teléfono con falla.,"Me llegó un producto defectuoso, el parlante está daado.",2020年11月7日 在美国审核
No recomendado,"El cristal trasero está muy rayado y la pantalla también, había un protector para disimular.",2021年3月16日 在美国审核
Choose your seller,"Got one from D’Tech Mobile, has a lot of scratches on the screen. I guess it really depends on the seller you choose. Bought one later on from Verizon pre-owned and it looks a lot of better.",2020年3月11日 在美国审核
Ughh.,I give this a 4/10 it was easily damaged only had for 4 months had to order a new iPhone.I don’t recommend waste of money,2021年3月5日 在美国审核
Does not work!!!,Does not work!!!,2020年7月26日 在美国审核
FACEID BROKE,FACEID BROKE AFTER 8 MONTHS!! WHY?!? NO WARRANTY ELIGIBILITY?!!,2020年9月5日 在美国审核
Face ID did not work,Face recognition is not good at all,2021年12月19日 在美国审核
l,"Couldn't touch numerous numbers and letters on the screen, very disappointed",2020年5月13日 在美国审核
either stolen or bought in black market,"Awful, the day i tried to put phone service i couldnt because it said it was either bought from the black market or stolen, i dot know what to do to unlock, anyone got any tips???",2020年5月13日 在美国审核
My i-phone,Thank you very much!,2022年4月11日 在美国审核
DO NOT BUY FROM THEM!!!,Not worth the money or the wait! Very very disappointed with the phone I received! DO NOT BUY FROM THEM!!,2021年4月9日 在美国审核
0-10,The whole right side of the phone wasn’t working really messed up my first experience with u guys,2021年4月27日 在美国审核
Worst phone,Phone is absolutely no good got it yesterday and it gets really hot and it has been stuck on the apple icon called the company and its a run around,2020年4月24日 在美国审核
Phone did not charge and was not usable,Phone did not charge and was not usable,2022年2月10日 在美国审核
No le compren a esta compaía compre un iPhone XS y no sirvieron las bocinas,El celular llego con fallas en el pin de carga y las bocinas muy mala compra,2021年5月12日 在美国审核
Horrible,"Horrible phone ... the p and 6 would not work and I pot two phones , same issue on both",2021年6月3日 在美国审核
Bad speakers,The speakers don’t work they are so staticky that they audio is unrecognizable terrible phone,2020年10月25日 在美国审核
Phone was sent horrible scratched,Phone looks like someone dragged it behind a truck for about a mile or 2 / DEEP scratches all over the phone,2021年2月25日 在美国审核
Junk,Phone is junk!!!!!!! Phone had very sharp edges. Looked nothing like the iphone screen.,2020年5月8日 在美国审核
Bad battery,"Battery performance is very bad ,this the first order ordered from amzon.I don’t satisfy with this order",2020年12月31日 在美国审核
Not well at all,The screen doesn't work well and the auricular is not working,2021年3月31日 在美国审核
Broken speaker!!,They sent me a good condition iphone xs but the speaker does not work.I tried sending it back and i got the same iphone xs back.Will not be buying another used phone ever again.,2020年1月9日 在美国审核
Had a ghost touch problem,"The device looked clean and had no scratches, however, the screen had a ghost touch problem.",2021年3月17日 在美国审核
This phone sucked,The phone never worked properly.,2021年11月3日 在美国审核
