Wrong size,Sent me a max instead of the normal xs but I would prefer the max so it worked out!,2021年6月1日 在美国审核
compra buena y eficiente,Hasta el momento luego de un mes y medio de uso todo sigue muy bien :),2021年9月8日 在美国审核
Muy Buena Compra.,"Excelente, llego como nuevo. Solo q tiene 86% de Batería. Pero estéticamente Está Como Nuevo.",2021年6月27日 在美国审核
Love it,Love the face recognition!! Screen quality is great!!,2021年1月26日 在美国审核
"Great condition, Battery Health at 100%","Product came ahead of schedule. Is in great physical condition. No scratches or nics, and the batter health is surprisingly at 100%. Super happy with my phone.",2021年12月27日 在美国审核
Great value,I LOVE this phone! I had the SE but this is awesome. Not much bigger overall but wall to wall screen makes it seem so much bigger. Half what a new one would cost and same apple quality,2020年2月10日 在美国审核
Great buy,"Phone came 2 days after ordering. Battery lasted for at least a day until I had to charge it. Phone is super fast, no scratches and works great.",2021年11月29日 在美国审核
A jewell just like a jewell,This phone is brand new its beautiful it came amazingly fast,2020年2月1日 在美国审核
Great phone for not a lot of coin!!!,Good phone for not a lot of money,2022年6月1日 在美国审核
It came LIKE NEW,I know it's down to luck when you buy a refurb phone to get it right... The one I got is just like new.,2021年4月11日 在美国审核
Phone review,I was very nervous on buying a used phone from the internet even amazon. I was very surprised that the phone was in great shape and working beautifully. Would buy from this seller again if I needed a new phone.,2021年3月27日 在美国审核
great transaction,great purchase.exactly as described,2020年1月2日 在美国审核
Great phone,Got this for my 16 year old. No issues yet! Super fast shipping. Was delivered 2 days earlier than. Expected!,2021年12月30日 在美国审核
Screen protector cracked in 4 places &amp; Apple said there’s a software problem allowing virus issues.,"Love the phone , Hate the fact that the software causes viruses",2021年8月4日 在美国审核
GREAT PHONE,I like how it works nice and clear would definitely get items from this seller again,2022年2月9日 在美国审核
Muy buen iPhone,"Sin palabras, calificación 10 ",2021年6月20日 在美国审核
Very happy with purchase,Excellent purchase.Looks like a brand new phone.Bought 2.,2020年2月16日 在美国审核
Good phone,"No scrunch, no problem , good price.",2021年1月9日 在美国审核
Amazing,"Phone came in near perfect condition. Slight scratches on the screen but can barely see it , extremely satisfied with it ! Battery life is at 100%highly recommend!!!!!!",2021年7月2日 在美国审核
Cumple con las expectativas,Equipo en buen funcionamiento,2022年2月17日 在美国审核
Looks new,Great phone. Came with apple charger and cord,2020年2月25日 在美国审核
Live my jew phone,I love my new phone. Screen looks like brand new. Battery life very long. So far no issues have come up,2020年3月13日 在美国审核
I got everything I expected. Thank you.,"I got what I asked: quality product with no issues, and on-time delivery. Four iPhone’s purchased for my family and everyone is happy with the iPhones. Thank you.",2020年8月24日 在美国审核
Buena compra,Excelente producto no ha tenido ningún problema después de casi un mes de uso.,2021年3月16日 在美国审核
Battery capacity,Battery capacity was not accurate on my last iPhone but this one discharges to only 50% in 24 hours. So far I am happy.,2022年2月23日 在美国审核
Great Value,Like new and was well received a Christmas present.,2020年1月24日 在美国审核
EXCELLENT!!!,"as the description, good product",2021年1月16日 在美国审核
Good purchase,It works just fine!...,2021年5月18日 在美国审核
Great phone.,Clean and spotless. As advertised.,2021年3月22日 在美国审核
Good quality,Fast servicegood product like new! Happy!,2021年6月1日 在美国审核
Be Careful From Who You Buy!,"I just received my iPhone XS that I purchased from the provider 'Woot!', and the phone itself is amazing. Runs like a dream, has 94% remaining battery life, and only two small scuffs on the sides of the body.However, I wasn't a fan of the way they packaged it. They put it a paper mailer with the bubble wrap lining, and the phone + accessories were loose inside. The wall charger was a Lenovo plug, and the cable was a 3-inch AmazonBasics cord. DON'T PLAN ON USING WHAT THEY GIVE YOU! The phone was individually bubble-wrapped and wrapped in plastic, so while it was safe, I'd rather it be in its own box.Overall I'm very satisfied with what I get, but be prepared to spend up to $50+ on quality accessories because these are unusable. I'd recommend 'Woot!' over other providers because I paid for a good used phone, and that's what I got. Not much more. I see other reviews and their nightmare stories of torn up, unusable devices. I'll update this review if anything changes. Thanks for reading!",2021年4月17日 在美国审核
It came with 90 on battery and is flawless,I will buy another,2022年4月3日 在美国审核
Better than expected,"Phone looks really good, like it was brand new. Also battery capacity is 100 % which I didn’t expect. Great product!",2022年3月22日 在美国审核
Should’ve done this sooner,Easy toget this new phone up and running works with my Comcast mobile carrier save myself a couple hundred bucks,2020年10月7日 在美国审核
Recomendable,Excelente calidad y terminación! La cámara es lo mejor de todo,2021年3月9日 在美国审核
Awesome phone,Looked brand new. It's unlocked and works great on our plan. Seller was kiss electronics.,2020年3月13日 在美国审核
Refurbished IPhone XS. Excellent condition,"I was bit nervous buying a refurbished iPhone but I have say I have had zero issue with it.Aside from a few scuffs that were easily covered up by the case I placed on it, I give it a solid A.",2020年3月4日 在美国审核
Cellphone is a perfect,"The cell phone Funcion 10/10 your software is perfect and has no rays or shots, the battery came 90% but I last all day. Excellent shopping. I don't regret it, it's perfect!",2021年4月26日 在美国审核
Excellent Turn around,I was very happy with this seller. I received the phone 5 days ahead of schedule. I just wish there had been a XS 256 GB iPhone available but since I was using a 32 GB before the 64 GB is fine.,2021年3月25日 在美国审核
Solid purchase,It’s the phone I ordered.,2020年4月11日 在美国审核
Perfect,"There is no way this was a used phone, it's too perfect.Might have been a factory defect that was repaired.Definitely would recommend.",2021年11月18日 在美国审核
Pretty good,I’ve had this phone for more than 6 months and have dropped it a number of times and it is just now acting weird so I think it is pretty good,2022年4月17日 在美国审核
Worth its money,"Like the phone everything works down to the screen to the camera and the battery life , all on point",2021年5月21日 在美国审核
Excellent Seller,The phone was literally brand new. No issues whatsoever. Excellent seller! Highly recommend!,2020年10月1日 在美国审核
Good value for that money,Battery more than 90%,2021年12月17日 在美国审核
Like new,The phone is like a new. So far I am pleased with the purchase of a renewed phone.,2021年3月1日 在美国审核
good value,"really good phone for how much it cost, reliable and has so much storage I don't worry about it any more.",2021年9月25日 在美国审核
"Product works good, price was little high, but overall good deal! No cracks!","Replaced a Samsung, will never go back from an Iphone!",2022年6月8日 在美国审核
Buen producto,El aparato sirve bien,2022年5月26日 在美国审核
Thumbs Up,This was a great phone for a great price despite the fact that the Face ID didn’t work the phone came with insurance and I was able to go to apple and receive a brand new one.,2020年3月8日 在美国审核
Amazing!,"In the beginning I was a little scared to order, but when it arrived after two days, I was so excited. The phone doesn’t have one scratch and it worked perfectly with a super straight body no dents, dings, or any signs of use. I am in love! No problems at all.",2020年4月5日 在美国审核
It's in perfect Condition,"Tbh I was so scared to buy an Amazon renewed item but this iPhone was in perfect condition, It have no scraches, everything runs smoothly. The battery life was at 86% but after 1 day it dropped to 83% don't know why that happened.",2021年3月19日 在美国审核
No complaints,"Came well packaged, way sooner than expected, no scratches, blemishes or anything like that. Battery at 87% no complaints, popped sim card in and everything works just fine. Very happy with this purchase.",2020年5月25日 在美国审核
100% capacity,Phone came with 100% battery capacity!! Was really afraid about buying off an online store and after reading different reviews but I’m very satisfied with this!,2022年1月14日 在美国审核
Excellent phone,The phone was in perfect condition and the battery capacity was at 100%. Phone works great and no problems with the screen or camera. Great buy!,2022年2月1日 在美国审核
It’s a good phone,My daughter loved it and it really was like new! Thank you so much,2020年6月4日 在美国审核
Great but.,The phone looks new physically. Only downside is battery life is 84% no big deal. I can get the battery replaced for $35,2022年6月16日 在美国审核
Grate,Looked brand new. I wood reclaimed is seller,2020年1月10日 在美国审核
Highly satisfied,"I was extremely satisfied with this purchase! I was a little skeptical, but I’m so glad I went through with it! The phone is like new, and it hasn’t given me any trouble yet.",2021年10月22日 在美国审核
Good phone decent price,"The phone was smaller than expected, but the quality was excellant.",2021年2月14日 在美国审核
Price awesome,Just what it described,2019年8月16日 在美国审核
Yes,Great phone!My daughter loves it.There were no scratches.Refurbished is the way to go.,2021年12月20日 在美国审核
Great product perfect condition.,It was as described . All refurnishediphones that I bough from Amazon work perfectly. Hardly recommended !!,2021年1月28日 在美国审核
iPhone XS,It came on time and it looked as good as new,2021年11月16日 在美国审核
Good product so far,The battery life is on 82% and it doesn’t last much longer than expectedBut in overall I’m happy with the phone,2022年6月20日 在美国审核
Good phone,Really good. Came with 85% battery life. Practically brand new. No scratches or cracks. Shipped fast. I love it!,2021年2月20日 在美国审核
Like a new,Really good product like new. No even ascratch. Works perfectly.,2021年6月5日 在美国审核
nice,"the phone is cool, but the rear cameras caused a slight discord",2020年2月18日 在美国审核
Great condition works perfect has warranty,Phone was in very good like new condition. Warranty still valid till next year. Works great.,2019年12月29日 在美国审核
Reconditioned perfectly,"Reconditioned perfectly - no marks or scuffs, and FaceID functional",2021年2月16日 在美国审核
flawless device,Due to the excellent condition of the device and the excellent customer service.this was my second purchase. I recommend,2020年5月20日 在美国审核
WORKS AND LOOKS JUST LIKE NEW,I was skeptical at first because even though the average score is 4.5 something i read many bad reviews but when i got a NEW LOOKING iphone for this price i was relieved. It literally came with zero scratches and battery life at 94%. Everything works just fine. 5 stars but i would give more!,2020年5月3日 在美国审核
Fantastic Deal,"Received mine Silver 256GB in two days. If I didn’t know it was used I would sworn it was new. Came with a screen protector already on it. Battery is at 91%, I can live with that.",2020年1月21日 在美国审核
Great Quality,I am overly impressed with the quality of this product. Packaged well and came with original charger! Phone is spotless!,2020年9月11日 在美国审核
I literally received a brand new one,It literally still had the plastic on it. Highly recommend Prime Mobile 1 as a seller.,2022年6月23日 在美国审核
"Funciona perfectamente, casi como nuevo.","El celular llegó en perfecto estado, con cargador alternativo. Prácticamente nuevo con batería al 93%. Llevo una semana de uso y no he tenido problemas. Recomendado.",2021年4月19日 在美国审核
Excelente,El producto llegó a tiempo y todo funciona bien una excelente compra!,2021年7月8日 在美国审核
Great deal,Arrived in seemingly perfect condition. Works great-love it.However-it’s important to note if you use straight talk you will have to purchase a “Bring your own phone” sim kit if you want to use the same phone number.,2020年2月21日 在美国审核
Todo OK,"Fue una muy buena compra,ha pasado medio ao y estoy completamente satisfecho con el producto, físicamente sigue como nuevo, uno de los iPhone más bonitos de todos los tiempos.",2021年4月28日 在美国审核
Great experience,"I’ll admit I was kind of nervous to buy a phone on amazon but I have to say it was a great choice, the phone came a day early and was handled great. It came with a screen protector already on it and the battery life was basically like brand new. I’m very happy with my purchase.",2020年4月22日 在美国审核
It was pristine and shipping fast buy phone here,Flawless victory,2021年3月16日 在美国审核
Everything works smoothly and perfectly,This was the iPhone X perfected,2021年3月19日 在美国审核
excellent condition,Phone looks like new. No scratches or marks.Works beautifully,2020年6月1日 在美国审核
Good as new!,I’ve been using my phone for the last two months and love it! So far so good ,2021年6月12日 在美国审核
Thumbs up!,The phone was exactly as advertised.,2021年3月10日 在美国审核
ITS AMAZING. BEST RENEWED PHONE IVE EVER BOUGHT,"It came it (like new) condition it had no scratches nothing that shows it’s been used, except the batteries health was 88 and that’s amazing. Irecommend 100%. And definitely buy more from this seller.",2021年3月5日 在美国审核
Perfect,Absolutely better than expected,2022年2月21日 在美国审核
Nice refurbished phone!,Nice phone for my son!,2021年3月23日 在美国审核
Very satisfied with my purchases,I purchased one for my wife and another for myself almost 6 weeks ago and I must say I that I’m very pleased with my purchase. It’s as though I went in the apple store and made a direct purchase.,2020年2月20日 在美国审核
Perfect,Phone is in outstanding condition - virtually as new.Extremely pleased.,2021年2月14日 在美国审核
Really good,"i was doubting about buying a renewed phone. Butat the i end up buying anyway and it turns out really great. The phone came out in great shape, didnt have any scratches and the battery life is like the description promise, more than 80%.",2020年12月30日 在美国审核
iPhone xs,I love the phone &amp; in good condition too everything works perfect recommended too everyone else,2022年4月29日 在美国审核
good so far,it is good so far. zero scratches,2020年1月11日 在美国审核
Do it,It works. Not banged up or anything. Looks great.,2019年12月28日 在美国审核
Works and is way cheaper than buying new,My only real issue is that it doesn’t come already updated to iOS 13 which isn’t on the seller. Came a day early and works great. Even came with a screen protector on it. A friend has the same product but new and pays double what I did. My favorite phone to date,2020年4月3日 在美国审核
Good deal,"Battery life is excellent, arrived in excellent condition. It’s been working great over 1 month so far.",2021年5月4日 在美国审核
Worth it,"Phone came in outstanding condition. I was a little skeptical buying a refurbished phone, but I was not left disappointed. There are no scratches and the phone practically looks and feels new. Definitely worth it! Even came with tempered glass!!",2020年1月17日 在美国审核
Awesome,Phone was immaculate fast shipping was pretty impressed with it,2020年1月11日 在美国审核
Product as offered,"Really good phone, superb quality. Battery health at 82%. As advertised.Screen, audio, all good.",2021年5月31日 在美国审核
Totally satisfied!!!,"At first I had inconveniences with the update, I blocked the phone, however I was given adequate support and was able to fix it without any inconvenience. The cell phone is practically as new. Fully recommended!!!",2020年8月17日 在美国审核
Just buy it,"Clean device, 4 months later and still brand new",2020年5月31日 在美国审核
Excelente compra,"La verdad supero mis expectativas, llego como nuevo",2022年4月21日 在美国审核
SO worth it.,"LOVING this phone so far, and honestly so worth the money to buy a renewed/refurbished one than a whole new phone. Battery is great, mine came with a screen protector already on, and no scratches.",2020年3月12日 在美国审核
Perfect,This is my second time buying a phone from Amazon and I am amazed looks brand new,2021年5月4日 在美国审核
Shipping time was amazing!,Phone works great! The company had my order shipped within 12 hours after the order and I received it two days after I placed the order!,2022年2月17日 在美国审核
Good,Good band for your buck,2021年12月11日 在美国审核
Great product,Great purchase I love my iPhone X I got it in 2021 a couple months ago and definitely feels great and has improved my life has become my main phone,2021年6月14日 在美国审核
Very happy buyer,Phone came in the iPhone Xs and looks like new. I'm very happy with the quality and condition it's in. Will do business again with this seller. Highly recommend.,2021年5月17日 在美国审核
Like brand new phone and accessories,Easy face recognition set-up. Beautiful old screen,2021年11月18日 在美国审核
Great phone for even better price.,Very satisfied with phone. No cosmetic damage. Like new. Would buy from seller again.,2022年3月13日 在美国审核
iPhone,Only complaint is that it came with a bit of a smudge on the corner of the screen but other than that it’s a great product,2022年2月22日 在美国审核
Perfect!!,Got the product as expected..,2020年6月25日 在美国审核
Renewed phone is a good choice if you dont need to spend new phone money.,"As the packaging the phone came in was no where close to OEM we were initially sceptic, but after 15 days of using the phone, all functions checked out ok and the user is very happy.",2020年7月7日 在美国审核
Realiable,Just love the user friendly phone!,2022年6月11日 在美国审核
Please with my purchase,The product was in tip top shape - it took me awhile to find a seller that did not have a lote of bad reviews so I must say I'll be coming purchasing all my iPhones from this seller moving farword,2021年3月9日 在美国审核
its not top of the line but still a great product,what i liked about this product id it feels like a pro devise and it works great,2022年2月21日 在美国审核
Great Buy,"Came in perfect condition, not a single problem after two weeks of use. Was even delivered a day earlier than expected, not sure if I just got lucky but I’m very happy with my purchase.",2020年4月28日 在美国审核
Great,"Great phone, excellent quality.",2021年1月14日 在美国审核
came on time as  stated !and packed great!,still learning how to use my first I phone but so far so good!,2021年7月29日 在美国审核
Almost perfect,"The phone arrived in almost mint condition. Only complaint I have is the battery health.( arrived with 82%) but besides that, the phone is amazing.",2021年4月7日 在美国审核
Pleasantly Surprised,"Was as advertised. Battery life at 80% (as advertised), cosmetically better than advertised. Worthwhile purchase.",2022年5月2日 在美国审核
Great phone,The battery health is at 84% which isn’t terrible but overall it’s in perfect condition! Excited to ugly everything all set up and be an iPhone user again!,2021年3月19日 在美国审核
Muy satisfecha con mi producto,"El celular venía en muy buenas condiciones, las descripciones del producto fueron bastante acertadas. Lo utilizo diariamente y hasta el momento no ha presentado ningún problema",2021年6月28日 在美国审核
Perfect out of the box,Arrived on time before the scheduled promised date. The phone was perfect with no scratches or dents. Looks brand new out of the box. I’m absolutely impressed.,2021年3月11日 在美国审核
AMAZING . I TOTALLY RECCOMEND,"everything was amazing!!! face recognition amazing, touch screen was amazing !!! &amp; battery life came at 100% . their were no scratches or anything . It was literally brand new for a awesome price !!",2021年3月22日 在美国审核
Looks like new,"I selected BuySPRY since other reviews recommended it. Phone looks like new. Very happy with the purchase, everything works fine. Battery life has 85% which was expected.",2021年1月8日 在美国审核
Quality,Excellent Quality,2021年1月7日 在美国审核
"TLDR, phones great","It is 100% what I expected. The phone works perfectly, has an original apple screen, and no functional issues. The only thing “wrong” with it is tiny cosmetic scuffs on the back from light use. Definitely worth the value!",2020年1月16日 在美国审核
iPhone XS Max- great service with seller,"Came just like it said it would, no damage. 90% battery life",2021年3月3日 在美国审核
Highly Recommend,"It's good to read more than one review.Everything works perfectly.I have one little scratch, that's barely noticeable",2021年8月24日 在美国审核
Reliable seller,Great seller! We suddenly had to move and seller changed shipping address for us and still got item to us on time. Item was just as described.,2020年4月17日 在美国审核
Working perfect,I have been using the phone for a month and a half already and everything is working fine. I am using it in Peru and have no problems. The only thing I'm noticing is that battery health is already at 96%. It didn't come with headphones and the charger doesn't seem genuine.,2020年4月21日 在美国审核
Looks good,"Received the phone in good condition (apart very minor scratches on corners), had no problems setting it up, and it’s been working well for the past two years! However, it appears the battery was not replaced as it came at 86% battery capacity when checked through settings.",2020年5月11日 在美国审核
Muy bueno el teléfono,Hasta el momento todo bien,2021年3月24日 在美国审核
Phone in new condition!,"The phone is in new condition. No scratches and the battery is at 100% health. I do admit the box and the charger are weird, but I didn’t mind.",2020年4月30日 在美国审核
100% would recommend,Product came as listed.A beautiful phone with only a few tiny scratches that can’t be seen unless your really looking for them.100% would recommend,2020年9月3日 在美国审核
Perfects,"I was a little scared after reading some reviews, but was more than happy when I received the phone! Everything was perfect! 95% battery life and one tiny tiny scratch! Showed up in 2 days!",2020年4月13日 在美国审核
Amazon Phones Are Legit,I love how there was barely any scratches on it n it still looked brand new. But I wish it came with headphones and a adapter.,2020年8月12日 在美国审核
I have been enjoying it!,"The phone came with everything it said, looks like if it was brand new and with a 90 percent battery lif. Have been using it for more than a month now, super happy!",2021年7月17日 在美国审核
♀,It’s just like any other iPhone. I mean it’s used but it works like new so I can’t complain,2021年2月7日 在美国审核
Love the phone,"Was very easy to transfer information from my old phone, love the phone, no issues.",2021年2月2日 在美国审核
Reliable,Personal. Battery life is not that long,2021年10月6日 在美国审核
Fue una excelente compra,Excelente compra!!! El celular está excelente!!!,2022年1月13日 在美国审核
AWESOME PRODUCT&amp;SHIPPERS ROCK,I love the phone! It came in brand new condition. I thought I ordered the iPhone XS Max so I was a little disappointed at first.. that’s on me though. I just love it! Thank you! Oh and it shipped and I received it almost a week ahead of schedule. YALL ROCK!,2020年4月24日 在美国审核
Surprisingly Immaculate!!,Exceptional quality of a phone!! This phone was immaculate when it arrived and surpassed my expectations!!!!,2021年1月9日 在美国审核
PHONES PERFECT !!!,"everything was perfect but the box it came in was weird. i thought they sent me an android at first but then i opened it and they didn’t thank god! anyways , totally worth it. don’t listen to anyone who write bad reviews , this is so worth it!",2020年5月19日 在美国审核
Great phone!,Was kinda hesitant to order this phone but when I received it was just as new no scratches no cracks everything works really great and for a really great price highly recommend!!,2021年2月23日 在美国审核
It’s different than my old one a lot better,It’s different than my old one,2022年2月13日 在美国审核
As promised,This product came completely as advertised. I was completely satisfied.,2021年5月8日 在美国审核
