Average,Phone is goodButCamera quality is not good.,2022年5月14日 在印度审核
Not as expected,After using 2 months am writing this review. hanging problem exist which is not expected being one plus brand also camera is not good. its light weight and looks good. overall an average product,2022年5月16日 在印度审核
Battery life is worst.. mobile is heating very much. Screen gets on during call and mute button pr.,Battery life is worst.. mobile is heating very much.In short wr can find good mobile in same value.,2022年4月22日 在印度审核
Micro camera not good results quality we have campers other brand 2 mp camera,During phone charging time heating observe.Micro camera quality issue ( camper with other brand )Call recoding option not inbilt ( camper other brand )During video callheatingphoneUse GPSMAPduringoverheating. Only 1 hrs use GPS and battery fast down.We need all option please update phone. And in bilt auto call record .,2022年3月4日 在印度审核
Overall happy not satisfied,"WhatsApp recieved pics doesn't show in gallery quickly it takes time to show n gallery othervise it gaming camera(except light control) display (should be 120 hz) battery, processor is best",2022年6月2日 在印度审核
Worst phone ever.,This phone is not really stand in the line of oneplus series. The hardware quality is been hardly severely compromise. Phone hangs a lot from the very first day. While on call the sound quality is not so good. Phone is extremely slow. Picture quality taken by the cameras is quite pixelate despite of all the settings. Overall we have regretted buying this phone.,2022年3月5日 在印度审核
lost trust and confidence on OnePlus brand,"Writing after using for 3 months. I am facing following issues One Nord mobile:1. When you receive a call, caller contact name dispalay with delay of 5 to 8 sec.2. Mobile heating3. Mobile discharge very fast",2022年6月27日 在印度审核
User interface very faltu.,I dislike this phone. Android 11 very bad. And No Automatic call recorder. Jab aap call record karoge to other side bhi pta chal jata hai. Bahut hi ghatiya function.,2022年4月2日 在印度审核
Disappointed,Not Any special in this phone.... disappointed,2022年3月21日 在印度审核
"Camera quality is very ordinary, not upto mark","Overall design and hardware compabilty is good, but one and only bad thing is it's camera quality is not upto mark from one plus brand. If you are photo lover camera quality is ordinary.",2022年4月3日 在印度审核
Low quality mobile,Other brands like iqoo have better phones lesser than this price. Just bought it because of the brand but one plus is low-quality brand.,2022年6月17日 在印度审核
OnePlus CE 2... 14 day s use kar raha hu....  Don't value for money,Camra Quality poor 2/5.... Battery backup 3/5..... Build Quality 4/5..... Display best...,2022年4月16日 在印度审核
not so good,battery power not good ovreall good,2022年4月18日 在印度审核
Battery backup is very bad!,Battery backup is very bad!,2022年5月30日 在印度审核
Not so special anymore from One Plus. They need to rethink on Budget segment,Performance was not upto the mark. It's new phone &amp; start hangt&amp; update time to time in less than 3 weeks.<br>Very dissatisfaction &amp; disappointment as this was gift my relatives.</br>,2022年4月11日 在印度审核
Not as good as expected..,Camera quality is not as good as expected.Otherwise all other features are good.Battery life is good and working very smoothly on 90hz.,2022年5月24日 在印度审核
Average phone..little bit hang issue...average camera... overheating when in charging condition,Average phone..little bit hang issue...average camera... overheating when in charging condition,2022年3月15日 在印度审核
Not user-friendly mobile .,"So many option are either missing or not user-friendly.like back button or app switching option are very hard to use.camera quality is good.little bit mobile started hanging in 2days even have not loaded with apps.very good thing is battery charging,it's takes hardly 30 minutes to 100% charged.so 25k price is very costly.it is 15k quality mobile.overall feeling like Chinese quality mobile compare to others.",2022年3月2日 在印度审核
Waste of money,MRP printed itself 24999/- why Amazon showing high rate and rebate. It is simply cheatingBattery draining very quicklyCamera quality is not upto the markSpeaker performance also not goodAt this price better you go for Samsung,2022年4月12日 在印度审核
Sub standard phone,Sub standard phone from one plus stable don’t buy this if u using ne thing above one plus 3 better go for poco realme from this price,2022年3月8日 在印度审核
It's OK,Its OK phone not bad this amount,2022年3月5日 在印度审核
Ok ok phone heating pbm,Phone is not upto the mark not worth of 25k .phone start heating at the time of charging.,2022年3月19日 在印度审核
Worth a buy,"Though a little expensive, but worth for those passion ate about this brand",2022年4月6日 在印度审核
One plus in this affordable price range.. very good,May be hang once a day....Camera quality also good not Pro...Finger print n face'unlocking Pro...Screen prooo...,2022年6月22日 在印度审核
Battery drains a little fast during internet activities,Battery drains only a little fast during internet activities. Everything else is superb. Can ignore battery issue if like one plus,2022年5月24日 在印度审核
Battery issue,Battery issue problem,2022年6月16日 在印度审核
I'm using this mobile from 1 month. Automatic false notification false ringtone problem i found.,I'm using this mobile from 1 month. Automatic false notification false ringtone problem i found. Avarage mobile like other Chinese mobile. Not recommended.Little heating issue.,2022年3月30日 在印度审核
My sound quality is really bad ...Speaker is now not working properly,Sound quality very bad...can't even hear properly... starting it was good...it's only 2 months ..and my speaker is not working properly,2022年5月29日 在印度审核
This phone Quality is good,This sell phone charging time is hitting problem,2022年3月31日 在印度审核
Not upto the name OnePlus,It's just rebranded oppo phone with exact specifications. Please don't buy it if you want actual OnePlus experience,2022年6月12日 在印度审核
front camera image quality is bad,The front camera image quality is very bad. Unexpectedfrom 1+,2022年3月14日 在印度审核
Screen recorder not working properly,Overall product was good but in screen recorder voice is not recording only video was recording.,2022年5月7日 在印度审核
Heating issue,Phone is fast and performance is good but phone getting heated too much for which unable to attend calls directly so using alternate blutooth,2022年3月13日 在印度审核
CHARGER MISSING AND DISPLY PROBLEM,Charger missing in the box please replace my phone,2022年3月14日 在印度审核
Camera quality is very poor.,"Camera quality is very poor. In none of angle it looks 64 MP lol, better to purchase oppo",2022年3月14日 在印度审核
Not so worthy to buy,Mobile get heat very soon.Not a good choice compared to redmik20,2022年5月10日 在印度审核
Not on OnePlus level ,"Though it's a mid range phone for 5g it never gives you a normal one plus phone impression, camera is worst , display is average. You will see a lag whenever you use Instagram and often I see a issue even after the muting, the audio is popping out",2022年4月10日 在印度审核
Good mobile with this price.,"Mobile is good working camera, nice RAM, fast charging but Slow in 2-3task at same time because of less performing processor.",2022年3月13日 在印度审核
Vibrator stopped working,Phone vibrator stopped working within 1 month....Now i have to go to service centre and they open my new phone....what is this?,2022年3月22日 在印度审核
Over hiped phone not worth for the money,Front.camera quality is worst. Pictures are coming like beauty mode photos. Back cam is ok not too bad.,2022年5月20日 在印度审核
Required more advanced features,Product is worth for the cost. However more advance features and battery discharge faster would have considered,2022年6月10日 在印度审核
Not worth 25k,Fingerprint quality and charging speed is good. But Camera is so pathetic that some part of the picture is blur. Battery drains faster. Phone doesn't feel like premium product. It looks like cheap android phone.,2022年3月9日 在印度审核
Average mobile,"Battery backup not good, at the time of charging mobile heating issue, The mobile gets hot after using it for a long time.",2022年3月23日 在印度审核
Battery life disappointed,Battery life less than expected. Camera is average. Phone is very lightweight. Single speaker but sound is sufficient,2022年5月9日 在印度审核
not as expected,"earlier i used one plus 6, nord ce 2 not reached my expectations",2022年3月11日 在印度审核
Not good,Actually people's are very passionate about one plus..when you go to reality nothing is there..1.Very poor battery performance2.Heatiing3. Not good cameraAs per my knowledge buying of 10k mobile is more than enough..,2022年5月20日 在印度审核
Decent phone with not so much features..,If u r looking fr a good camera phone .. than it is nt the right choice .. other features are good an look is fabulous.,2022年2月26日 在印度审核
Not purchase this model,"Battery backup not good and after 2 month phone not charging upto 52% and network issue,",2022年6月7日 在印度审核
not value for money,"camera quality is worst ever from oneplus. this is not expected at this price from a brand like oneplus. single stereo, again not expected one but should have been double camera.",2022年3月21日 在印度审核
Camera and lookwise is good,It's okay but heating up while playing game and vibration is coming to backside body while listening music or video.,2022年3月7日 在印度审核
Good but bit overpriced,"Battery life is not good, only bright area is the camera",2022年6月10日 在印度审核
Not satisfy,Phone hang hone lag gaya hai. ek din bluetooth earphone link Kiya to video chalna hi band ho gaya delink Kiya to chalna start. fed up with this.,2022年6月15日 在印度审核
"Mobile look like ok, but heating problem","Product company and look good, But mobile heating problem .....plz consider before buying this product...",2022年6月2日 在印度审核
Good,Phone fits in hand easy to hold. But this phone has some network issue,2022年2月28日 在印度审核
Camera is look like under 15000.,15000rs segment mobile,2022年4月15日 在印度审核
worst camera in this segment,"overall good, but the camera doesn't fit with one plus name",2022年4月10日 在印度审核
Nice,"Go for it, I got it on a discounted price",2022年5月12日 在印度审核
Battery backup issue,Wrost battery backup....after full charge it will give only 12 hour backup. Not a good deal in 25000.,2022年5月22日 在印度审核
Battery heating more during charging,"Not a good phone , Battery heating more camera and sound not good. Now i think return the product.",2022年6月1日 在印度审核
"Battery draining so fast without using that much, not satisfied with battery","Battery backup is not good,<br>Power saving mode is also not good,There is no ultra power saving mode.</br>",2022年3月26日 在印度审核
Gud value of money,Back camera very nice like apple but front not so gud and slow then Vivo v 20 I have,2022年3月7日 在印度审核
Don't buy not worth for money,Guys don't buy this mobile it's not provide one plus quality it's provide only 15k range quality only,2022年3月3日 在印度审核
The quality of the rear camera is not good at this range,The quality of the rear camera of this phone is not good and this phone is having heating issue.,2022年6月7日 在印度审核
OnePlus is just like normal phone,Poor camera quality,2022年4月12日 在印度审核
Average phone,Not value for money.,2022年5月14日 在印度审核
Battery eating phone,Needs many improvements,2022年4月7日 在印度审核
Low budget type phone features,Phone getting hang 5 to 6 times a day. Need to restart. Camera quality not good or rather not like traditional One plus. In process of returning back..,2022年3月11日 在印度审核
The phone doesn't charge in 15 min. Even in aeroplane mode it tools about 35-40 min,"The battery is not good enough, camera is good at this price point",2022年5月26日 在印度审核
Mobile was heating,"Mobiles have low camera quality and mobiles are heated, there is no multimedia app",2022年5月7日 在印度审核
Phones lags sometimes,Pros: good build qualityCons: camera qualityPhone lags sometimes,2022年4月8日 在印度审核
This phone gets hit very quickly and what happens after that its battery drains very quickly.,This phone gets hit very quickly and what happens after that its battery drains very quickly.,2022年3月29日 在印度审核
Camera Issue,Camera is not upto the standard of One plus brand,2022年4月25日 在印度审核
Bought10 fones from Flipkart allgood nd I bought one from Amazon it's display is bleeding,Display started bleeding the very next day. Local phone. Flipkart phones are better than amazon,2022年4月6日 在印度审核
Battery life 6 hours,Phone is perfomance very slow<br>Phone is hanged problems</br>,2022年5月29日 在印度审核
Average phone,Battery is pretty average and camera is not that good. Overall average phone under this range,2022年3月19日 在印度审核
Disappointed,It could have been better. The brand has certainly lost trust by making these kind of phones. Not so cool and refined design,2022年5月23日 在印度审核
This phone producing more heat while using net and while charging,This phone producing more heat while using net and while charging,2022年4月16日 在印度审核
WIFI connectivity is not good it drops very frequently even one is near to WIFI,WIFI connectivity is not good it drops very frequently even one is near to WIFI,2022年6月3日 在印度审核
There is a heating problem sometime there is heat yo a some extent like like fire,There is a heating problem sometime there is heat yo a some extent like like fire,2022年4月6日 在印度审核
Not good,Worst BatteryDrains too fast,2022年5月7日 在印度审核
Softwere some issues to download app,Fingerprint is good.battery is miniman 5000 mah is batter.frient camera is so good,2022年3月9日 在印度审核
The product is not up to the mark as per the rates,The product is not up to the mark as per the rates,2022年4月4日 在印度审核
Software not as per specifications.creatig problems,Software omitted and phone given to authorise centre for software.we have not satisfied.please ensure that subject phone is working properly otherwise replacement will be done under warranty,2022年6月15日 在印度审核
Worst phone ever,"Instagram is not working properly,camera will enhance the phone,videos on YouTube,Amazon prime are getting stuck at one place and also there aspects ratio is also not proper.",2022年3月11日 在印度审核
Disappointed ,No multiply windows screen too shoddy bad battery life and the technology has got me back an my OnePlus 5 was much better,2022年6月13日 在印度审核
"While calling the mute options is active,The mute option is disturbing a call","All is good but only mute option is active,And recording call not active properly, when I use recording option the calling person realized recording his call.Plz updated this type of query..",2022年3月15日 在印度审核
Good,"Phone thik hai , likin battery backup jyda sahi nhi hai ,rate ke hisab se",2022年5月5日 在印度审核
Camera quality not good,Battery very less camera quality not good . finger print not working properly,2022年4月20日 在印度审核
Phone is getting heat very much,Everything is good but battery drained so early and phone is get heat very fast.,2022年4月28日 在印度审核
Battery is very Bad heat up a lot,Battery is very Bad and phone heats up a lot,2022年6月4日 在印度审核
Worest camera ever,Worest phone from One plus. 64mp camera is working like normal 4mp camera.,2022年4月18日 在印度审核
Charging very slow,Phone charger 65 w but Charging very slow,2022年5月23日 在印度审核
Poor Camera Quality,"Really feel bad for the camera quality, A OnePlus device mustn't perform like this",2022年4月13日 在印度审核
Camera quality doesn't meet one plus name,Not Happy with its battery lifeAnd Camera quantity,2022年6月1日 在印度审核
this phone has lot of bug,This product has a bug. The fingerprint sensor does not work. You can unlock your phone without a pin or fingerprint scan.,2022年6月25日 在印度审核
It is bakwas phone..it is not 25k range phone,Heating issues.Very Less battery backup.. but good thing is fast charging.battery draining very fastly..worest Amazon service .. don't buy mobile from Amazon ...Bakwas camara.This is not 25k range phone..it is 15k range phone.. waste of money ...now a days just using brand selling all bakwas products.,2022年3月2日 在印度审核
Average mobile.. Not what expected from 1+,This mobile is just average. Not as expected. Nord 1 was way better to this.,2022年2月26日 在印度审核
"Front Camera is not so good, back one is good","Front Camera is not so good, back one is good, I am disappointed with this mobile",2022年3月8日 在印度审核
There is a lot of heating issue after using phone continuously for 20 min only even in a AC room,Lot of heating issue after using phone continuously for 20 minAlexa is not working properlyFirst time taken OnePlus because of brand but totally disappointed,2022年4月20日 在印度审核
Not Bad,Battery Backup is not Good it's getting down when net was connected.,2022年5月26日 在印度审核
Camera quality and battery life not good,Camera quality not much good.battery life also,2022年4月6日 在印度审核
Poor camera quality,"Poor camera quality,",2022年4月26日 在印度审核
Battery capacity is very low,"Fingerprint sensorgood bettry life bad , camera good quality",2022年5月2日 在印度审核
Battery issue,This phone heating while use and also while charging.,2022年4月6日 在印度审核
Audio Issues,There is an audio problem with the mobile,2022年5月18日 在印度审核
ONE PLUSE NORD CE2 HAVING A DISPLAY ISSUE,"IBrought this phoneon 27.02.2022 , since 3days I'm facing Auto display OFF and erraticmultiple display showing and mobile unable to get restart. first time( On 03.05.2022)it tookapprox. 5 mins to get normal or restart, second time ( On 04.05.2022 )approx. 5 mins to get restart.Third time ( on 07.05.2022 ) it took approx. 20 -25 mins to get restart .Complain lodge withONE PLUSE Online service for assistance .I think ONE PLUS MANAGEMENT shouldimmediate think about theONE PLUSE NORD CE 2 mobile phone technical glitch on high priority . Other wise ONE plus may loose customers faith in market .Looking forward for a better support from ONE PLUS teamin this regard .",2022年5月7日 在印度审核
"Worst Camera  , compare to real me 8s 5G",Batterydecent and Camera quality is very Bad,2022年6月23日 在印度审核
Not a OnePlus quality. Don’t buy.,"Compared to cost it carry, display and camera is very poor. Don’t look like a premium product. Plastic body and build quality is for sure no a OnePlus product.",2022年3月31日 在印度审核
Overall ok but sometimes it's hanging,Battery backup not soo good average.<br>Camera is also average.</br>,2022年4月22日 在印度审核
Bad experience,Fine it's not working as expected. Some times it's working as robo even if iam not pressing anything. What to do,2022年6月5日 在印度审核
Hotspots not working,Major problem in this phone is hotspots not working properly,2022年5月28日 在印度审核
Mobile is Good Camara Quality Worst,Camera Quality is very bad....OnePuls Mobile worst camera experience,2022年6月23日 在印度审核
battery life is low,battery life is low,2022年5月27日 在印度审核
Overall is good except battery backup.,Battery backup performance disappointedme. Not very good.,2022年4月14日 在印度审核
Within 15 days got colour spots on my screen,After usage of 15 days got colour spots on my screen,2022年4月7日 在印度审核
Average Phone,This phone is average not great value for money.,2022年6月21日 在印度审核
Some of the internet connection is poor on this mobile,Finger print is nice but betery life osum camera good,2022年3月1日 在印度审核
Not satisfied,Not clear working ringtone,2022年4月15日 在印度审核
Back camera,Back camera image very poor,2022年3月17日 在印度审核
camera quality very jyada poor,"kuchh khas nhi hai thik thik hi hai ,",2022年5月16日 在印度审核
Average phone,Camera not that quality and average phone at this rate.,2022年4月20日 在印度审核
Writing this review after using one month,This phone not upto mark pls don't buy wif we are using Instagram it is hanging up even though it is 8gb ram. Better to go other phone.,2022年4月12日 在印度审核
Don't buy here. Worst experience again.,battery not charging. faulty adapter. no response from customer care. no technician visit. worst after sale service from Amazon. please buy from store.,2022年4月4日 在印度审核
It's not a buy worth of the cost,It's not a buy worth of the cost,2022年4月4日 在印度审核
Not that much premium but ok when compared with Samsung,Somewhat disappointed with performance but look wise ok,2022年3月3日 在印度审核
When we call voice not goes properly,Whenever we call anyone he complaint that my voice is not come,2022年3月5日 在印度审核
The battery life is not that good,Battery life is not that good,2022年3月22日 在印度审核
As per our exception OnePlus is not fulfilling .,As per exception OnePlus not fulfilling.<br>It's only ok in this price it's a worst productPlz don't by Nord ce 2 .</br>,2022年4月7日 在印度审核
Not worthable,Not good ...photo clarity was not good and it was hanging ...,2022年3月5日 在印度审核
Average,All good but battery drain very fast.,2022年3月22日 在印度审核
3.5 mm jack socket not working.,3.5 mm jack socket not working.,2022年5月26日 在印度审核
Average phone from Oneplus,Camera: average<br>UI - Average</br>,2022年4月18日 在印度审核
"Poor network, and Data speed.",Network problem &amp; week in Calls &amp; Data browser,2022年6月27日 在印度审核
Camera quality was not good,Battery performance good but camera quality is like poor,2022年3月16日 在印度审核
Mobile over heating problem,OnePlus nord CE 2 over heating problem,2022年4月23日 在印度审核
Phone working is very slow,Phone process is very slow compare to other phone,2022年3月3日 在印度审核
Not value for money,Finger print sensor response is very bad even less cost phone performance response is better than this phone.,2022年3月14日 在印度审核
Poor product quality and poor service,I purchased one plus nord ce 2 5G on 29th April from Amazon and phone was delivered on 1st May. Phone screen freezed on 20th May and I dropped the phone at your authorised service centre in jammu.As per service centre people the phone sreen is not working. How can it be that within 20 days of purchase the phone screen turns to be faulty and the service centre that they does not have spare parts to repair it . What warranty the company is offering if spare aren’t available. This was my first purcahse and i I think this will also turn out to be last with this kind of product and service. No response from customer care. Now they have given me 27 June date for receiving parts then it will be repaired,2022年6月12日 在印度审核
Camera failure,Camera quality is below expections.,2022年5月26日 在印度审核
Camera is worthless ,Processor to kaafi acha hai but camera worthless hai,2022年4月8日 在印度审核
Speaker quality is so poor,Speaker quality is so poor,2022年5月9日 在印度审核
Better than,Dear sir One pluscamera quality is not good,2022年4月20日 在印度审核
Audio jack not working,"Its not been many days I bought the phone , I faced the issue with audio jack. I thought of enjoying the audio personally by attaching the earphones, but no sound i can hear. Initially I thought earphones were the problem and i try to change them. But there is no use. I try to restart the phone with the earphones plugged in, this time there is some improvement that the audio jack started working, but as soon as I unplugged the earphones, the speaker is not working. Also microphones are also not working.Adding to above, I started using the phone nowdays as a hot pack to relieve my pains. A good relief for me. thanks to One plus for the multipurpose. It is mentioned that average time to charge the phone is just 15 minutes with 65W charges, but my phone is taking almost an hour to get fully charged.",2022年4月8日 在印度审核
One Plus  or One Minus  ???,Not upto the mark ,2022年4月11日 在印度审核
Value of money,Quick ball option not available...,2022年4月22日 在印度审核
Not up to the mark,Battery life is very bad,2022年4月20日 在印度审核
BATTERY BACKUP IS VERY POOR,BATTERY BACKUP IS POOR,2022年6月8日 在印度审核
Samsung a32 is better in this price,In this price samsung a32 is better than nord ce2,2022年3月21日 在印度审核
charger is not working,charger is not working after 20days,2022年6月17日 在印度审核
Broken Screen recieved..,"Got broken piece struggling with phone since first day,came to know after 15 days when visited OnePlus store. New screen cost is approx 7000/-",2022年3月20日 在印度审核
Not as expected,"Not as expected, Heating everytime",2022年6月10日 在印度审核
