Terrible phone! I bought this phone to get a ...,"Terrible phone! I bought this phone to get a step up from my windows phone and I hate it! The phone doesn't come with a manual so trying to figure out how to configure stuff was complicated and I still couldn't figure out how to change certain things. Most importantly though, the phone HAS ZERO STORAGE EVEN WITH A SD CARD! I bought a 64 memory card and I still couldn't load anything. I put three small apps on my phone and tried to download some other larger ones and I couldn't because the phone has ZERO memory and I could only get the apps to load on the phone and then move them to the SD card. The camera works really good but the front facing camera is CRAP! I couldn't get a clear shot for anything no matter how still the phone was. It was always fuzzy and just plain terrible.I only got the phone and charger. The phone come with a horrible flimsy protector that did absolutely nothing. I sent this back and am so so SO happy back with my windows phone. I think I will just save some extra money and get a better phone.",2016年11月29日 在美国审核
Extremely limited cell phone,"Do not buy this phone.I have had this phone for about a year after I broke the screen on my Iphoneand wanted something cheap while I searched for a replacement.This phone has several serious drawbacks:1.The screen is not bright enough to see in full sun.2.It will not download updates to the software.Instead it displays a message stating that you must delete some other program (in my case Waze gps) to make room for the update.3.It will not download or install apps but displays the same message that there is not enough memory space for the new app. It has 8 gb of Ram and slots for additional memory cards but this feature does not function.If you want a cell phone with extremely limited function capable of doing nothing more than emailing, instant messaging, and running only one app and do not want to pay more than $100.00 ( I found it on Amazon for $50.00), this is the phone for you.My advice is to keep looking.",2017年12月10日 在美国审核
Awesome deal!,"Bought for mother-in-law and it was awesome. The phone itself had a bit of weight to it, so it felt really authentic. Came with battery, usb charger, and manual. The white is very glossy and nice. Edges have silver buttons etc.",2017年9月20日 在美国审核
if i knew then what i know now........,"not a great start...the cover was almost impossible to remove;had to be pried off with a small jeweler'sscrew driver, causing damage to the edge. a cosmetic problem, which has been ongoing.next, at and t did not have this phone on the list of compatible models.....heck no!after i worked with the company online and by phone, the model was finally added to the list....that is an hour of my life i will never get back!then i had to take the phone into my local store because this model will not accept my older standard sized sim card.i had to then do a transfer of my contacts and other data at the store on a phone at and t had not yet added to the list of compatible manufacturers from my old standard sim card to a new micro sim card.after all this trouble, you may ask why i am giving the phone four stars.well, since the problems have been solved, this phone works like a charm.....for now!!!!! i would not repeat this experiment.however, all is well that ends well, as they say....",2017年3月5日 在美国审核
I'm a bit disappointed,"I liked the performance in average. The phone looks really nice, i like it very much, is very thin, i'm gonna be honest, i was expecting a crappy camera, but in good light it's pretty good. I haven't test it at night. The escreen looks amazing, i mean, i have the Advance 4.0 and the screen is total crap, but the screen of the 5.0 it's really good., what i disliked is that has really small internal space, so if you don't put a sdCard (mine hasn't arrived yet) and install bunch apps the screen will not turn on unless you reset the device, then go erase the temporal data of the app's and then reset it again. I don't know if this is a malfunction of my device or if is a common behaviour for this phone. I'm waiting the sdCard to test the device properly.I will update this review when i get the sdCard****Update***I haven't got my SDcard, but i put another one that i had and i keep having the same problem, then i realized that the problem wasn't the memory (altough it's really annoying that when it's full you don't get any message, whatsaap, or notification until you free some space, even the phone doesn't notificate that has no memory left) the problem is when the phone has low battery (about 10% left) or its fully charged/charging. I think its a malfunction in my device, i have to reset it and then keep the phone unlocked about 5 to 10 minutes, so then it would work. For me it's really annoying, because i have to keep reseting the device every nigth or morning when i'm gonna use it, and i can't use it when it's charging because the screen doesn't turn onthe moment i plug the power cordand i don't know if reseting the device so many times or when it's charging could cause any damage.***Update*******I've talked with amazon abut the malfunction on the phone and because i'm out of USA and will be very difficult for me to send it back to review the roblem, they send me another one for free. I'll expect it arrives and give feedback.I'm still using the malfucntion phone and really the only complain that i have is the issue of the screen when it's charging or running low on battery. I haven't experienced lag on the phone yet.Also i already put the 16GB micro SD card and runs really well. I don't have so many apps on my phone because i don't use so many, so the little amount of internal space (about 1.1GB without any app installed) doesn't bother me that much. And also i've installed the apps on the sd card so i still have left about 500MB of free internal space.",2016年3月3日 在美国审核
This phone has a known memory defect which renders it ...,"This phone has a known memory defect which renders it almost unusable. It is unethical that Amazon and Blu claim this phone has 4 GB of memory.Out of the box the memory on the was already at over 98% of capacity - you can't download apps, music, books, etc. Try to take a picture and you get an error message stating there is insufficient memory available. Add a memory card and it still tells you there is insufficient memory to take a single photo.Do a search on memory problems with this phone and you will find hundreds of articles discussing the flaws in both the operating system and the hardware.",2017年6月26日 在美国审核
This phone does do good as far as reception and has a really nice ...,"The BLU Advance 5.0 has 4 gigs of memory, however 2 gigs are unusable because they are dedicated to the OS. After adding Facebook which is aprox. 400mb, this leaves just over 1.5 gigs. I have added about 8 other apps including Pandora, yahoo mail, facebook messenger, and chrome. I am out of storage. I have set apps to store to SD card however they will not. Once I download an app IF it will be allowed to store to SD card I have to manually do so. At least 3 times a week I have to clear cache and delete messages due to the fact that I am out of internal storage space. This phone does do good as far as reception and has a really nice screen.",2016年4月15日 在美国审核
JUNK,"DO NOT BUY ANY JUNK FROM BLUI BOUGHT THIS PHONE LAST MAY AND BY AUGUST(LESS THAN 3 MONTHS), IT STARTED MALFUNCTIONING. THE SPEAKER IS BAD AND THE PHONE MUTES ITSELF. I FINALLY GOT HOLD OF BLU SINCE THE PHONE IS STILL UNDER WARRANTY AND AFTERPUSHING ME AROUND THROUGH FRIVOLOUS CALLS, THEY SENT ME AN EMAIL TO MAIL THEIR PHONE(AT MY EXPENSE) TO A LOCATION WHERE IT CAN STAY WITH THEM FOR ABOUT A MONTH. SO, I HAVE TO BUY AN AUXILIARY PHONE TO USE FOR THE TIME BEING AND THEN PAY UPS OR FEDEX ABOUT $20 SO THAT BLU CAN REPAIR A PHONE THAT IS WORTH LESS THAN $60. THE MOST RIDICULOUS THING I DID WAS TO ADVISE MY COUSIN TO PURCHASE THE PHONE BUT THANK GOODNESS HER PURCHASE IS STILL WITHIN THE RETURN PERIOD AND SHE WILL DO SO TODAY OR TOMORROW. IF YOU ARE PLANNING TO BUY THIS JUNK, BETTER ROLL UP THAT MONEY AND SET IT ON FIRE.",2016年9月26日 在美国审核
The look is outdated,"the way the phone operates seems outdated conpared to the technology on the market now, but I suppose that's why it's so much cheaper. The talk to text function doesn't work for me, but I needed a phone and this covers the basics. The reception is horrible though",2017年5月10日 在美国审核
... and I thought this was going to be as good..,"I bought a BLU R1 for the same price as this one at the beginning of the year and I thought this was going to be as good... hmmmmmmm no!While the R1 was like WOW this mega cheap cell does all these stuff, this one is like cheap cell that performs cheap. I wanted to returned it between a week and exchange it for the R1 once I figured that I got the wrong phone. Unfortunately, at the time I didnt have the money to get another cell or able to wait for the process of refund, return and get another one.Do NOT buy this cell. It got almost no space for anything, It doesnt run smoothly all the time where is very noticeable. Just spend a lil bit money and save yourself the headache. If you want to restrict a teen with his/her cell usage then this would be the phone for that punishment. It would get the essentials in and then a lil bit more. However this wouldnt be the prize cell you would replace a old iPhone or old Nexus or old Samsung.",2017年12月13日 在美国审核
It is not 4G LTE but it has EXCELLENT signal on AT&amp;T and its running on android 6,"I got this for my girl friend. SHE LOVES IT. It is not 4G LTE but it has EXCELLENT signal on AT&amp;T and its running on android 6.0 marshmallow.2 sim slots , Sim 1 is a micro Sim 2 is standard size. Uses WIFI well and it's just a nice little phone with a crisp clear screen. 2 Drawbacks, the back of the phone is difficult to remove and she dropped the first one getting out of her car and the screen cracked despite being in a case because it landed on the corner. I recommend you use a 9H hardness glass screen protector to avoid this issue.",2016年10月4日 在美国审核
I have had this phone a little over a month ...,"I have had this phonea little over a month, I have not dropped it or done anything to damage it. All of the sudden, yesterday, it stopped charging. I have tried several charge cords. The phone just won't charge. Unlike many other products I have bought on here, this Amazon sold product does not have an option to message the seller. I need to know who to contact to fix or replace the phone, and I can not figure it out. I have paid 70$ for a phone that I got to use for a month.",2016年10月18日 在美国审核
Junk,Downloads apps without permission. Do not buy this or any other Blu phone. The price isn't worth the scummy business practices you'll be forced to endure.,2019年1月31日 在美国审核
Really easy to use,"My girlfriend loves it. Since we live in Venezuela, it is a cheap phone and one she can put on her jeans without too much noticing. Really easy to use, and the lollipop os she can upgrade her daily use of instagram and other apps she loves to use.",2016年10月3日 在美国审核
Nice phone,Nice smart phone - easy to use.I like the back cover as it is not smooth.If you don't want all the bells and whistles of the name brand this is a good choice and very easy on the pocketbook.I also like the option of the dual sim card,2016年6月16日 在美国审核
l like this product it is nice and work well in ...,"l like this product it is nice and work well in my country, l do buy and sell this product. l would therefor like to know if l can get replacement LCD screen and batteries for this product as my customers are inquiring. Thanks in advance for all information",2016年5月14日 在美国审核
Don't Waster You Money!,"If I could give this phone a 0 star, I would. I took my time, read the reviews and decided to take a chance on this.First off, the battery life is terrible, even when the phone is not in use, the battery life drains significantly.Second, even though I purchased a 32gig SD card, I still get insufficient space messages, mind you I have moved as many apps to the SD card as possible. With insufficient memory, the phone will not allow you to make calls until you have cleared up the cache.Third, the camera takes blurry pictures, you will not be able to take a pic of a document to send anywhere because it will be ineligible.Fourth, the phone is not compatible with T-Mobile. Yes, I know it says the phones works with T-Mobile but there are some functions like the gps and your T-Mobile data that won't work. I have call blu customer service due to my GPS not working, I was told to call T-Mobile to get the APS info. When I called T-Mobile they told me my phone is not compatible and they can't help me.Fifth, the phone overheats quickly.I purchased 3 phones, One for myself, one for my mother and one for my daughter. They all are terrible. Don't waste your money. Now my money is down the drain and I have to order a different phone. I will stick to brands names I know off from now on like HTC, LG, Samsung, etc....",2016年9月1日 在美国审核
BEAUTIFUL Phone with Numereous Features,"This beautiful sleek white phone is my second BLU phone purchase and a perfect addition since I now carry two phones. It has two Sim card slots that can be used to add a second cell number for convenience or while traveling outside the USA / internationally. Using a second Sim will save a tremendous amount of money on phone expenses, especially in Mexico where the last resort I stayed in charged $95.00 per minute [in their currency] - that's right ninety-five dollars! Before you travel internationally, check with your carrier to determine whether you need a International Sim card or if your regular Sim will do the job. Also, my first BLU phone automatically transferred my entire phone book to this new BLU phone and all I did was charge them side-by-side. When finished, there was my entire phone book on the new phone - Voi La! You will LOVE this phone!",2016年3月21日 在美国审核
Okay for a not so high tech person,"I hate that it only has 4gb of internal storage and many glitches. However, I put a 64gb Samsung SD card, which you have to format, and it helped with storage.",2017年6月30日 在美国审核
"I am using it, but it won't take messages ...","I am using it, but it won't take messages. I am on a family plan and AT&amp;T won't set up messaging with out family authority. It works for a phone. Got what I paid for and less than what I expected.",2017年11月10日 在美国审核
Not a bad deal!!!,Very good phone for very cheap price. Quality is not that bad. Has 2 sim card slot and 1 micro sd card slot. The back side of the phone is Kinda cheap.. But u cant expect a lot from 60 dollar phone.. Works well and i advice people if ur on the market for cheap phone.. This is the 1 for u.,2017年1月4日 在美国审核
good,its a great phone for a kid,2020年8月3日 在美国审核
This phone will not upgrade to Android 6.0 Marshmallow... and that's a problem.,"The reason I don't like it is I cannot upgrade the OS to Marshmallow 6.0. That is not available for this model. As is, it will not load new apps or other needed upgrades to the sd card, only to the phone storage, which was full very quickly. The phone is priced right and works well in all ways, but without being able to add useful apps and features it is (almost) a total frustration. Apparently the BLU Advance 5.0 HD does not have this problem (for about $10 more). The reason I don't like it is I cannot upgrade the OS to Android 6.0 Marshmallow which would supposedly correct the main problem of where new apps and files are stored on the phone.3/3/2017 I am back here looking at reviews again and noticing that reviews for different phones are being provided mixed together, making this a confusing mess. The reviews seem to be mixed up due to similar model names. I am seeing my review and others for the BLU Advance 5.0, along with a review for the Advance 5.0 HD, and starting from the listing for the Advance 5.5 HD. My phone still works well and has the same limitations. BLU did contact me through this review and said they were sorry... Me too.",2016年12月27日 在美国审核
Works perfectly in Africa👌👌🤗🤗,"I was worried that maybe these phones won't work in Africa, but my sister says it works perfectly and everyone is in love with them!! People asking if I can purchase some more, I'm ordering another one for my aunt.....thank you",2017年8月10日 在美国审核
Extremely happy with this phone,"I've only been using it for 3 days now, but I am absolutely thrilled with the speed, durability, and function of this phone... especially for the price.If you do a lot of selfies or want super-clear video chat-- and they are important to you-- you probably don't want this phone.I don't and it's not, so I'mnot disappointed.The front facing camera is pretty good, and everything else thus far has been awesome!I really, REALLY like this phone.",2016年11月12日 在美国审核
Avoid like the plague,"Got this phone back in February. Just the other day, the firmware decided to corrupt unexpectedly. I've already contacted customer support and tried every solution that my years of computer experience could muster, and still no results. There is lack of support for the phone overall, and their own webpage has no tools for recovery, or even tips on what to do when this phone malfunctions.The 8gb internal memory drive is completely hosed with bloatware what can't be deleted, and you'll soon find yourself having to tediously move every app you download to an SD card manually. Exterior speaker is cheap and nearly silent, and the EQ is ear-shatteringly unbalanced. The touch screen is unresponsive sometimes, making the already clunky menus harder to navigate; and get this, the recovery menu has the volume buttons navigate the list for you, with power to select, and by power to select, they mean volume up. This was NOT a product up to scratch, and should be considered a foul impersonation of an Android phone at best, you're much better off using a brick as a phone, because at least that would be more reliable.",2016年4月15日 在美国审核
Good for a cheap phone,"I've got to say that I'm not a fan of cheap brands but this BLU is better than expected , very fluid and pictures aren't so bad! However it lacks in Ram and storage space but that's normal at 60$ , I'll just buy a SD card for space. I recommend trying this phone if u just need a back up phone or have low budget. Its unlocked for all gsm carriers but doesn't seem work on 4G.",2017年2月21日 在美国审核
Amazing phone for an amazing price.,"I love this phone, especially for the price. It's easy to operate and has all the functions I need with a few perks like the LED light. The flashlight on it is blindingly bright, too. This could easily be a much more expensive phone.",2016年10月27日 在美国审核
Great phone with great value,"Absolutely fantastic phone for the price.I've had similarly priced phones before with not nearly as much capability as this one.I love it, will buy BLU products in the future.A great value!",2017年9月27日 在美国审核
You get what you pay for...,"This phone gives you VERY basic functions.It's fine for basic texting and apps, but load it up with apps, and you'll be in trouble.The most disappointing feature is the TERRIBLE camera.Photos are extremely grainy even at highest resolution, and the camera app itself is very twitchy.But what do you expect for this price?I would consider this a disposable phone...if I get a year out of it, I'd be surprised.It's good on battery use, but that's not surprising considering you can't run much on it.It locks up on most internet apps, especially youtube and even google.Did work well on switching networks traveling between US and Canada.The phone app is horrible..tapping on a contact, rather than bringing up the contact info,instead immediately calls the contact.Not cool.On the plus side, the BLU comes with very few bloatware apps...much appreciated.I guess I would say it's a good stop-gap phone before deciding to invest in a more robust one.Charging is fast and good and the charging port is particularly tight and good...a major complaint of mine with multiple Samsung Galaxies that had flimsy charging ports that failed in a matter of weeks. Phone call sound and quality is quite good.I guess, the thing is, for $60 or so, that's what you get.UPDATE - the charging port on this phone failed in just over one month.Attempts to reach customer support on this and other issues with the phone resulted in ""clear cache and reboot phone"" type responses. I'm seriously agitated with this low level of customer support and will be returning the phone.",2017年11月3日 在美国审核
Super!,"So far so good. Really clear and large screen and decently fast. Great usability, streamline. Haven't had any problems so far! Just put in my cards and was ready to go. Very happy with this purchase!",2016年6月21日 在美国审核
Storage issues,"I am giving this a two star review not because it is a bad phone but because of the storage issue I have with it. I have had the phone for a year now and so far it's awesome! BUT I have a 16gb sd card installed in my phone and it's like the phone isn't recognizing it. I have absolutely ZERO storage room. I'm extremely dissatisfied since I should be able to have apps galore on here and all I can have is Facebook, Google Photos and Zedge... Wtf!?!?",2018年5月28日 在美国审核
Four Stars,"my Blu Advance 5.0 unlocked battery was giving trouble, I thought it was the battery I changed the battery and it still did not work get very hot and said need to cool.I just throw it aside because I live abroad so I could not send it back.I would not buy any electronic things because of warranty",2016年3月4日 在美国审核
Definitely worth the price,"I like this phone, especially for the price.My biggest issue is that I haven't yet figured out how to voice dial via the Bluetooth.The closest thing I have found is to utilize the ""OK Google"" feature to call using my contacts list.Because I had an older phone, I was not able to transfer my contacts and notes from my old phone through the AT&amp;T app designed for that.However, I found that if I saved all of my contacts to SD card, I was able to import them from there.Unfortunately, the notes didn't work so well.Luckily I didn't have too many, so I just reset them on my nook.The camera and sound are actually pretty good.It works well with on AT&amp;T service with SIM card.It is much better than I expected.I do plan to upgrade to one of the newer versions of the BLU phone soon, then my husband will get this one.I had upgraded from a 3 year old LG phone, which I could not upgrade the android operating system.This phone was definitely worth the price.",2016年3月29日 在美国审核
Average,"This phone is very functional, for an inexpensive phone. I rated the BLU Advance 5 as, &gt; average. The BLU Advance 5 has some limitations, but the audio is incredible. I can hear the phone ringing, while multitasking. I am pleased with this purchase.",2016年7月26日 在美国审核
Good phone,Bought this awhile back for a family member and she loved it. Perfect for her budget and her style.,2020年2月14日 在美国审核
Great value phone for travel!,"Good looking phone, good value! I got a white one. Made in USA!Unlocked phone with dual sim under $100.! Resolution is very good too. Instructions r not great but was easy to set up. Not been able to watch Amazon prime video from phone to TV so far!",2016年7月22日 在美国审核
great phone. Only drawback is the small internal storage,"Overall, great phone. Only drawback is the small internal storage. Every time I want to download an app, I have to go into settings, clear my cache, download the app, then immediately transfer it to me SD card (even though I have made the SD card my primary write disk). It's a hassle, but I have been able to download everything I needed this way. Otherwise, nothing but positive things to say about this great phone.",2016年8月17日 在美国审核
Happy,Just love this phone. I had one before and it was stolen. I had an old phone that I was using in it's place but I missed the Blu so much I had to buy a new one. I am also very pleased with the seller. They handled my order very well.,2016年1月23日 在美国审核
Great Budget Android Phone,"This is a great value for an unlocked Android phone. It comes with Android 6.0, and has a nice quality screen. I inserted my T-Mobile sim card and it was immediately recognized with no problems. It lacks some of the bells and whistles of an Android flagship phone, but at roughly 10% of the cost, it is pretty high on value.The first one arrived with a defective touchscreen, but BLU customer support was quick and courteous and set-up the Amazon return. The replacement has been excellent. My teenage daughter uses this one after she dropped her last phone. To me, this is the perfect, inexpensive solution when you need a decent, reliable phone but don't want to grieve for weeks if it gets dropped or you leave it somewhere. It's amazing you can get a quality smartphone for under $100.",2017年2月9日 在美国审核
"If you just want a disposable phone for a trip like me, then its perfect","Just got the phone and first off the bat, the screen touch is not very sensitive.If you just want a disposable phone for a trip like me, then its perfect.If you wan't it for long term spend more money and buy a better one.",2016年10月18日 在美国审核
