Initially happy but time has only told.,"This product seems great new. Previous to this I owned a Note 5. So compared to that it ran android well, at first. Over the last 2 months I have owned this phone, it has gotten progressively more sluggish. Even running cleaning apps have not helped. The phone is finiky on cell and wifi reception in buildings. Many apps (email and messaging) will not disply notifications until app is actively selected. The adage about getting what you pay for is true in this case. Buyer beware.",2016年12月21日 在美国审核
Five Stars,"It works great, I have no long term contract and it did not cost one of each...arm...leg.",2016年6月25日 在美国审核
One Star,"Piece of crap, do not buy, I literally threw it in the fireplace",2017年11月2日 在美国审核
it gets the job done is stunningly easy fashion. For the price,"I needed a replacement for my broken iphone while waiting on insurance. Its not an iphone, android base. All in all, it gets the job done is stunningly easy fashion. For the price, 5 stars. The dual sim makes it worth keeping around for a trip out of the country, too.",2016年5月31日 在美国审核
Five Stars,My friend really happy to have it this kind of phone it was goodfor gift her birthday,2016年6月30日 在美国审核
Great phone for a great price,I got this for my daughter and it is a great phone for a teen to start with.,2017年1月20日 在美国审核
"Nice, inexpensive smart phone.",Works well so far. I'm using it as a mobile hotspot to write this review. Only had it activated for a few days.,2017年1月2日 在美国审核
"this phone is DEAD, already. what kind of ...","this phone is DEAD , already .what kind of warrenty is there on it ?",2017年4月20日 在美国审核
Five Stars,good product. I recommend,2018年2月24日 在美国审核
Five Stars,"Weird that it charges from the top instead of bottom, and there are no drivers for windows (10).",2016年5月25日 在美国审核
"Beautiful, easy to use (is kinda hard to remove ...","Beautiful, easy to use (is kinda hard to remove the case tho) and is unlocked so you can use from anywhere and is double sim :D",2017年7月8日 在美国审核
Five Stars,I LOVE THIS PHONE ....I BOUGHT FOR FAMILY AND FRIEND IN AFRICA...,2017年6月29日 在美国审核
Works great!,Bought this for my mother to use with the Ting network.Works great!,2017年4月23日 在美国审核
Battery life good,My friend loves this phone. Battery life good,2017年8月29日 在美国审核
The only 2 problems I see in this phone is ...,"The only 2 problems I see in this phone is:1) When I unpacked the phone, I had to remove the cover, so I could proceed to put on the battery and the chip. It's REALLY difficult to do this!!! and nobody tells you how to do it.2) The battery does not last long. a half hour using it and it gets to the 20%... and it's new.",2016年12月23日 在美国审核
The phone is great value for money and arrived early,The phone is great value for money and arrived early! I have 1critique . My son bought same GBluI am pleasantly surprised . What a great phone for the buck. I have one little peeve - it did not come with a set of ear buds. Otherwise it works well and takes good pictures 😁,2016年10月26日 在美国审核
I feel like this wasn't as great of a buy as I ...,"I have had this phone for 7 day to the day and I am already having screen problems. The screen is just black and you have to reset the phone just to get the phone screen to work and that is even hit or miss. I feel like this wasn't as great of a buy as I thought it was going to be, It turned out to be a disappointment.",2017年3月11日 在美国审核
Four Stars,Very good cell. Good image front and rear camera. fast Internet connection ..,2016年10月24日 在美国审核
Love it,Love the phone very easy to use only problem I have is because the phone is white. The color of my clothes is staining the phone when I have it in my pocket..,2016年4月1日 在美国审核
"REVISED REVIEW, NOT SO GREAT!!!!!!!!!!","I want you all to know, just because it has dual sim cards, does not mean you have to have two. I called my provider, StraightTalk and they told me I could NOT use this phone. But they were WRONG!!! I ordered a new sim card, and transferred it to this phone, and have great service!!! I was going to return the phone, and I was upset to have to send it back. Now I don't need to return it!! It works PERFECTLY!!!This is a great phone!! And I didn't have to break the bank to purchase it!!!UPDATED REVIEW:I've had this phone roughly 80 days, and like it....not so much. It keeps telling me the internal memory is low. I have a micro SD card installed. Everything I've installed I've installed to the SD card. I've set the SD as the default storage. This must have NO INTERNAL STORAGE!! My previous phone was a Galaxy SIII, and I loved that phone, if it hadn't stopped holding a charge, I never would have purchased this phone. Sure wish I'd known in the first 30 days it was a LOSER!!",2016年4月1日 在美国审核
nice phone,excellent phone. fair price. very nice phone to hold too. nice graphics. fast. works well,2017年7月27日 在美国审核
It came as a wonderful Christmas gift,My teen loves it!!! Thank you very much! It came as a wonderful Christmas gift!,2016年12月26日 在美国审核
Nice phone for the price besides the charge plug is ...,Nice phone for the price besides the charge plug is at the top I hate that part and the import plug is upside down,2016年5月14日 在美国审核
Five Stars,"Phone for my daughter, t-mobile doesn't recognize the phone itself but still functions well.",2016年2月26日 在美国审核
Five Stars,Blu is my choice of cell...not flashy but functional...,2016年7月16日 在美国审核
"The phone was great, but not compatible with my provider","had to return, not a phone issue. The phone was great, but not compatible with my provider.",2016年12月23日 在美国审核
Not recommended.,The phone is giving trouble . It not even two months selecting on the screen is problematic. It not a phone for constant use it is for persons who do very little texting and interacting with social media. My take. Not recommended.,2016年3月24日 在美国审核
Five Stars,I am very satifaite of my purchases and the respect of the delivery deadlines,2016年12月4日 在美国审核
Great first/backup phone,My son loves this as his first real phone. Even comes with a case.,2017年1月19日 在美国审核
Great Value,Love the two sim card feature. Great for international travel. Screen size is also great. Prefer it to my I-phone most of the time.,2017年1月17日 在美国审核
Great phone,I love this phone loll . I even woke up one morning and it was laying in a bucket of water that was beside my bed . Couple days later the battery dried and it started back working. All phone wouldn't do that but it lasted me for about a yr and a half until I wanted a new one.,2017年2月1日 在美国审核
I really like this phone except I can't use WiFi calling,I really like this phone except I can't use WiFi calling. Which means I don't have service where I live.,2017年5月3日 在美国审核
Incredible Value,"I really can't believe how much value I got for this phone. If someone had given me one of these, I would never have guessed it was a 60 dollar phone. I bought it just to use for a few weeks when I switched plans but I may stick with it for a while.",2016年6月21日 在美国审核
Five Stars,"I love the phone, I am still getting acquainted with all of its optionions.",2016年9月5日 在美国审核
Three Stars,Good phone quick shipping doesn't have very much memory,2017年4月23日 在美国审核
Four Stars,"Good price., no to good the product quality",2016年12月17日 在美国审核
Awesome,"I got it today , definitely the best phone ever works great no problems.",2017年10月5日 在美国审核
Five Stars,Was perfect price and great for my 11 year old.Very pleased,2017年2月21日 在美国审核
ALWAYS RUNNING OUT OF MEMORY! DONT BUY THIS PHONE,"WORST PHONE EVER! I don't recommend anyone buy this phone. I'm always running out of memory. I get a message on my phone every 30-45 seconds telling me i need to free up more space. I dont understand how my phone is using up so much space. I only have 3 apps installed on my phone(total memory used 1.89GB) and now i have no more memory. This phone has 8GB and for some reason its all used up. I uninstalled the apps but after a week, I had no more memory again. I had to factory restore my phone more than 3 times in the past 3 months because this phone tried to install apps with out my approval.This phone corrupted 2 of my sd cards and I can't figure out how to fix it. DON'T BUY THIS PHONE! THERE ARE A LOT BETTER OPTION THAN THIS!",2018年3月22日 在美国审核
Excellent phone for cheaper price than Apple 700,Excellent phonefor cheaper price than Apple 700.00 phone,2017年3月6日 在美国审核
Great value,my son told me that it works great even with Pokemon Go and minecraft,2017年1月21日 在美国审核
its cheap but works,it worked fine for the price. hard to type on. clear phone calls,2017年1月4日 在美国审核
"Not a bad phone, just not a lot of room","The phone works without issues, and for the money isnt a bad buy. But if you want to have apps and such on the phone... don't bother. For using as a phone and texting people.... Then by all means get it but if you like to load up on apps, Then Id consider other options.",2016年3月1日 在美国审核
Works great in Iceland!,"Works great in Iceland. I was looking for a phone that would work on vacation in Iceland. My Verizon phone is pretty much useless outside the US. Added a prepaid SIM card and was all set in minutes. This has slots for two different size SIM cards so you don't have to get a specific SIM size. Holds two SIM cards at once. Battery life is better than expected but I don't have a lot of apps loaded. Display and performance are acceptable. GPS and WiFi seem to work fine, although Google maps is worthless here, no fault of the phone.",2016年5月29日 在美国审核
Love my phone,Came with case and screen protector. Great phone,2016年9月5日 在美国审核
Five Stars,junk. sometimes I can't hear what people are saying to me on the phone.,2016年12月17日 在美国审核
Five Stars,They were a gift to cousins in the Philippines..,2017年8月21日 在美国审核
Five Stars,"Very nice....only a week old, but so far is working well...great value/price, compared to my daughter's $400 iPhone",2016年5月1日 在美国审核
Five Stars,"Great product, excellent service",2017年10月23日 在美国审核
Five Stars,Great quality products at great prices.,2017年8月24日 在美国审核
This phone is not worth your money.,"This is a terrible phone. I know it's low-priced, but even judging it on that curve, it's just plain bad.The first phone I got couldn't be charged. It kept saying that the battery temperature was too low (whatever that means), and so it wouldnt allow the phone to be charged. I called customer service, but they couldn't help (hint: you probably know you're buying a piece of junk when the front of the phone's box has the customer service number and says please call customer service before returning the phone).I got a replacement from Amazon (great service). Knowing that the phone has hardly any internal memory, I installed an internal 16GB SD card that I had lying around. Guess what? The phone won't allow you to store apps or app data on the phone. Just photos and music. So, here I am, with 16GB of memory, but the phone can't update my email or whatsapp because the internal memory is full.I have Whatsapp, Facebook and Skype apps on my phone. That's it. And the phone won't work, because the memory is full. Again, there is 16GB of additional memory in there, but you can only use it for photos and music.Did I mention that the battery life is awful?Did I mention that the sound quality for regular conversations is bad?Pay the extra money for something else. Save yourself the hassle.",2016年9月19日 在美国审核
Five Stars,perfect for what i needed. it was more than i expected.,2017年5月31日 在美国审核
Don't do it.,"So disappointed in this phone, by the time you do the required update, if you keep more than 2 emails you're out of internal storage. All the BLU phones have this issue, and when I try to get in touch with the company it's near impossible. My kids spent their hard earned money on this and the SELFIE phone only to be constantly asking me to ""fix it"" to clear up internal memory. Save your money and buy yourself an unlocked phone. These are unreliable and pretty much glorified paper weights when you've deleted all you can.",2016年10月24日 在美国审核
Not a good phone.,Poor quality phone with severely limited storage.,2019年11月5日 在美国审核
Five Stars,"Loved my purchase, Works as described but better. Would recommend this !",2016年11月11日 在美国审核
and it worked just fine. Only problem is I have trouble connecting it ...,"Entered my sim card, and it worked just fine. Only problem is I have trouble connecting it to my computer in order to transfer files.",2017年2月4日 在美国审核
Good to look at... not to hear on...,"I bought this phone as a Christmas gift for my mom. After receiving it, I opened the box (just to peak) and was really happy with the phone's overall appearance. However, after my mom opened it on Christmas and set it up, she was complaining about not being able to hear well on the phone. Originally I thought maybe she was inadvertently hitting the volume button on accident or the volume was turned down, but after checking the volume settings and making sure the volume was as loud as it could go, I realized the problem was the phone itself! The volume is extremely low even on the maximum setting, which basically requires you to talk on speaker phone all the time! I tried contacting the manufacturer regarding the problem but haven't heard anything in response. Beautiful phone.... if only the volume worked better.... :(",2017年5月26日 在美国审核
Great for LATAM countries,High quality and low cost. Great for LATAM countries.,2016年6月7日 在美国审核
Four Stars,quality product works for me perfectly,2016年10月27日 在美国审核
Second unit isn't doing any better. Numerous hangs and freezes makes the phone impossible ...,"First phone died after a couple weeks, after repeated ""System UI has stopped responding"" errors (almost continuously while actually using it).Second unit isn't doing any better.Numerous hangs and freezes makes the phone impossible to work with.Trying to do anything is a chore, because it will freeze, and then the entire screen will go black and finally return you to the home screen.Edit:Just noticed something strange.The serial number is 0123456789ABCDEF.Is that unusual?Are these phones knock-offs?",2017年5月23日 在美国审核
Four Stars,My wife is very happy with this phone.,2017年10月29日 在美国审核
Would be a decent phone if it worked,"I bought this phone in February and I am already going to get rid of it. I previously had a Blu Studio 5.0C HD which I loved, but had to replace after breaking the screen and unfortunately I bought this piece of junk. Right from when I got the phone, I had issues receiving texts messages. I could only receive messages if I texted someone first and they replied within a few hours. I tried re-configuring the APN (which worked for about a day) then did a factory reset, which fixed the texting issue but seemed to delete the software that recognizes the front camera. Since then, texting stopped working again and now my phone calls automatically hang up after an hour, and sound has been cutting in and out sporadically during calls as well. Needless to say that overall I am very disappointed with this phone, especially since I had a pretty high opinion of Blu products beforehand.There are good things about the phone, but if you don't want to risk getting a phone that does not work then I would recommend buying something else.",2017年6月25日 在美国审核
Five Stars,Wonderful phone it met all my expectations would recommend to friends and have recommended the friends,2017年7月21日 在美国审核
Five Stars,Good phone. Good price,2018年3月17日 在美国审核
Four Stars,I loved the phone but could not use it I had to send it back,2017年4月5日 在美国审核
Works well for what I've bought it.,Great phone for its price.Bought it to receive texts from 2 sims in 3G network.Woks pretty well (for about 1 month).,2017年3月6日 在美国审核
grandson love their new phones great,"my granddaughter,grandson love their new phones great product",2017年2月2日 在美国审核
"Good for starters to Android, large screen",Bought for my in-laws and they are pleased so I relay those sentiments since I personally have not used the phones.,2016年5月29日 在美国审核
great value..good looking phone,Great looking phone. Works like a much higher priced phone. My granddaughter loves it.,2016年4月22日 在美国审核
Excellent buy from Excellent company,"How Beautiful is this phone? Large screen display ,amazing pixel colors,great headphones,just excellent quality for price.",2017年7月2日 在美国审核
Best buy on the cell phone market.,Who needs an IPHONE1Does everything I need a phone to do.,2016年9月5日 在美国审核
Five Stars,The phone works great and it has really good display. The phone has a good loud speaker.,2017年3月11日 在美国审核
Five Stars,"good Cell, good color, look good everything is excellent.",2017年1月18日 在美国审核
BLU phone - I'm a fan,"For less than $100 this was an outstanding value. I am disappointed that I chose the 4gb model vs the 8gb, or 16gb. But overall the phone worked well for me here in the US and in Europe. I have since recommended BLU phones to friends and business colleagues.",2016年7月5日 在美国审核
Five Stars,On time and as expected.,2018年2月12日 在美国审核
Five Stars,perfect. i got another one for my 90 year old mother.,2017年6月7日 在美国审核
No software available. ..,Worked well until it crashed. ..no software to repair that sucked!,2017年8月28日 在美国审核
https: //www. amazon.,https://www.amazon.com/dp/B018IZ0SWI/ref=cm_cr_ryp_prd_ttl_sol_36,2017年1月18日 在美国审核
DO NOT PURCHASE THIS PHONE! DO NOT PURCHASE THIS PHONE!! DO NOT PURCHASE THIS PHONE!!!😤😤😤,"Can't used the phone app...whenever I press the phone app to try to make a phone a call it comes up then goes away and a error message comes up ""Unfortunately phone is not working."" Also the when the phone is speaker the volume is horrible! I purchased the phone around March and this piece of crap started falling apart in April... When I wanted to replace I was told it's too late!!! I couldn't believe the insult after all I've ordered from Amazon... I was really hurt. I need my phone for health reasons...serious health reasons...and they did absolutely nothing to rectify the problem. I understand if it had months and months since I had purchased the phone... But it was not the case at all...it does the same thing with the camera as well...and don't get me started with it powering down by itself😖😖😖😞😞😞",2017年9月27日 在美国审核
Battery ALMOST EXPLODED..HUGE!!!,Look at the battery after a year!!!Almost exploded!!! SWOLLEN!! So lucky I didn't get hurt :( I'm not sure why this happened.. I was overjoyed with the phone when I got it...hope this doesn't happen to someone else because it's CERTAINLY a SAFETY HAZARD!,2017年5月6日 在美国审核
Five Stars,Updated my phone so I needed an updated case. Holds everything I need.,2016年10月11日 在美国审核
Five Stars,This phone was great the screen was nice and big sharp color's also.,2016年6月28日 在美国审核
I like it. its as expected sleek and light,"I like it . its as expected sleek and light, easy to setup.howeverI did not received any headphones I'm my package, and as a result is unable to use the FM radio.Instructions advise to use enclosed headphones to first set upradio.",2017年1月1日 在美国审核
but I must say it looked very nice.,"I don't use it for personal use. I purchased it to send to family abroad, but I must say it looked very nice.",2017年3月1日 在美国审核
Recommended,Great phone for your kids!,2018年1月3日 在美国审核
good phone for basic use,"good phone for basic use, don't expect to much of it. But it is a good cheap phone if you need one right now",2017年10月17日 在美国审核
Five Stars,I received it on time and great product .thank you,2017年1月3日 在美国审核
Five Stars,My mother is like it.,2018年6月22日 在美国审核
loved it,Purchased as a gift for son in law he said he loved it. Thanks,2016年12月27日 在美国审核
... the phone for my boyfriend and so far so good based on his opinion,I brought the phone for my boyfriend and so far so good based on his opinion. The battery life is great. He hasn't complain about anything in particular.,2016年8月17日 在美国审核
Five Stars,Excellent product,2017年12月26日 在美国审核
Five Stars,Bought this phone for my mom she's happy with it and its easy to use .,2017年1月13日 在美国审核
It is alright for some people not for others...,"I mean it's a sturdy device and all, but the viewing angles and the screen itself are sub par and it feels cheap, kinda slow and also the camera sucks. It would be a great device for someone's first smartphone or maybe an older person but honestly invest more money into a better phone. THe iPhone 5s is only like $199 so try that",2016年12月19日 在美国审核
Five Stars,nice and good quality at low cost,2016年3月11日 在美国审核
Five Stars,"its a good product, its light and thin it works perctly in venezuela",2018年7月31日 在美国审核
Good as second phone,I use only voice with AT&amp;T prepaid card. Works well. Screen sharp. Battery lasts. Good as second phone. Hard to beat with this price.,2016年8月28日 在美国审核
Good only for calls or texts,"I have had the phone for four months now. Battery doesn't last. Maybe half a day. A lot of the apps crash. Snapchat doesn't work half the time. Camera is not good. Sometimes when turned off it won't load the Facebook or Messenger app. It's like they are no installed, however, Google Play shows them as installed. Phone re-boots often. Too many times. This is the third time I had to to restart it to factory settings and it didn't not back up my pictures in the sd card even though I asked for. The phone is ok if you are looking to just text and make phone calls. Good price. But if you want to do more than that I would recommend something else",2017年3月6日 在美国审核
KusorD,Beautful sand affordable beautiful phone. Love it.,2017年5月27日 在美国审核
Good for the,"Got it for my dad, and he loves it! Good for the price",2016年11月17日 在美国审核
Good for the money,Perfect phone...Well almost but for the price I am not complaining at all.,2016年5月3日 在美国审核
Five Stars,Great phone for the money. I have had no complaints. Thanks.,2016年10月21日 在美国审核
"If there is a 16g or bigger internal storage, get it.",Very limited internal storage,2017年12月30日 在美国审核
Excellent choice...,"It's working well in Haiti ( port au prince /fontamara)no problem what so ever according to my sister. She's on Facebook, whatSapp browsingday in day out. Excellent choice",2017年4月28日 在美国审核
Five Stars,I always buy BLU,2017年12月20日 在美国审核
It's a great phone for the price and I also love the ...,"It's a great phone for the price and I also love the features and style of the phone. It's fast and durable. My only issue with the phone was the battery, the battery runs out too fast with or without using the phone, but overall it's a great phone for the price",2016年12月6日 在美国审核
Works,It is what it is a cheap telephone but it does work,2017年3月21日 在美国审核
A good phone for first time smart phone users.,"This is a great phone for a first time smart phone user.My only complaint is that it will not recognize my Plantronics bluetooth headsets.They worked fine with my previous phone so I don't know what the problem is.Otherwise, it does a great job for the price.The user manual leaves something,make that a lot to be desired but I have managed to figure out most of the functions through trial and error.",2016年6月18日 在美国审核
Great phone.,"Great phone...work construction and always need to replace my phone every 6mos to a year due dropping, vibration and dust. These are a cheap alternative and always exceed beyond my expectations.Order another one soon with more GB",2017年4月22日 在美国审核
but up to now a Good phone// very good for the price,"Ive only had it for a month, but up to now a Good phone// very good for the price.Good camera, speaker volume jpwever weak, especially on calls, but Ok.... Inserting and or replacing the battery a real headache/ stupid to make it so hard and not offer instructions.A real shame and business mistake not to offer amanual. Otherwise, the thing works well. Hard to imagine a better deal for the price, but be prepared to pull a few handfuls of hair out inserting the battery and Sim cards.",2016年9月23日 在美国审核
