They came fast and we had no problem getting their service switched over,2021年4月11日 在美国审核
Great item,2020年6月21日 在美国审核
I love this phone and it was as described,2020年6月21日 在美国审核
Amazing,2020年6月16日 在美国审核
Had no problems with phone since I got it,2020年6月16日 在美国审核
Great buy.,2021年1月29日 在美国审核
Phone arrived early and the packaging it was in was securifor the phone,2021年1月29日 在美国审核
The phone looks and performs amazingly,2021年1月29日 在美国审核
Words can't justify the most perfect phone this is,2020年2月23日 在美国审核
Very Nice,2020年8月21日 在美国审核
My sister loved it!,2020年8月21日 在美国审核
literally perfect !!,2021年7月7日 在美国审核
"came in great condition , if it’s been used before you can’t even tell , it seems like it’s a brand new phone ",2021年7月7日 在美国审核
Works perfectly!,2022年3月16日 在美国审核
I bought this phone about two years ago now and it's still like new! Love it,2022年3月16日 在美国审核
Great Device!,2022年4月8日 在美国审核
"Phone arrived in excellent condition, almost new",2022年4月8日 在美国审核
Great condition,2020年6月25日 在美国审核
My sons loves his new Iphone! It arrived a day earlier then expected and is in great condition!!,2020年6月25日 在美国审核
Great condition,2019年12月27日 在美国审核
My daughter just started using this phone and Everything is good so far,2019年12月27日 在美国审核
Yoooo it works,2021年6月20日 在美国审核
"It’s an iPhone XR, and that’s all I gotta say",2021年6月20日 在美国审核
EXCELLENT PHONE IN PERFECT CONDITION!!,2021年1月5日 在美国审核
I ordered this phone on December 31st and got it on the 5th of January which was 2 days sooner than expected and it is flawless! It looks brand new and works as if it is brand new! I am 1000% satisfied with my purchase!!,2021年1月5日 在美国审核
quality,2020年8月18日 在美国审核
Good item it work lik new,2020年8月18日 在美国审核
Amazing Condition Not a Scratch,2020年8月23日 在美国审核
"Came with all it original cord and charge, and not a scratch on it",2020年8月23日 在美国审核
Good phone,2020年6月23日 在美国审核
I was skeptical after reading some reviews but when it came I was impressed,2020年6月23日 在美国审核
Iphone xr,2020年10月3日 在美国审核
I ordered this phone for my son,2020年10月3日 在美国审核
I would gladly buy another,2020年10月3日 在美国审核
Almost like new,2022年1月5日 在美国审核
"Everything works well except it’s hard to hear unless the speakerphone is turned on, even with the volume all the way up",2022年1月5日 在美国审核
Great purchase,2020年4月13日 在美国审核
"Phone came earlier then expected, no scratches or blemishes",2020年4月13日 在美国审核
Will update if any issues come up!,2020年4月13日 在美国审核
Looked brand new!!!!!,2022年3月2日 在美国审核
"It came so sleek and i couldnt see any physical or interior signs that it was used, it only charges slowly but other than that i am very satisfied with my order!",2022年3月2日 在美国审核
Renewed phone works great!,2020年3月21日 在美国审核
I absolutely love it! I switched from Samsung and I don’t think I’m going back,2020年3月21日 在美国审核
Great purchase! worth it,2019年12月17日 在美国审核
i was nervous to buy a phone off of amazon,2019年12月17日 在美国审核
Gift for 16 year old,2020年9月3日 在美国审核
My granddaughter loves it!,2020年9月3日 在美国审核
This is a great phone!,2020年1月31日 在美国审核
I love this phone so much! I definitely recommend this and this was a great upgrade from a 6 to an XR,2020年1月31日 在美国审核
WOULD BUY AGAIN!,2020年2月28日 在美国审核
"I liked everything, came unlocked ",2020年2月28日 在美国审核
No issues or wear and tear,2020年12月5日 在美国审核
The battery capacity was at 100%,2020年12月5日 在美国审核
im haooy it wasnt a scam! i love my phone the camera is the best part.,2022年4月18日 在美国审核
came on time nd i had no problems witht he phone,2022年4月18日 在美国审核
Like new phone at a low price!,2019年11月27日 在美国审核
Best price for what looks and performs like a brand new phone! Like it a lot,2019年11月27日 在美国审核
Everything checked out,2022年4月23日 在美国审核
"I was so nervous!!! But I am so relieved, I got the right space, the phone looks beautiful, my battery life is 98%",2022年4月23日 在美国审核
Looked like new,2021年1月5日 在美国审核
"Came in an Amazon package, but phone was received as described",2021年1月5日 在美国审核
"Great quality for the price, perfect condition",2021年10月15日 在美国审核
"The phone is in amazing shape, extremely happy with my purchase!",2021年10月15日 在美国审核
iPhone XR (coral) fully unlocked,2021年4月20日 在美国审核
I bought the coral XR! Works great! Perfect condition! Exactly as described! Would buy from this seller again!,2021年4月20日 在美国审核
Tremendas fotos,2021年3月25日 在美国审核
"Me gusta mucho la camara que tiene el telefono, todos los samsung tienen muy buena nitidez",2021年3月25日 在美国审核
Works well,2020年6月16日 在美国审核
Shipping was prompt and the condition of the phone was as described and works well with TMOBILE ,2020年6月16日 在美国审核
Excellent used phone.,2021年12月12日 在美国审核
I expected to get a phone with 80% battery life that performed somewhat the way it should,2021年12月12日 在美国审核
If you want to upgrade your iPhone this is a Great buy for the money,2021年1月27日 在美国审核
Battery life good for my daily use touch screen working very fast screen quality look very good like new the sipping was very fast to Puerto Rico,2021年1月27日 在美国审核
It works very well,2021年1月4日 在美国审核
"It works perfectly, nothing was wrong when arrived and I have been using it for months now and nothing is going wrong",2021年1月4日 在美国审核
Definitely worth it,2020年3月8日 在美国审核
NOT A SCAM YALL! :),2020年3月1日 在美国审核
So at first I was a little skeptical about buying this but it’s worth it,2020年3月1日 在美国审核
Don’t hesitate buying a phone online.,2020年3月18日 在美国审核
Very happy with the XR,2020年3月18日 在美国审核
"Was timely, worked great",2020年3月18日 在美国审核
Great,2019年8月22日 在美国审核
"Great price for expensive gift! Bought for bf in manaus brazil, slipped in a sims card and phone worked great! As they say in brazilobrigado (thanks)!",2019年8月22日 在美国审核
Absolutely LOVE!!!!!!!!,2020年10月20日 在美国审核
"I absolutely love my new XR, so glad I purchased it",2020年10月20日 在美国审核
pretty good,2022年2月21日 在美国审核
i think this is a really good product i ordered it twice and there are not problems that i can see with either of them they also both came early so that’s a plus!,2022年2月21日 在美国审核
Upgraded my phone,2021年2月5日 在美国审核
I thought this was aGood deal and so far I am very happy with it!,2021年2月5日 在美国审核
Great price and convenient,2019年11月26日 在美国审核
"I've been using this for about a month now and it works great! The only hassle was calling up my phone company and switching the sim card from my old iphone, but on the upside I could do that from home instead of going into the store to have them make the transfer",2019年11月26日 在美国审核
"2 days in, GOOD purchase so far.",2021年12月27日 在美国审核
"Will update in a few months, so far, so good",2021年12月27日 在美国审核
So far so good,2021年2月15日 在美国审核
So far so good,2021年2月15日 在美国审核
Buy this!,2019年6月6日 在美国审核
"I’ve never left a product review on amazon before, but based on all the negative reviews I felt I needed to share that I got a brand new phone for 200$ less than I would’ve on apple; no dents or scratches or imperfections whatsoever and battery capacity is 100%",2019年6月6日 在美国审核
No headphone area. Must wear Bluetooth earplugs and some do not work with I-Phone.,2019年12月19日 在美国审核
I love my I-phone! It was almost half price from Original cost,2019年12月19日 在美国审核
Nice phone and color,2021年2月9日 在美国审核
"Love the color, the phone is perfect with no scratch, it’s completely New ! 100% satisfied also for the prime delivery , always on time",2021年2月9日 在美国审核
"Best cost &amp; benefit, I really recommend",2020年12月25日 在美国审核
"I'm Brazilian, I was afraid the telephone does not work here in Brazil, but it worked perfect!Telephone came as new (no scratches , perfect screen - with screen protector, 90% of battery life, in a perfect condition)I love it ! Thank you",2020年12月25日 在美国审核
I LOVE my new XR!!! No issues since November!! Perfect price &amp; perfect phone..,2020年1月26日 在美国审核
I love this phone!! Has worked perfectly since I got it back in November,2020年1月26日 在美国审核
"I have had no issues with this phone and heavily recommended this product to those who may be skeptical about purchasing from amazon, and those looking for a phone they can trust to do the job! ",2020年1月26日 在美国审核
Great quality,2021年3月14日 在美国审核
"Besides the back camera having a little bit of glue showing on the edge, the phone was in good conditions and everything",2021年3月14日 在美国审核
Excellent product with excellent service!!!!,2020年5月15日 在美国审核
Have not used it yet,2020年5月15日 在美国审核
"What I can say, it is a most excellent phone at a very good price",2020年5月15日 在美国审核
Cricket,2020年5月20日 在美国审核
"Phone works good ,looks brand new this is my first I phone so idk how I feel about it in that way yet but other then that great phone works with cricket that’s what I’m using",2020年5月20日 在美国审核
Just bought it.  Hard to rate after one month.  Particularly battery life,2021年4月4日 在美国审核
Just learning it,2021年4月4日 在美国审核
Recommend,2021年5月20日 在美国审核
Great product,2021年5月20日 在美国审核
Amazing!!,2022年5月14日 在美国审核
I have bought it for my son,2022年5月14日 在美国审核
Renewed iPhone XR for a fair price.,2021年4月11日 在美国审核
Phone arrived as described in a timely manner,2021年4月11日 在美国审核
iPhone XR looks like new!,2021年3月8日 在美国审核
"Looks great, performs great",2021年3月8日 在美国审核
Worth it!,2019年11月22日 在美国审核
This phone is definitely worth the money,2019年11月22日 在美国审核
The best change ever,2021年4月12日 在美国审核
Love this phone and it even came a day earlier than expected,2021年4月12日 在美国审核
Definitely recommend!,2020年5月9日 在美国审核
"I was skeptical about buying a phone online, especially with having it shipped",2020年5月9日 在美国审核
Solid phone,2021年8月16日 在美国审核
Solid device,2021年8月16日 在美国审核
No noticeable scratches or cracks,2021年8月16日 在美国审核
Battery works for long periods of use and works as intended,2021年8月16日 在美国审核
Highly recommend this seller,2021年8月16日 在美国审核
Facial recognition works great,2021年8月16日 在美国审核
Great,2020年3月30日 在美国审核
Nice phone,2021年2月16日 在美国审核
Works as expected,2021年2月16日 在美国审核
My new iPhone XR,2021年2月13日 在美国审核
"I loveI would recommend it to anyone!The phone was in excellent condition, It came with a nice clear case +screen protector",2021年2月13日 在美国审核
Excellent buy,2020年10月11日 在美国审核
Absolutely PERFECT and FLAWLESS,2020年10月11日 在美国审核
Good,2021年5月7日 在美国审核
The phone works and there’s no visible marks,2021年5月7日 在美国审核
Good price compared to local stores,2021年3月13日 在美国审核
Easy to switch over to my current number,2021年3月13日 在美国审核
iPhone XR,2020年9月8日 在美国审核
"So far the phone works really good, except the battery life isn’t what I thought it would be, but other than that, phone looked new and I’m happy for the purchase",2020年9月8日 在美国审核
AMAZING!!!,2020年11月15日 在美国审核
"I have had my phone for about 1 month, and in this 1 month I have had no problems, phone came in perfect condition not a single scratch on anything, battery health was at 97% was expecting way lower",2020年11月15日 在美国审核
Bought 2 Phones.. received in very good condition,2021年8月6日 在美国审核
I’m from Trinidad and Tobago I recommend anyone to buy this! Works like new!,2021年8月6日 在美国审核
Good quality,2020年11月10日 在美国审核
"Upgrade my Android to iPhone, I’m happy with the change",2020年11月10日 在美国审核
GREAT CONDITION!,2021年6月15日 在美国审核
Product looks brand new and in perfect condition,2021年6月15日 在美国审核
Excellent refurbishment.,2021年1月25日 在美国审核
Product looks and works like new,2021年1月25日 在美国审核
IPhone XR 128gb Unlocked,2021年1月29日 在美国审核
The phone had no scratches and it was true to the description,2021年1月29日 在美国审核
Highly recommend,2021年5月1日 在美国审核
Everything works perfectly,2021年5月1日 在美国审核
iPhone XR great love it,2020年3月3日 在美国审核
The iPhone XR I bought was from amazon renew,2020年3月3日 在美国审核
It's like a brand new one,2021年1月19日 在美国审核
"It works like a brand new one, can't find any difference at all from previous brand new ones that I had",2021年1月19日 在美国审核
best device for $300,2022年6月13日 在美国审核
best device for $300,2022年6月13日 在美国审核
I will buy refurbished phones again,2019年12月17日 在美国审核
This was my first refurbished phone purchase,2019年12月17日 在美国审核
It came to me like it was new!!,2019年12月17日 在美国审核
Very Great Product,2022年4月29日 在美国审核
"This is the first iPhone I have ever owned and it’s great, I even got a free screen protector already placed on the phone",2022年4月29日 在美国审核
Great !,2021年1月16日 在美国审核
Just received my phone a few days ago &amp; it was in excellent condition &amp; the quality &amp; battery life is like new! Super satisfied!,2021年1月16日 在美国审核
I NEVER bought a phone off amazon until last month,2020年3月17日 在美国审核
So every store had the xr but no red I’ve had my phone for a month now and I loveeee it the picture quality is AMAZING the battery lasts all day with power saving mode on and I love the new specs of this phone I would definitely recommend this phone,2020年3月17日 在美国审核
Would recommend.,2021年7月14日 在美国审核
"Bought for my son, he’s only had a few days: It came in perfect condition, so far, no noted issues",2021年7月14日 在美国审核
Refurbished and Quick Delivery,2021年4月21日 在美国审核
Very satisfied and would recommend,2021年4月21日 在美国审核
Stop Working,2022年1月2日 在美国审核
Stop working after 3 months,2022年1月2日 在美国审核
Excellent value for an awesome phone.,2020年5月25日 在美国审核
So glad I decided to make this purchase,2020年5月25日 在美国审核
Great phone,2020年3月30日 在美国审核
"No complaints, works and looks perfect",2020年3月30日 在美国审核
10/10,2020年3月12日 在美国审核
"Great price, good value screen was a bit scuffed",2022年6月8日 在美国审核
Screen was scuffed,2022年6月8日 在美国审核
Great phone,2020年12月25日 在美国审核
"It’s great, this is my first iPhone",2020年12月25日 在美国审核
Price/Quality ,2021年2月12日 在美国审核
I got the phone yesterday,2021年2月12日 在美国审核
Exactly what I had hoped for,2022年4月16日 在美国审核
The phone came quickly I suggest ordering a case at the same time but I have had no problems with this phone,2022年4月16日 在美国审核
Great phone and so much better than paying the NEW price,2021年3月24日 在美国审核
Love the quality and battery life,2021年3月24日 在美国审核
I love it,2022年1月26日 在美国审核
Phone looked brand new and to me worth the 275 bucks,2022年1月26日 在美国审核
This made my day,2020年3月3日 在美国审核
Absolutely love this phone! It’s basically brand new awesome condition even got to me 1 day early,2020年3月3日 在美国审核
I got lucky I guess,2021年3月12日 在美国审核
as expected,2021年7月13日 在美国审核
"nothing wrong with it, and not sketchy at all",2021年7月13日 在美国审核
Great buy!!!,2021年2月27日 在美国审核
Everything works on this phone as it should,2021年2月27日 在美国审核
Excelente servicio !! Recomendado !!,2021年3月2日 在美国审核
La batería llego al 100% la pantalla en perfecto estado sin signos de haber sido usado antes !! Como nuevo llego,2021年3月2日 在美国审核
I would recommend this product,2021年2月2日 在美国审核
At first I was hesitant but I have absolutely no issues with the phone,2021年2月2日 在美国审核
It’s ok too buy renewed,2021年1月3日 在美国审核
This was the perfect gift,2021年1月3日 在美国审核
iPhone XR!!! Great buy!!,2020年2月19日 在美国审核
Received the phone in hand on 10th February and so far has been flawless,2020年2月19日 在美国审核
It’s ok,2022年4月4日 在美国审核
Price goodBut doesn’t have original Apple battery,2022年4月4日 在美国审核
Good phone,2021年1月17日 在美国审核
Good camera!This is my second XR,2021年1月17日 在美国审核
NA,2021年11月16日 在美国审核
"Good product, fast shipping",2021年11月16日 在美国审核
Satisfied with my order.,2020年3月25日 在美国审核
"I was sketchy on buying this phone because I never bought a phone off amazon before, but when I ordered it, it came in a matter of 3-4 days",2020年3月25日 在美国审核
Very good,2021年1月6日 在美国审核
Product works well as described happy with purchase,2021年1月6日 在美国审核
Great quality,2021年4月29日 在美国审核
I’m very impressed with the quality of this phone for the price,2021年4月29日 在美国审核
"Great device, as advertised!",2022年3月27日 在美国审核
Works great,2022年3月27日 在美国审核
This is a very great iPhone and works very well,2022年1月27日 在美国审核
Great in all caterigories,2022年1月27日 在美国审核
Black iPhone XR,2020年2月25日 在美国审核
Great buy! My son is very happy! Everything is working great now,2020年2月25日 在美国审核
Great phone,2020年9月5日 在美国审核
The phone was as expected!,2020年9月5日 在美国审核
works great,2020年6月8日 在美国审核
I was kind of sacred to order it but it came in great,2020年6月8日 在美国审核
Essentially A brand new phone!,2020年3月2日 在美国审核
I searched high and low for any defects or scratches and found NONE,2020年3月2日 在美国审核
Happy customer,2021年6月23日 在美国审核
Was hesitant to buy a renewed phone but it was well worth it,2021年6月23日 在美国审核
Would recommend!,2021年6月23日 在美国审核
Great Buy,2021年2月20日 在美国审核
The color of this phone is just beautiful! I bought this a couple of months ago and the qualityof this phone is top notch! Great buy,2021年2月20日 在美国审核
Review,2021年10月20日 在美国审核
"The phone works very well, no scratches or faults",2021年10月20日 在美国审核
Like new,2021年6月27日 在美国审核
Came in like new condition,2021年6月27日 在美国审核
Very Happy with the purchase,2021年6月27日 在美国审核
Would recommend!!,2021年6月27日 在美国审核
Producto malo,2021年3月19日 在美国审核
Nice,2019年12月27日 在美国审核
Better than new,2021年3月3日 在美国审核
This phone looks and acts as if it was brand new,2021年3月3日 在美国审核
Excellent great shape 10/10,2021年6月26日 在美国审核
Excellent overall,2021年6月26日 在美国审核
The color,2021年12月29日 在美国审核
I like everything about it,2021年12月29日 在美国审核
Phone,2022年3月20日 在美国审核
"The battery life isn't the best but the phone didn't overhead, it's fast, the face resonation was amazing definitely buy this phone",2022年3月20日 在美国审核
Great deal,2021年9月5日 在美国审核
2 weeks and has worked greatly,2021年9月5日 在美国审核
Good,2022年1月26日 在美国审核
Everything is good about this phone 100% you should buy it it’s affordable it works perfectly good condition any service you want very good product I would recommend it,2022年1月26日 在美国审核
Buen telefono,2022年2月10日 在美国审核
El telefono esta calidad la batería vino con %98 y bien en buen estado ,2022年2月10日 在美国审核
Works great,2020年2月12日 在美国审核
Works perfectly no issues at will,2020年2月12日 在美国审核
New IPhone XR,2020年8月26日 在美国审核
Amazing performance and flawless look,2020年8月26日 在美国审核
Perfect,2020年5月2日 在美国审核
Came early and the phone was perfect no scratches and has a battery life of 100%,2020年5月2日 在美国审核
Recommend,2020年6月9日 在美国审核
"Thank you seller! Unblocked, 93% battery health, no scratches",2020年6月9日 在美国审核
Works great,2021年1月12日 在美国审核
Everything works great and was in perfect condition,2021年1月12日 在美国审核
Buen precio y calidad,2020年12月25日 在美国审核
It’s a good product,2021年5月4日 在美国审核
Everything works as expected,2021年5月4日 在美国审核
Perfect no errors ,2020年7月7日 在美国审核
Everything came out perfect,2020年7月7日 在美国审核
Happy,2020年1月1日 在美国审核
My daughter loves it! No issues at all,2020年1月1日 在美国审核
Great find,2019年7月25日 在美国审核
Great item not a single scratch,2019年7月25日 在美国审核
As long as momma's baby and poppa's maybe be happy....the world can keep on turning round and round.,2021年4月29日 在美国审核
It was nice getting what I paid for,2021年4月29日 在美国审核
It was for a teenager who was extremely happy with it,2021年4月29日 在美国审核
iPhone XR,2020年2月18日 在美国审核
Love it great condition for the price few minor scratches but great phone,2020年2月18日 在美国审核
A solid iPhone for a decent price,2020年11月21日 在美国审核
"Great phone with great battery life, my only gripe was the phone had no charge upon arrival",2020年11月21日 在美国审核
Great,2022年2月19日 在美国审核
You Can Trust,2020年12月2日 在美国审核
I bought an XR with BuySpry and it came with a new battery and in good condition,2020年12月2日 在美国审核
Great phone.,2020年3月21日 在美国审核
Great phone,2020年3月21日 在美国审核
Like new,2021年9月29日 在美国审核
Like new! As description,2021年9月29日 在美国审核
Awesome,2020年6月8日 在美国审核
Nothing wrong with it came like it was new definitely invest for how much it is,2020年6月8日 在美国审核
Fantastic phone,2019年6月22日 在美国审核
"This phone is amazing! It was safely shipped and delivered earlier than expected, and the manual set up was quick and easy",2019年6月22日 在美国审核
GREAT PHONE,2021年5月25日 在美国审核
I dont know about the other comments but this is a great phone so far,2021年5月25日 在美国审核
Nothing Wrong,2021年2月8日 在美国审核
The phone is perfect literally like if i bought it from the apple store,2021年2月8日 在美国审核
Worth every penny!,2020年3月5日 在美国审核
I love this IPhone! It Looks and works like brand new! No scratch and any flaws I could find(For a meticulous person like me)I was hesitant to buy a used iPhone (it's my 1st time to try a used one) and this phone didn’t gave me disappointment !2 thumbs up! Love it!,2020年3月5日 在美国审核
Love it,2020年1月11日 在美国审核
I love this new iPhone XR coral color is beautiful and size fits perfect in my hand,2020年1月11日 在美国审核
Totally worth it!,2021年6月17日 在美国审核
"I was afraid that there would be cracks or malfunctions when reading the reviews, but it came early and there were no scratches at all! It’s totally worth it",2021年6月17日 在美国审核
Mas que lo esperado,2020年11月19日 在美国审核
"De no ser por la caja, el equipo esta en condiciones de nuevo",2020年11月19日 在美国审核
Great Phone very Happy,2020年10月7日 在美国审核
"The phone arrived very quickly and as advertised, great condition",2020年10月7日 在美国审核
Excelente producto funciona OK en Chile,2022年4月21日 在美国审核
Excellent,2021年1月12日 在美国审核
Good phone no trouble it’s what I expected !,2021年1月12日 在美国审核
Renewed phone works perfect,2020年1月4日 在美国审核
Bought renewed phone and have been using for a month and works like brand new!,2020年1月4日 在美国审核
impressed,2022年4月19日 在美国审核
excellent product for an excellent price,2022年4月19日 在美国审核
Buen producto,2022年1月12日 在美国审核
Presently satisfied,2021年9月13日 在美国审核
