I-phone XR as represented,2022年2月24日 在美国审核
This was a money saving surprise,2020年10月6日 在美国审核
What I received was a pretty close to perfect used smartphone,2020年10月6日 在美国审核
Pretty close equates to damn near perfect,2020年10月6日 在美国审核
Great phone,2021年1月24日 在美国审核
I moved up from an iPhone 6s so no surprise this phone is awesome to me ,2021年1月24日 在美国审核
Great,2021年3月21日 在美国审核
"The battery life is amazing, literally lasts all day",2021年3月21日 在美国审核
Great used phone,2022年5月6日 在美国审核
Not bad for the price and workability,2022年5月6日 在美国审核
LOVE,2020年3月26日 在美国审核
I received my phone over 2 weeks ago,2020年3月26日 在美国审核
Apariencia perfecta,2021年12月12日 在美国审核
Great value!,2021年10月26日 在美国审核
Came as advertised,2021年10月26日 在美国审核
And a great price compared to new phone,2021年10月26日 在美国审核
No noticeable blemishes or defects,2021年10月26日 在美国审核
La mejor compra de mi vida!!,2021年1月7日 在美国审核
"Si estás pensando en comprar un iPhone restaurado no lo pienses, será la mejor compra",2021年1月7日 在美国审核
BUYER BEWARE!!!,2020年7月22日 在美国审核
Phone is not unlocked to carriers and when you try to add it to any service provider they will say the imei number is invalid meaning it’s not a real device,2020年7月22日 在美国审核
Worth it,2022年4月9日 在美国审核
Worth it for the money my ex still have she have no issues,2022年4月9日 在美国审核
Not true to advertising,2021年1月4日 在美国审核
The seller lied about the unlocked accommodating for all cell phone companies,2021年1月4日 在美国审核
"Not a scam, great phone! Definitely an upgrade",2020年10月14日 在美国审核
"It took me a very long time to find a phone on Amazon, coming from boost mobile I WAS VERY SKEPTICAL but I swear this is not a “scam” you will get your phone and mine even worked with boost mobile! It came with a screen protector, sim removal tool, charger, and a box! And it came 3 days early! No complaints from me!!",2020年10月14日 在美国审核
Perfect just perfect.No issues .thank you,2021年6月21日 在美国审核
Couldn't find anything to dislike about this product,2021年6月21日 在美国审核
Beautiful iPhone and great value,2019年9月20日 在美国审核
This is a beautiful iPhone however I had some issues with mine periodically it would freeze up and I even had problems with the rotation at one point it took 10 minutes till I was able to get it upright,2019年9月20日 在美国审核
It’s okay,2022年1月23日 在美国审核
When I first got the phone there were small scratches on it,2022年1月23日 在美国审核
Amazon Refurbished Products are Worth 6 ,2020年6月3日 在美国审核
Amazon refurbished has done it again! I ordered an iPhone 6S years ago from an Amazon refurbished seller,2020年6月3日 在美国审核
Waaayyyy worth it!,2022年5月24日 在美国审核
"Battery life is like new, and there were no cracks or scratches… the speaker had some dust in it but that’s the only thing that sets it apart from a brand new iPhone",2022年5月24日 在美国审核
"Perfect condition, everything works not a disappointment at all!",2020年3月9日 在美国审核
"Love love love this phone!! I was definitely skeptical being I have tried a refurbished phone before and it wouldn’t work but this phone worked perfectly and I have had it for months now and no complaints!! Battery life is great, facial recognition works perfectly and the phone looked brand new, no scratches or anything!! I would highly recommend this phone and company!",2020年3月9日 在美国审核
I love my new phone!,2022年5月12日 在美国审核
I love my iPhone XR! It’s my first new iPhone since the 7 Plus,2022年5月12日 在美国审核
,2020年10月6日 在美国审核
I was a little skeptical about buying this phone because of the negative reviews I saw,2020年10月6日 在美国审核
Hey no problems so far,2022年6月5日 在美国审核
No problems with the phone and it came with a screen protector,2022年6月5日 在美国审核
Will buy again,2020年3月11日 在美国审核
Going to buy another for my sister,2020年3月11日 在美国审核
Love it,2020年2月15日 在美国审核
My 1st iPhone!It was a refurbished phone and came in mint condition,2020年2月15日 在美国审核
So much better than the Samsung Galaxy phones I always got before!The picture quality alone by far is better than the Samsung,2020年2月15日 在美国审核
They are definitely different to operate but not to bad,2020年2月15日 在美国审核
Glad I switched to iPhone!!!,2020年2月15日 在美国审核
Worth it!!,2021年2月23日 在美国审核
Both my husband and I have had this phone for about a month now I ordered the yellow he ordered the red iPhone XR and it works perfectly fine! I was so skeptical at first about buying a phone on Amazon but I’m glad I went head and did it! No regrets here! It’s definitely worth buying a phone on here than paying so much more elsewhere,2021年2月23日 在美国审核
Great phone,2021年1月27日 在美国审核
Works great,2021年1月27日 在美国审核
Phone Looks like new,2020年5月3日 在美国审核
I was really skeptical about buying this but I was pleasantly surprised after I received it,2020年5月3日 在美国审核
Great product,2022年3月10日 在美国审核
Product exactly as described,2022年3月10日 在美国审核
Great Condition/Great Price,2020年2月20日 在美国审核
I’ve had this phone for a little over a month now and I must say that it is absolutely worth every penny,2020年2月20日 在美国审核
Great iphone,2021年4月7日 在美国审核
"Fast shipping and great iPhone, minor scratches and the included a iPhone case with it",2021年4月7日 在美国审核
Great!,2021年6月11日 在美国审核
Love how big it is! Bought if for the hubby for father's day,2021年6月11日 在美国审核
Excellent Phone!,2021年11月6日 在美国审核
This phone is amazing! Excellent features,2021年11月6日 在美国审核
Love it,2020年11月19日 在美国审核
Phones In Exellent Co sit-up ,2020年11月19日 在美国审核
received a near perfect quality phone,2020年6月17日 在美国审核
very happy with the phone I received,2020年6月17日 在美国审核
"Few minor slight scratches, but for the price I'm more than happy with live with it",2020年6月17日 在美国审核
The scratches went away after applying a screen protector,2020年6月17日 在美国审核
Great,2020年10月26日 在美国审核
Excellent phone,2020年10月26日 在美国审核
The most important thing to know is. This is where u need to get ur electronics from!,2019年12月6日 在美国审核
Overall good phone,2022年4月21日 在美国审核
Overall this was a really good purchase,2022年4月21日 在美国审核
iPhones quality and appearance are excellent. Very satisfied with this purchase,2021年3月20日 在美国审核
Both iPhones look pristine,2021年3月20日 在美国审核
Like new,2021年4月29日 在美国审核
Of course it's a good product! Prompt delivery,2021年4月29日 在美国审核
Great iPhone XR,2020年2月18日 在美国审核
"So far I absolutely love my phone! It came fast, it was in great shape looks brand new",2020年2月18日 在美国审核
Pretty great,2022年3月4日 在美国审核
Only comment is that the packaging left me nervous cause it was a box much bigger than the phone and the phone itself was just in bubble wrap,2022年3月4日 在美国审核
Satisfied customer!,2021年3月12日 在美国审核
Phone came in perfect condition and completely UNLOCKED!I am very satisfied with my purchase and I will definitely buy from them again in the future,2021年3月12日 在美国审核
I’ve had a good experience,2020年12月20日 在美国审核
"i was almost scared away by the bad reviews, but i’m glad i ignored them! phone is in perfect condition; it didn’t even have any cosmetic imperfections, which i wasn’t expecting! i looked it up the imei number to make sure it wasn’t stolen because a lot of reviews claimed theirs were, but it came back completely clean! works great with my carrier, no complaints!",2020年12月20日 在美国审核
As advertised,2021年12月6日 在美国审核
As advertised,2021年12月6日 在美国审核
"It is used and there are wear and tear, but it works and so far so good",2021年12月6日 在美国审核
There is a charger and Apple Lightening to USBA cable + screen shield,2021年12月6日 在美国审核
"Nothing fancy, but it's all there",2021年12月6日 在美国审核
Quality purchase,2022年2月28日 在美国审核
"It is a brand new phone! As it states it doesn’t come in an apple box or accessories but I’m in love with my new phone! I’ve been telling everyone about this deal, I even ordered another one for my fiancée",2022年2月28日 在美国审核
Upgraded from a first gen iphone se. My son absolutely loves this iphone xr.,2021年2月17日 在美国审核
Bought this for my 17 year old son to replace his first gen iphone se,2021年2月17日 在美国审核
Perfect!,2019年12月29日 在美国审核
"When you purchase this, you get exactly what you want! It came in perfect condition but one scratch on the screen, but it was very minor and I had to look for it",2019年12月29日 在美国审核
A new phone for a fair price,2021年6月30日 在美国审核
"The phone looks new, no scratches, no worn signs for a very reasonable price and it works just fine; very happy customer",2021年6月30日 在美国审核
keenancarroll,2019年5月19日 在美国审核
En perfectas condiciones con seas leves de uso,2021年3月8日 在美国审核
It's an iPhone XR from Kiss Electronics,2020年3月5日 在美国审核
It's an iPhone XR from Kiss Electronics,2020年3月5日 在美国审核
"Really what more can I say?I purchased mine on Amazon through Kiss Electronics and the phone was in pristine condition, not a single blemish",2020年3月5日 在美国审核
Arrived in 2 days!,2020年3月5日 在美国审核
"Like new condition, fast shipping!",2021年1月23日 在美国审核
This deal was the best price I found on the internet without having a trade-in,2021年1月23日 在美国审核
Love my new phone!,2020年7月17日 在美国审核
I was a little iffy on buying the phone but I needed a new one due to problems with one I had just got and I love this phone! It came about a week earlier than estimated date from Amazon and there is nothing wrong with it,2020年7月17日 在美国审核
AWESOME,2021年12月30日 在美国审核
"This phone came looking brand new!! Absolutely no scratches, 91% battery health, smooth software!! Everything came perfect, I spent all my birthday money on this phone and it was worth it !!",2021年12月30日 在美国审核
100% funcional y sin engaos,2021年12月16日 在美国审核
Great value and phone,2020年12月5日 在美国审核
This was the easiest phone setup ever,2020年12月5日 在美国审核
Great phone!,2020年4月30日 在美国审核
"I was a little skeptical about buying this phone but it’s honestly great! It was fully unlocked , the camera quality is great ,and mine came looking 100% new! Mine has no scratches or marks on it ! Honesty worth it if you’re trying to save money ",2020年4月30日 在美国审核
Worth the money,2021年4月20日 在美国审核
"It’s been a year I am using this phone, so far so good",2021年4月20日 在美国审核
EXCELLENT,2020年8月19日 在美国审核
"Delivered way quicker than the estimated time! Came completely unlocked (just not factory rest), with a screen protector already applied + a charger! It was so nice of them to include that! No scratches or anything else like that",2020年8月19日 在美国审核
"Not a scam, go for it!!! Outstanding purchase!!!",2019年12月26日 在美国审核
my iPhone XR just arrived (a day early) and in less than 15 minutes I was ready to go,2019年12月26日 在美国审核
"The phone is spotless, not a scratch on it",2019年12月26日 在美国审核
"For the price, it’s what you expect!!",2020年3月24日 在美国审核
I was really worried that it wouldn’t work with MetroPCS but all it took was a brand new SIM card and some patience,2020年3月24日 在美国审核
I am happy as hell,2021年4月6日 在美国审核
I have only had the phone for less than a month but the quality is great the battery life is the best I have ever had the face recognition has adapted to my face even with sunglasses I am happy with my phone so far,2021年4月6日 在美国审核
Perfect condition,2022年5月27日 在美国审核
Phone came in perfect condition and works perfectly,2022年5月27日 在美国审核
Great phone,2022年5月24日 在美国审核
Very long battery life,2022年5月24日 在美国审核
Wowed!,2020年7月8日 在美国审核
"Took a chance in ordering a refurbished phone online, and was blown away",2020年7月8日 在美国审核
Very happy with purchase,2020年8月16日 在美国审核
Battery at 94%,2020年8月16日 在美国审核
"Put it immediately into an Otter Box so I don't have to worry about scratches, dents, etc",2020年8月16日 在美国审核
So far I'm happy I saved a lot of $$$ over the Apple factory refurbished,2020年8月16日 在美国审核
Ask me again in 90 days :),2020年8月16日 在美国审核
Great Condition,2022年1月12日 在美国审核
Phone works great no cracks or dings that I can see and black is one of my favorite colors,2022年1月12日 在美国审核
Great value,2020年10月22日 在美国审核
Looks like a brand new phone and battery last like a new phone,2020年10月22日 在美国审核
iPhone XR,2020年1月1日 在美国审核
Really love the new IPhone XR,2020年1月1日 在美国审核
H E L L Yes,2020年9月20日 在美国审核
"I was a bit scriptural at first because I had never bought an IPhone from this person at SUCH a low price but THIS IS AMAZING, I have bought two already, it’s worth the money guys trust me",2020年9月20日 在美国审核
Just like new!,2020年7月15日 在美国审核
Refurbished phone that looked like new! My daughter has had this for a couple of months now and it works like a charm,2020年7月15日 在美国审核
Quick delivery.,2020年2月28日 在美国审核
Very impressed with how quickly this came,2020年2月28日 在美国审核
AWESOME COOL PHONE!,2020年5月14日 在美国审核
This phone is amazing! As an iPhone user since I was 17! This phone rocks and as it may take some getting used to not having a home button it really didn’t take as long as I thought it would and it takes really good quality pictures! Absolutely love it,2020年5月14日 在美国审核
it's functional and not damaged,2021年2月7日 在美国审核
The one I received Looks just as if it were new,2021年2月7日 在美国审核
Excellent value high quality phone I am so happy with purchase! ,2022年2月6日 在美国审核
This phone is like new,2022年2月6日 在美国审核
Satisfied,2022年2月2日 在美国审核
"I was not sure what to expect given some of the reviews, but I have to say I am definitely surprised by the quality that I received",2022年2月2日 在美国审核
So far works great!,2021年4月6日 在美国审核
"Do far great! My son loves it, cane with a case and screen protector too! Can't beat that for the price",2021年4月6日 在美国审核
amazing phone,2021年1月1日 在美国审核
came earlier that expected delivery date,2021年1月1日 在美国审核
no scratches anywhere on phone,2021年1月1日 在美国审核
battery life was at 100%,2021年1月1日 在美国审核
Very Happy Customer,2022年4月16日 在美国审核
Skeptical most definitely but no issues at all,2022年4月16日 在美国审核
Phone looks brand new,2022年4月16日 在美国审核
As Advertised By Seller,2021年12月14日 在美国审核
No complaints,2021年12月14日 在美国审核
Buy it already!,2021年2月17日 在美国审核
"Agonized over this purchase for a week, so glad I bought it",2021年2月17日 在美国审核
Very good phone,2021年11月27日 在美国审核
It arrived fast as you would expect from Amazon,2021年11月27日 在美国审核
Great Purchase,2020年5月13日 在美国审核
Was scared so I waited to write a review I had my phone since 5/120 and put my SIM card it and I have everything on my old phone transfer phone is excellent great purchase recommended,2020年5月13日 在美国审核
100% SATISFIED!!!,2020年3月20日 在美国审核
Nothing to say other than 100% customer satisfaction here! Refurbished phone,2020年3月20日 在美国审核
BRAND NEW CONDITION!!! 100% battery health and the color is so stunning that the pics don’t do it justice! If you’re hesitant to buy because of it being a refurbplease don’t worry about it,2020年3月20日 在美国审核
"Absolutely, Excelent Physical condition. Works A+.",2022年6月6日 在美国审核
Absolutely Everything works as expected,2022年6月6日 在美国审核
Wonderful,2022年3月13日 在美国审核
Outstanding phone for price,2022年3月13日 在美国审核
Great phone great price,2020年12月29日 在美国审核
Looked brand new out of box,2020年12月29日 在美国审核
But it’s worth it,2020年10月3日 在美国审核
Yeah no complaints here~,2021年9月16日 在美国审核
I bought it for my dad and he seems to like it,2021年9月16日 在美国审核
Performs like new,2020年12月25日 在美国审核
I love this phone,2020年12月25日 在美国审核
It looks and performs like new,2020年12月25日 在美国审核
Upgraded from a flip phone and use features like FaceTime all the time,2020年12月25日 在美国审核
Will not be disappointed!! AMAZING,2021年4月11日 在美国审核
Great quality and quick delivery,2021年4月26日 在美国审核
Bought one for me and my fiancé,2021年4月26日 在美国审核
Selecting a mid-range iPhone upgrade,2021年2月15日 在美国审核
First phone without the “home” button,2021年2月15日 在美国审核
Great working phone!,2019年12月28日 在美国审核
Great restored phone,2019年12月28日 在美国审核
Best option if you don’t want to buy new,2021年8月15日 在美国审核
The screen and buttons work perfectly,2021年8月15日 在美国审核
Just like a new phone,2020年7月16日 在美国审核
Arrived early,2020年7月16日 在美国审核
Best purchase,2021年3月28日 在美国审核
"GREAT PHONE, was extremely nervous ordering a phone off of Amazon and I was not disappointed at all! ",2021年3月28日 在美国审核
So far it’s a great iPhone XR,2019年9月1日 在美国审核
It’s is nice phone I didn’t had any wrong with this product,2019年9月1日 在美国审核
But why apple makes small screen size for iPhone XR ???,2019年9月1日 在美国审核
Perfect for me.,2020年12月3日 在美国审核
I upgraded from an iPhone 6s Plus and this phone is amazing! O &amp; M Wireless provided all the information that I needed to successfully transfer my data,2020年12月3日 在美国审核
The tech that you need at a price you can manage,2020年10月23日 在美国审核
Got my renewed iPhone XR about 3 months ago now,2020年10月23日 在美国审核
Better than buying from the store,2021年9月3日 在美国审核
I say this because I only buy my phones on amazon unlocked (and typically refurbished) so already paying less than full price for full quality,2021年9月3日 在美国审核
Not Cracked and Real!,2020年10月19日 在美国审核
"This phone is perfect! Didn’t come to me cracked or even scratched! I even went on the apple website to make sure it was real, and it is!",2020年10月19日 在美国审核
Phone came in perfectly fine and on time.,2022年2月2日 在美国审核
I was very skeptical on ordering this phone but it came in today and looks literally like new ! I didn't even much see a scratch on the phone,2022年2月2日 在美国审核
Great product!,2020年8月18日 在美国审核
"Beside the battery being a little deteriorated at 88% which isn’t bad, I would have thought this was a brand new iPhone",2020年8月18日 在美国审核
Excellent,2020年12月22日 在美国审核
"Bought this for my 15 year old son and it came spotless, as if new",2020年12月22日 在美国审核
We are very pleased and will buy from here again,2020年12月22日 在美国审核
10/10 Recommend this!!,2020年5月21日 在美国审核
"At first I was pretty scared to buy this due to the few bad reviews that I found, but I’m so glad that I still got it!! 10/10 recommend buying this phone! I upgraded from an 6s to an XR and I’ve never been happier! This phone is super fast and the battery is amazing, it’s like going to the Apple store and getting a new one right of the shelf! Completely in love with it, and delivery came right on time with everything needed",2020年5月21日 在美国审核
My grandson is very happy with his phone!,2021年8月15日 在美国审核
We got this phone for my 13 yr old grandson &amp; he is very happy with it!,2021年8月15日 在美国审核
Was what was described,2022年6月25日 在美国审核
Took some time to figure it out but works fine,2022年6月25日 在美国审核
like  brand new,2020年9月10日 在美国审核
Looks and works like brand new,2020年9月10日 在美国审核
Awesome!,2020年4月28日 在美国审核
"Product came early, and was in new condition",2020年4月28日 在美国审核
Fast service and absolutely perfect working phone condition!,2020年2月20日 在美国审核
First of all,2020年2月20日 在美国审核
Perfect,2021年1月29日 在美国审核
Nice case included was a welcome surprise,2021年1月29日 在美国审核
Value,2021年8月13日 在美国审核
Phone had low volume on calls,2021年8月13日 在美国审核
Very impressed,2020年12月6日 在美国审核
I purchased this as a Christmas gift,2020年12月6日 在美国审核
No visible scratches or cracks,2020年12月6日 在美国审核
It’s BRAND NEW,2020年1月31日 在美国审核
You get what you pay for,2020年6月13日 在美国审核
"I will admit, the packaging and presentation wasn’t there and I was scared of receiving a cracking or non-functional iPhone",2020年6月13日 在美国审核
Very satisfied with purchase so far.,2021年8月28日 在美国审核
Everything seems to work like new,2021年8月28日 在美国审核
Pleasantly Surprised,2022年6月12日 在美国审核
"I was leery to buy this phone, but it’s perfect",2022年6月12日 在美国审核
"Nice upgrade, fast phone",2021年2月28日 在美国审核
"I love the bigger screen size, touch screen is flawless",2021年2月28日 在美国审核
Happy customer!,2020年3月1日 在美国审核
Phone came faster than expected,2020年3月1日 在美国审核
Works,2021年3月26日 在美国审核
"Bought this phone for my bf, it looked good and works good",2021年3月26日 在美国审核
Great buy,2021年5月6日 在美国审核
Great phone for the price,2021年5月6日 在美国审核
Bought this for an upgrade to my teenage daughter's phone and she has been very happy,2021年5月6日 在美国审核
Battery life is long and it was in pristine shape,2021年5月6日 在美国审核
Good deal,2021年12月10日 在美国审核
I chose this over a new iPhone,2021年12月10日 在美国审核
Amazing,2021年3月19日 在美国审核
The battery life is good face recognition is Greatand the screen quality is amazing I love this phone so far,2021年3月19日 在美国审核
I'll never buy a brand new phone again,2022年3月11日 在美国审核
"Been 3 months since purchase, and it's perfect still batter life is great, I've had zero issues with this device",2022年3月11日 在美国审核
Awesome Experience,2020年8月2日 在美国审核
I absolutely love this phone,2020年8月2日 在美国审核
Works and looks like New phone,2022年1月3日 在美国审核
Everything was just as started in listing,2022年1月3日 在美国审核
iphone XR,2021年5月13日 在美国审核
She looks really good,2021年5月13日 在美国审核
I have not hooked her up yet but everything seems to look good,2021年5月13日 在美国审核
Great phone,2020年7月22日 在美国审核
I am always a little nervous when buying a used or refurbed phone,2020年7月22日 在美国审核
Great renewed phone,2022年4月20日 在美国审核
Great value for the price and works great,2022年4月20日 在美国审核
Excellent buy,2020年12月4日 在美国审核
I love my phone excellent condition,2020年12月4日 在美国审核
This is my 5th iPhone I purchased on Amazon and everyone has been excellent condition,2020年12月4日 在美国审核
So far so good,2021年2月4日 在美国审核
Just got the phone the volume seem to be lower than my other iPhone and I haven’t had the phone long enough to comment or rate battery life,2021年2月4日 在美国审核
Great buy,2020年8月5日 在美国审核
Was worried after I read reviews of others poor experience,2020年8月5日 在美国审核
Works awesome!,2021年7月17日 在美国审核
Looks brand new and works well,2021年7月17日 在美国审核
Great value for a great smartphone,2020年1月9日 在美国审核
Very happy with the condition of the phone,2020年1月9日 在美国审核
I love the larger screen!,2022年4月10日 在美国审核
"I had a first generation XR a few years ago, this 2nd gen is even better",2022年4月10日 在美国审核
Like getting a new phone,2019年10月24日 在美国审核
This was such a great purchase! I feel like I purchased a new iPhone,2019年10月24日 在美国审核
