Good deal,"I was a bit concerned about buying a ""Renewed"" phone, especially after reading several complaints here about the phone not being truly unlocked, and still bound to a particular cellular service provider. Fortunately, my unit came without any such issues. After three days of digging into software, I couldn't find any info that could help identify the previous service vendor, if there was one. My current provider is Tmobile, and the phone seems to be happy to work on their network without any issues.Speaking of software, the phone came with android 9 ""Pie"" OS preinstalled, as well as the usual Samsung bloatware, but that's it. No vendor-specific apps.The package contained the phone (Snapdragon 845 version), charged to half capacity, a Samsung's charger and a noname USB type C cord. It's the bare minimum sufficient to get the phone up and running. The phone itself shows some evidence of prior usage (for which I am giving it 4 stars instead of 5): the sd/sim card door seems to have been opened at least several times, and there is a couple of microscopic scratches on the back near the fingerprint sensor.Not a deal breaker for sure, just a minor annoyance.Everything the phone is supposed to be doing it is doing with gusto. And yeah, it is still a great device. As a longtime Note user, I can appreciate how much the brand evolved over the years. The upgraded S-Pen is so useful in so many ways, I can't imagine how most people manage to live without it. Maybe Note9 is not as cutting edge as it was a year ago, butit is so well-rounded in terms of features and capabilities that it's hard to find any other phone that's clearly superior to it, even among newer ones.The only thing I really miss is the IR blaster, which was present on some earlier Notes. It seems that all phone manufacturers decided to ditch IR altogether, so I don't really have a choice in this regard.Overall, I am happy with my purchase, especially considering the price.",2019年7月6日 在美国审核,0
I like my new cell very much,"I like th phone,just need th book to learn how to operate lt",2019年10月29日 在美国审核,2
Good but...,"So the device itself seems to be working just fine. When it got here the phone was gross. It had something stuck on it as if someone handed it to a small child with sticky hands then stuck it in the box.It says it comes with a Sim card Key but didn't, no big deal I have extra.It came with a screen protector on which I thought oh hey cool. I'd already ordered new screen protectors and decided to add the new one anyway since this one had a few bubbles. Well it had the screen protector on to cover the pretty decent sized gouge in the screen. Deep enough that when I run my fingernail over it, it catches. So I wasn't happy about that.It was also supposed to be t-mobile phone but when I turned it on it said ATT but a paper said it was unlocked and explained how to reset the phoneso no big deal.Over all I still like this phone I just felt $250 for it's condition was a bit much. Hopefully it continues to work and I don't have any issues with it.",2021年11月5日 在美国审核,0
Like new,I have no complaints. Didn't even know the phone was refurbished,2020年2月8日 在美国审核,2
Looks like new,"Phone, charger and cable, its ok and looks like new.",2021年3月24日 在美国审核,0
100% good,The product is very goodchipping fast and perfect condition,2020年4月22日 在美国审核,0
Excelente,El cargador hace carga lenta,2019年9月20日 在美国审核,2
Note9 refurbished,Refurbished due tobroken screen. New screen doesn't work correctly.,2020年1月2日 在美国审核,0
CALIDAD 100%,"El producto llegó en excelentes condiciones, recomendado",2021年1月28日 在美国审核,0
Perfect Totally worth it,Honestly like new! and worth the money!,2020年1月9日 在美国审核,0
It's great and such a new feel to it.,It's a great product!!,2020年3月7日 在美国审核,2
greay phone,Ihad a note 8 there is a big differnce,2019年7月6日 在美国审核,2
AMAZING PHONE,Amazing phone absolutely loved it,2020年8月28日 在美国审核,2
Arrived like new condition. Love it!!,"Mine is like brand new, just without the original box.<br>Everything included, the pen, charger, usb cable. Love it. Better than expected!</br>",2019年12月4日 在美国审核,0
It WORKS GREAT!,"It looks like it's brand new, is trustable and sold for a good price of $370!",2019年12月7日 在美国审核,0
Horrible condition,"Bought this phone but returned it.I understand that its renewed, but the phone came with visible scratches in multiple places. In addition it wouldn't let me add my own google account so I couldn't access anything on the phone",2019年8月22日 在美国审核,0
Great,I like everything about it,2020年1月27日 在美国审核,2
great battery life,Nice looking with more new features since my note 4,2020年3月18日 在美国审核,0
Amazing phone,Amazing phone in near perfect condition!,2020年12月18日 在美国审核,2
Wonderful phone.,Love everything about this phone so far.,2019年12月31日 在美国审核,2
Galaxy note 9,"I like all the features on Note 9, way faster, nice screen. Up until now 1/12/2019 everything has worked just fine.",2019年1月12日 在美国审核,0
Great phone just didn't work on Sprint.,Did not work on Sprint carrier.,2019年5月6日 在美国审核,0
One Great Phone,It's everything I wanted in a phone and more.,2020年1月2日 在美国审核,2
Great phone,"Love this phone, conditionis great,phone works great, and the price was cheaper than mos",2020年2月8日 在美国审核,0
COUTION LOCKED,"It's a great phone... BUTit was suppose to be unlocked, but came locked to t-mobilethink god that's the carrier I have",2020年4月25日 在美国审核,0
Highly recommended for the price,Very satisfied with purchase,2019年6月7日 在美国审核,0
If you have straight talk wireless this phone is a most have,Works great with straight talk BYOP.,2020年1月8日 在美国审核,0
Top Notch!,As good as it gets!,2019年5月2日 在美国审核,1
"Absolutely love it,best phone ever!!","Nothing to dislike ,I love it",2021年3月30日 在美国审核,2
My New Phone,"Only the camera is a little foggy when I try to use the flash. However, thats not a big problem as it has a night camera node",2019年12月22日 在美国审核,0
So happy,Very good quality for a refurbished phone.I would definitely buy from seller again.,2020年2月8日 在美国审核,2
Awesome phone,Phone came to me in great shape.,2020年1月14日 在美国审核,2
The do everything phone,An amazing phone. You will love it.,2019年6月30日 在美国审核,2
Good phone,This has been a good phone so far.,2020年1月4日 在美国审核,2
"Wonderful phone, wish I had it sooner!","I did not have any problem activating my phone, even after checking the reviews and feedback.I'm really enjoy my new phone!",2020年1月6日 在美国审核,2
Las fotos,Todo está perfecto lo recomiendo,2021年4月20日 在美国审核,2
Bad chargers,"The phone work out great, but the charger is not working properly. It show that it's charging, but the percentage just stay the same.",2019年6月7日 在美国审核,0
Looks and feels BRAND NEW! Came Unlocked and factory restored - Verizon User,"This review should be two fold: one for the Samsung Note 9 and second the quality of the condition of the phone itself from the seller. In the context of it being a used Amazon Renewed Phone, got to say, wow! It has exceeded my expectations on both fronts but most especially the quality of the condition the phone. I haven't detected a single scratch on the screen or edges. Battery life is holding strong - a real improvement from the note 8.Set up was a breeze - just popped my Verizon SIM card from my previous phone (Note 8), signed into google which automatically started downloading all of my apps, media, ect, with all of my custom settings and preferences fully intact, I might add. And bam. Within 30 minutes I was making calls.Now the samsung Note 9. It's an unbelievable phone. A true flag ship - and I couldn't believe it was available at under the $400 price point. I will definitely be doing this from now on - buying 1 year old flag ships on Amazon renewed. It's just an insane bargain for what your getting - one of the best phones ever made, with little to no signs of previous use.5-stars!",2020年3月3日 在美国审核,0
great,"worked perfectly and was super good, legit as if it was brand new",2020年12月20日 在美国审核,2
UPDATED - Almost all aftermarket parts broke within a year,"The phone is what I expected for refurbished. With close examination, I can see one ding around the speakers and four pinprick-sized spots of missing paint on the top and bottom edges. None of these irregularities are noticeable at a distance of a few inches and are completely hidden by the phone case. The stylus had a sticky smudge the size of a baby's pinky nail that cleaned up easily with a micro-fiber cloth and left no permanent marks.The phone itself is an excellent upgrade. I had a Galaxy 7 (not a Note) which worked okay but was dated. I had to install and re-install apps to get them to work correctly, so I upgraded to the Note 9. The battery life is MUCH improved. My old device was dead in less than 8 hours, but the Note 9 has gone 24 hours on a full charge and is only down to 51%.I don't know how much I can add to this review to make it meaningful, but if you were like me and looking to upgrade but is sitting on the fence, go ahead and do it. I saved approximately two hundred dollars by buying refurbished, and my refurbished model is like-new with hard-to-notice scuffs, and it a huge improvement over my old device.UPDATED: 1 Year LaterWithin a year the charging port and the camera failed. I took it into a shop to be repaired, and found that all the part that broke were aftermarket. Now, I knew receiving a phone with aftermarket parts was a possibility, but when they opened the device they found missing screws and clear wear and tear on the internal parts. I like the device and it's functionality, but ultimately I'm paying for repairs that cost 50% of what I actually paid for the device. And, of course, all these issues came up long after the 90-day warranty, but all of it happened within a year.Buyer beware.",2020年8月30日 在美国审核,0
Great phone,Bought this for my daughter she loves it. Only problem is the face recognition sometimes does not work.,2020年3月4日 在美国审核,1
Brand new,"Looks brand new, came with original box, earbuds and charger",2020年5月22日 在美国审核,0
Excellent product,"Excellent product, really appreciate it will buy again",2019年12月15日 在美国审核,2
"Factory unlocked, great phone.",It's a great phone..,2019年12月4日 在美国审核,2
Best Purchase Dollar for Dollar,"I have Metro PCS and I was very interested in buying a device compatible with my service features such as wi-fi calling and caller ID. Not to mention full capabilities to utilize network connectivity.I ordered two other Samsung devices, both International versions and I had issues with both (A50 and A70). Both stopped receiving text messages after a couple of days. Tech support wasn't able to figure it out, I read all the blogs online and concluded that international versions are not 100% compatible, hence why they're cheaper.Then I found this, I was debating between the OnePlus 7 PRO and the S10+, but I also didn't want to spend too much. Then I found this Tmobile Note 9, OnePlus wasn't a challenger due to the lack of micro sd slot. It is unlocked. It is a Tmobile phone. (Tmobile boot up) Pristine condition. (Zero blemishes) Battery works as it should. (I had this phone before brand new). It doesn't include an original Samsung fast charger. This doesn't bother me as I have plenty.For the price it's hands down the best phone you can get, this is a flag ship device. Waterproof, expandable memory, 4k 60fps quality video, super vivid screen. This phone was $1000 brand new just a few months ago. I can't even tell its used! Buy it, you won't regret it.",2019年11月22日 在美国审核,0
Great!,Bought for my husband and he loved it!,2020年1月5日 在美国审核,2
Samsung Galaxy Note 9,It works very good and run fast. I appreciate it for giving me so good smartphone!,2019年1月31日 在美国审核,0
Great phone,It's a great phone and a good price. I have been using it every day a d it doesn't disappoint.,2020年1月12日 在美国审核,0
Better than the older models,"This phone is amazing it charges fast, quick download speed the pen has more uses fan the older models do.",2020年4月4日 在美国审核,0
Samsung Note 9,Item was as described (Unlocked).It works well.Thank you,2020年8月20日 在美国审核,0
Great,Love the phone's,2021年3月25日 在美国审核,2
Phone is like brand new  .,Just received the phone and set it up .Looks brand new .There was no problems connecting to Total Wireless.Had problem with charger it was not the OEM. Contacted the seller (hybrid it) and they immediately tookcare of my problem.Looks like a great purchase.Update : After a few days we realized we were not able to send picture texts or group texts.I got in touch with Total Wireless and they tried to help but finally gave up.I searched and found 5 or 6 APN settings that were supposed to fix the issue.Nothing worked and these functions were important to my wife.The phone was like new and we wanted to keep it.I reset the phone back to factory settings.Contacted Verizon prepaid and they had a special promotion going on.My phone started right up and everything works as it should.I am still giving Hybrid Itfive stars because the phone was just like new and I think that the note 9 is not fully compatible with Total Wireless.,2020年5月2日 在美国审核,0
No warranty,I really like the phones. Almost like new. Just need to be able to purchase a warranty.,2020年3月4日 在美国审核,2
"Great buy, performs like new, but minor cosmetic damage","I bought this product about a month and a half ago. So far I am very happy with my purchase. I upgraded to this phone from a Samsung S7 Active. I was very cautious buying a ""Renewed"" smart phone. However, I was pleasantly surprised.But I want to make clear that the quality of the product could vary from seller to seller as it is not directly sold by Amazon but third party sellers who meet Amazon's specifications. My phone was sold by D'tech Mobile, and therefore your experiences my differ depending on your seller as other reviews suggest some are better than others in terms of quality. But keep in mind Amazon offers a decent 90 return/exchange policy.Anyway, as for the phone cosmetics, this is a used product so I wasn't expecting a pristine phone. The phone had a few small dents on the corners indicating it had been dropped from a short height on occasion. The front and back glass were very clean and mostly free of scratches. There were a few very minor scratches near the edges of the screen that were only really visible if the light hit the phone at the right angle. The S-pen was also in good condition but it was obvious that the previous owner heavily used the pen based on the wear on the writing tip. But the pen was still very usable, and any defect was hardly noticeable. With the case and screen protector on, you wouldn't be able to notice any of these minor flaws. I considered dropping to 4 stars because of this, but reconsidered as it is a used product after all and doesn't affect the overall experience of daily use.Now for the performance quality. The battery life was excellent. Part of the reason I upgraded was due to my previous phone's increasingly poor battery life. The battery life on this phone is excellent even used. I get a full day of heavy use, and two to two and a half days with casual use. The screen of the phone is top notch. The phone overall is very responsive. My previous phone had significant lag between inputs and seeing the action on screen. This phone lacks any such delay. The processor is very fast even with daily use though it is almost 2 generations old now. Side note: the phone is very large. I have large hands with long fingers and have issues reaching all corners of the screen with one hand. Keep that in mind if you have less than average sized hands.Also, several other reviews have claimed that their product was not unlocked. My phone was unlocked and worked on my AT&amp;T network. Keep in mind that this is a GSM phone, and therefore only works with GSM carriers (AT&amp;T and T-Mobile). Verizon and Sprint are CDMA carriers, and it seems most of the reviews that claimed in was not unlocked were for these carriers.TL;DR: Great quality for the price. Don't expect a new product, but rather a product that performs like new. Your experience may differ based on seller.",2020年5月21日 在美国审核,0
"Completely unlocked, just as described!!",Very happy with purchase!!,2020年2月6日 在美国审核,0
El diseo muy lindo,Excelentelo grande las funciones,2020年6月13日 在美国审核,0
Large screen. GREAT!,I am not phone savvy but this phone is easy to figure out.,2019年11月21日 在美国审核,2
Good phone,came with a bit of scratches but good deal compared to the price of refurbished,2020年1月6日 在美国审核,0
BEST  phone EVER! I LOVE IT!!,"I got this for my birthday and was nervous about it, with it being a ""renewed"" and ""refurbished"" product. I am so happy with this phone and love, LOVE, LOVEhow it has the led notification light, it takes amazing night and day light photos, it's super fast and responsive,and a beautiful large screen. I also love the shiny silver color of the phone and it has tons of storage. I'm absolutely in love with it. The battery life is OK, it lasts me about a day and a half. Overall, I am very, very, VERY happy and satisfied with this phone. It's the best phone I have ever owned. I am never upgrading to a newer phone. I'm sticking with this phone/ model for life.",2021年4月20日 在美国审核,0
Need an exchange or refund,Screen unresponsive at times,2019年1月3日 在美国审核,1
Everything is perfect,Everything is in perfect condition. I love it! Definitely will be purchasing more items for self as well as family.,2020年2月14日 在美国审核,2
The item perfect condition,Excelent!!! I’m happy the delivery very fast!!,2020年12月16日 在美国审核,0
"Absolutely great phone, but is still a used phone!","Love my new ""renewed"" Galaxy Note 9 phone, Samsung finally did the Note series right! This phone is fast, has lots of memory,has a large screen, great features and performance,s pen, water resistant,easily expands with up to a 500gb micro sd card.. I've loaded every app I ever wanted into my phones 128 memory and still have 85+ GB. Then I bought a 256gb sd card, (Samsung also),and downloaded another 13gb of Music Cds onto it. Absolutely no lag when scrolling through my CD list. Battery life if also fantastic. So far I've used it all day and all night long and still have 30 to 60 % battery life, at the end of the day.Still not used to the fact that I may not need to bring my charger along with me to work.. The price was great also, but the only reason I'm not giving this 5 stars,is because it is advertised as T mobile GSU, ""renewed"", the phone I received was clearly used, the screen has a few scratches and the back and edges also have scratches and pits. Plus the phone was set to AT&amp;T. I was able to insert my T mobile sim card and T mobile came up fine. The only reference to AT&amp;T was after a restart.The startup symbol appears for a sec and then disappears, with T-mobile logo on top.",2020年1月29日 在美国审核,0
Fastest phone I have ever used on Verizon prepay [4.5 stars],"Crystal clear phone calls, voice to text is the best on this phone out of any phone I have ever owned in my life.<br><br>Blackberry KeyOne can choke on it! I've run with Blackberry for the last few years, they did a replacement upgrade when my phone was lost at the FedEx or UPS warehouse, and let me keep it as a backup when it was recovered. So service seemed great, but recently I had to roll back bc my replacement phone has been breaking down. I transferred everything to my original KeyOne only to discover they never actually repaired the phone when it was in for repair. Neither of these phones ever did voice to text correctly.Years ago, I had a Samsung Note 3, which I loved. It was a durable, high quality phone, that didn't slip through your hands. Only problem is, when networks moved beyond 3G, it became pretty worthless. If there was an upgrade option for wireless networks in phones, then I probably would not have stopped using it before this year.Unlike the Note 3, the Note 9 is a slippery phone, so you need a solid protective case. I bought a stack of cases with the phone to try out and my favorite is the Zizo Bolt Series with detachable belt hook. - Brilliant design and durable enough that I feel safe using this phone with that case.. I'll be doing a youtube video on the cases in a few weeks.. look for Joseph Pahrle to watch it.Overall, I'm just amazed by how fast this phone pulled all my apps in. It had every app from my old phone loaded before I walked in the door of the grocery store down the street. It was the fastest upgrade I have ever had in a smart phone. Absolutely love this phone!/!\ update.. photos are very good, but video stabilization is very weak. If they added 5-axis image stabilization to this phone, then it would be perfect!</br></br>",2020年6月3日 在美国审核,0
As expected,"The phone works great but the pen attached arrived dead on arrival. It is completely non functional. I've already ordered a new one, but I shouldn't have had to. Other than that the phone is what I expect of Samsung. It is clean fast and crystal clear picture.",2019年9月25日 在美国审核,0
Perfect,Everything works good,2021年2月24日 在美国审核,2
Nice,Perfect and nice,2020年3月22日 在美国审核,2
Great Note 9 phone!!!!!!,Really love this phone. So glad that I bought my phone here. Would highly recommend purchasing from this seller.,2019年10月11日 在美国审核,2
Great product,"Very well packaged, no scratches, arrive on time, it come with all the accessories. And it works very well.",2020年2月12日 在美国审核,0
My wife is happy,No dislike the phone works great,2020年12月23日 在美国审核,2
"Been a refurnished cellphone, its seems really well taking care of.",I really like the phone. I took it Metro and did not had any problems on adding the phone on my line.,2019年11月3日 在美国审核,0
Its liked just like New!,"This was the first time that I have not purchased a brand new phone.I could not wait for the box to arrive today.I set up everything in a few mins with my SIM card and the phone was perfect...I was able to use the transfer USB plug that came with the phone.The screen did not have one mark on it, a wall charger, new earbuds , transfer plug.You need your sim to pop in it.I already had a ""Sim Pin"" to use.It only took a few mins to transfers my data from Iphone to Android with the app.I ready did not believe that it would work, but it really did.I have not switched from Iphone to Samsung...Lol.",2019年6月6日 在美国审核,0
mi telefono,muy buen articulo me encata my cell muy bueno,2020年1月4日 在美国审核,2
Amazing phone with value for money.,"Everything was up to the mark, thank you.",2020年2月13日 在美国审核,2
Not disappointed!!!!!,"Very satisfied with phone, would definitely buy from again. It had a few scuffs but nothing major.",2020年4月8日 在美国审核,2
Good clean refurbished device,It was in very good condition,2020年8月19日 在美国审核,0
as promised,Received my phone a day earlier all accessories are original would buy again,2019年2月22日 在美国审核,1
"I love Samsung phones, especially the large face with big print","I like the finger print unlock, sound",2021年1月18日 在美国审核,0
4g doesn't work but I can make phone calls....,"Excited for something new but I feel I was fooled, I thought I ordered the unlocked version but for reason I failed ..I guess. It also came with some knock off charge brick and what I can assume to be knock off cable. But I tried to remain optimistic and go to set up phone and hear the t mobile chime, this was upsetting but again in a negative world I strive for positivity. So I continue thesetup things are looking good I’m feeling good, I make a call it works so no problem I can deal with the bloat ware. Wasn’t till I left my house risking my life to shop for groceries that I notice there’s no data...like at all! I just bought flagship noise canceling true wireless ear pods from Sony to block out Walmart with music. Suddenly that charge brick started to anger me again. Just give me a replacement fully unlocked (Renewed) note 9 with the right charge brick and cable please. It only gives me the option for return and refund I don’t want a refund.",2020年5月13日 在美国审核,1
Bueno,Llego muy bien gracias,2021年2月22日 在美国审核,2
Exelente servicio en todo,Muy buena calidad de teléfono,2020年8月5日 在美国审核,0
Reliable seller,Cellphone came excellent condition.,2020年10月8日 在美国审核,0
note 9,So happy with it better than I thought,2020年9月24日 在美国审核,2
Almost like new,Small circle on screen that requires extra pressure to register contact.,2019年12月16日 在美国审核,1
Happy,"Hasta ahorita está Genial, me encanta",2019年9月12日 在美国审核,2
From a note4 to a note9. Everything.,The note 9 is a great phone. I didn't know that I would like but very impress with it. The pic isSuper great. I pick a winner this time. Thanks,2019年1月12日 在美国审核,0
