Galaxy note9 great price,The phone is really durable and it is a total upgrade from my note 4.The only thing is your company should send galaxy charges with the phone. The charger you sent doesn't work. I had to send up buying them separately,2020年12月15日 在美国审核,0
perfect after some wait,"After 3 phones from different seller this one was perfect, factory unlock N960U1, not extra stuff it even upgraded over Wi-Fi before I got the new sim card, the S-pen connect 60% of the time but hey is a use phone.",2021年1月10日 在美国审核,0
Super clean phone and it works great.,I was looking for an upgrade from my Motorola G7 Supra and the Note 9 is just that The screen quality is beautiful as are the picture and video quality. Phone is fast with plenty of storage.So far so good. I'm happy with this phone and I feel lucky I got it.,2020年6月24日 在美国审核,1
"Wow, excellent phone","I'm always a little worried when I buy a non-new product, but with Amazon's return policy I took a chance on this phone for my wife for Christmas. The phone looks brand new, I have no complaints and the price was outstanding. My wife loves her new phone. Will buy again from this seller.",2020年1月5日 在美国审核,2
"Samsung Note 9, ""renewed"" but perfect.","I'm not one who needs ""the latest"" thing. It was, however, time for a new (or, new to me) phone, but I could not justify spending $1,000 or more. This Note 9 is terrific. I love the larger screen, ""S-pen"" feature, extended battery life, and high quality camera.Being that the Note 10 and now Note 20 are out, and this particular phone was ""renewed,"" I paid less than $400. Totally worth it.",2020年8月14日 在美国审核,0
Works perfectly for me highly recommend if your on a budget.,Although this phone is over 4 years old I have to say it still works like a new flagship phone the fingerprint reader is among the best ones I've ever used. Would buy again and mine did come unlocked as requested.,2021年4月19日 在美国审核,0
Great phone for great price.,Seller chubbiestech was great! Product like new. Generic charger and power brick but a non issue because I have oem on hand already. The seller shipped order very fast. Everything works well so far! Can't believe I got this phone for such a great price.,2020年5月2日 在美国审核,2
Good buy. Great vendor,Very nice phone even in 2020 got excellent service from the vendor. Im very pleased.,2021年1月8日 在美国审核,2
Great purchase!,"Was super uneasy about buying this because of some reviews saying they got theirs locked or scratched but was super happy I decided to make the purchase. This phone looks brand new! Not a since scratch, heck it didn’t even have a single smear on it! Also came With charger. Great quality! Oh! And it arrived earlier than posted.",2022年3月30日 在美国审核,2
Greatest phone I had,I loved that phone! Sadly a person stoled it from my backyard table. An offer up customer. BewareThank you,2021年11月30日 在美国审核,2
So far so good,Had the phone for about a week now and so far so good. Phone looked amazing. Not a scratch. Very nice quality. The charger that came with phone was some off brand and cheap but I went and bought a better one and no issues. Will update if issues arise!,2020年4月28日 在美国审核,2
Like New Condition,We bought two Samsung Note 9 (unlocked) Phones and they arrived in New condition in my view. I have used them for one month now with no problems to note at all.Come complete with charger and stylus pen.I would purchase again.,2020年6月23日 在美国审核,2
good deal,Great used product. Zero complaints. Can't tell its used and hooked up to straight talk without any issues.,2020年10月3日 在美国审核,2
Samsung Note 9,"Will definitely purchase more phones from hybrid IT.I purchased a 128 GB Samsung Note 9 for my wife and I was apprehensive about getting it since some reviews I read, people complained that their phones were scratched, were in bad shaper wouldn’t work with their service provider.After getting the phone I inspected it for any defects and was shocked to find that the phone was brand new not even one scratch The pen and charger were also new and no other service provider name showed up when you power the phone on. It works like a charm with our provider MetroPCS.I’ll be getting one for my self next from this seller.",2020年5月23日 在美国审核,2
The definitive Android,"I bought this phone used for half off retail price, and at that value it's a steal. Does everything you could want in an Android phone. One UI has made the phone age with grace, and I will likely hold onto the phone for 12-18 months. Highly recommend if you aren't into the notch trends in current gen smartphones.",2019年11月2日 在美国审核,0
Awesome,"Definitely still worth more than 700 and up. I haven't played with power-saving functions since receiving it, but I have to force it to die because its low by bedtime haha. Been studying the fone for days and still haven't learned everything (that fact alone - in love). I know I'm late on this fone but it's still in league with apple's next release (quote me from this day haha). Condition is like new. Delivery was properly done. Verizon unlocked fresh out the box, but the new One UI software update changed the internal functions to my current fone-carrier automatically, surprisingly.",2019年5月25日 在美国审核,1
Looks and works as expected..,"It's truly unlocked, tried both GSM and cdma servicesand checks out.. only gripe I have is the fast charge power brick is defectivebut I planned on buying a wireless charger anyhow so I guess it is what it is.. Phones immaculateand fully functional, love it. Bought from D'Tech.",2019年7月13日 在美国审核,2
1st time buyer / Satisfied,"Samsung 9 Galaxy Note! Arrived on time.Unlocked,no issues get it activated @ Tmobile.Only small issue-- sim card holder was hard to slide in like something was blocking it, but Tmobile rep got it after working with it.",2021年3月24日 在美国审核,0
Like new,The smartphone looks like new and works great. It’s fully unlocked. I enjoyed my experience and will definitely purchase refurbished items from this seller again!,2021年4月18日 在美国审核,2
Stunning!,Great upgrade from Galaxy 7 Edge. The phone was perfect thanks to RE-CELL! Works perfectly with VERIZON. Stylus function is awesome - the display is cutting edge - and I saved hundreds from buying new! Amazing!!,2019年10月4日 在美国审核,1
Love it,I was kinda skeptical about Amazon renewed after returning my previous phone. This Note 9 came practically brand new it had a few scratches on the screen but they aren't noticeable. It is exactly what I wanted and half the price since I'm on prepaid. It works great with at&amp;t,2019年12月25日 在美国审核,2
Phone works almost flawlessly,Phone arrived as described.. hooked up to metro by tmobile with out any trouble.. has worked fine.Update.. phone was "refurbished "the microphone doesn't work properly in normal call mode.. works fine in speaker phone mode. Otherwise still good phone.. need hands-free,2020年6月10日 在美国审核,0
Exceeded my expectations,This thing is flipping amazing. Especially compared to the iPhone 7 I replaced. If your a highly industrial type who needs to take quick notes and you don't wanna spend 1000$ on the latest and greatest note I'd recommend this.,2019年12月21日 在美国审核,1
"Note 9 is great, but...","As a product, the galaxy Note 9 is a beast, great battery life, great camera the list goes on. I can't say enough about it.Now, as far as Amazon ""renewed"" Note 9 I was disappointed. I can say I've had a long stretch of good luck with my online purchases: I never received a product I wasn't at least reasonably happy with. I knew my time would one day come, and it did on this purchase, my Note 9 came with a bad main speaker (there's two), it sounds like when a speaker is busted.I don't think this will be the case for all of the ""Renewed"" ones of course, but for $400 I only expect minor cosmetic wear not a bad phone.It did come with original Samsung box and accessories, including fast charger.",2020年1月16日 在美国审核,0
It is a really great buy,I am very happy with this purchaseLike everybody else I didn't really want to purchase a used Samsung note 9 When I got the Samsung note 9 it came unlocked and looked brand new itmay not have came with the headphones or its original charger but that's OK the phone was in mint condition and works perfectly one of the best use buys I ever had I love this note 9 i love it,2019年11月28日 在美国审核,2
exactly as described,The note 9 is one of my favorites in the Galaxy series. It is durable and dependable with great graphics and functions.,2022年2月17日 在美国审核,1
No complaints,"I got this phone few days ago,I inserted my sim card and immediately started working without any problem, my carrieris Cricket. Is working perfectly I love it. If you use the phone most of the day like me you would have to charge the batteryat some point during the day.",2021年2月19日 在美国审核,2
Arrived Unlocked!,"Bought the phone about 2 weeks ago. Great condition, minor surface scratch on the back, which was noted as possible by the description. There is a break in the lens over a corner of the LED flash/light and corner of a sensor. For me, nothing worth sending it back.Good battery life, I wouldn't say brand new but definitely not far off.Everything works, stylus, finger print security, camera and it did arrived unlocked and I was able to use my Straight Talk sim.",2020年4月10日 在美国审核,0
LOVE IT,I was a bit cautious about purchasing a phone on Amazon because I'm used to going in person to get a new phone. I was very impressed with the general quality of the phone when I received it. The phone was as described in the description below. I was able to activate the phone with a carrier of my chosing without any issues at all. Overall I love the phone and its great features.,2018年12月18日 在美国审核,2
Worked like a charm!,This Note 9 is the second refurbished phone I have bought from Amazon. It worked right out of the box. The charger was not a Samsung brand but fast charged with no issue. Setup was easy but we did need to get a new nano sim card as her old phone was a mini sim. She's had it a few months now and still loves it.,2019年7月3日 在美国审核,2
Super Great Buy and excellent customer service,"I recently purchased 2 Samsung Note 9 (renewed) from SmoDy Renewed. They were both unlocked andin excellent condition. They were nicely packaged and you would not even know they were renewed. The battery life was great and the phones are working perfectly. The customer service was also wonderful. The item arrived in 2 days as promised. I asked for a more detailed invoice than that which Amazon provided. SmoDY very nice on the phone and responded without hesitation. This was a great deal for what may be the best cell phone of 2018. The Galaxy Note 9 lives up to it's expectations with a hugh battery, large screen, generous storage and a more useful S pen.",2019年9月30日 在美国审核,2
Awesome price awesome phone,"Phone was absolutely flawless, a few chips here and there but barely noticeable. Looks like new and I can't complain. Looking at the bad reviews, most were about the phone not coming with earphones or the original charger, or even being locked. But all of this is specified if you know how to read. I honestly can't complain my phone is like new and I love it.",2019年12月18日 在美国审核,0
The Galaxy Note 9 looked brand new,"If it was not for the fact that I know that the phone was a Samsung Galaxy Note 9, 128GB, Ocean Blue - T-Mobile (Renewed). Than, I could not have believed that it wasn't new. I also had no problem getting it activated. The face recognition as well as the finger print reader works perfect. I feel that it was money well spent. I am very pleased with this product and the company.",2022年2月11日 在美国审核,1
The phone I received was an excellent condition with no scratches on it at all.,I received the phone and it was in perfect condition. The fingerprint reader worked very good and so did the face recognization. I thought the battery wasn't going to hold the charge but after I charge it up again today it has gone down very slow. I would buy this phone again.,2021年1月22日 在美国审核,0
Very satisfied.,"I've had this for a few months now, and it is performing beautifully. Great battery life, and incredible pictures. Being able to snap photos with the stylus is so much better than using the timer.",2019年10月22日 在美国审核,1
Would be great if battery didn't drain so fast,The phone is working great only issue I have is with the battery life based on reviews and stuff that I've seen my battery is draining way too fast,2020年7月10日 在美国审核,0
Decent phone in good condition,A great upgrade from the Galaxy S8 plus. So far I am very happy with my purchase But they could have included a user's manual With the phone. Phone was in like new condition. Came with a plug and cable only. It was much cheaper buying online thenFinding a similar phone in the stores. Saving about a $100 . Now we'll be looking for a protective case and screen cover,2019年11月23日 在美国审核,0
Looks and works brand new,I am so happy I bought a samsung refurbished Note 9 phone for 30% of the price of a new phone.I cant tell any difference between this and a brand new phone.Everything worked perfect straight out of the box.Its fantastic and I would never buy a brand new phone again.Thank you Samsung and Amazon,2020年6月15日 在美国审核,2
I'm glad I purchased this.,"Not much to say except, if you're hell-bent on keeping your earphone jack, there won't be a better phone than this one.",2021年8月2日 在美国审核,0
The best phone I have ever had,All my cell phone connectivity and performance issues were gone after I had bought this phone. I bought it used and have been using daily for more then a year with no single issue.,2020年12月18日 在美国审核,0
Same as new,This phone is really nice. Looks and acts brand new. It figures that I would break my previous note 9 a few days after paying it off. Really happy with this purchase.,2021年1月2日 在美国审核,2
Excellent purchase,"Fast shipment ,worked straight out the box, easy setup and transfer, excellent condition.I'm with xfinity and it connected with my sims card from my note 8 without any issues",2022年2月3日 在美国审核,1
Works really good. No complaints yet,I was scared to buy a phone for Amazon. But this phone is great. I got the fully unlocked version (lavender) and it worked great with my boost mobile account. I find the space part amazing on my old phone I would always have to delete my apps and redownload for space. Glad I don't have that problem no more.,2020年9月1日 在美国审核,1
Great phone,I have to say I was nervous when I first made this purchase but the phone is great. No noticable scratches or damage. So far it operates just fine. I would recommend this to anyone who doesn't want to spend over a thousand on a new phone.,2020年4月14日 在美国审核,2
Best phone evaaa,I had the pixel xl 1st generation by Google and absolutely loved it....until it would no longer update forcing me to retire it.I looked and looked for one that was even remotely close to that and lemme tell ya folks this is it!!! I'm having to get use to all the Samsung apps rather than Google but everything else is great!! Can't beat the price either!! I would buy this phone again hands down,2021年3月5日 在美国审核,0
bomb phone bomb price don't let the negative comment scare you away,"Phone is what I wanted,i ordered the Verizon phone.. and that is what I received.It looks brand new, battery percent above 90. And I just awapped the sims and set it up myself.",2020年8月27日 在美国审核,2
easy to use with any app,"great phone. hard to sense some letters at first like the "" a"" but then in a few days worked great, the pen comes in real handy no need for a note pad.",2021年1月24日 在美国审核,0
Absolutely LOVE this phone,"Long battery life, easy to use, love the large screen.Lots of special features with the Galaxy Note9. Highly recommend this phone...it was refurbished but it works like brand new.I got the phone I wanted and saved hundreds by buying refurbished",2022年4月11日 在美国审核,0
"What are you waiting for, buy it already.  Highly recommended!!","Bought a blue one an early birthday gift for my hubby, I got myself the purple one. He / we love it. We both upgraded from s8 to note 9 and he is still excited about it a week later. He has his on STRAIGHT TALK all he had to do was switch the sim and I have mine on VERIZON PREPAID,all i did was switch the sim as well. Phones are clean no stratches, blemishes or dents. Everything works properly and have not had any problems.",2020年2月5日 在美国审核,2
Outstanding customer service!,Got this phone just as promised!Phone worked just as promised and was unlocked and DOES work on straighttalk without ANY issues whatsoever!I had a question and emailed the seller on Sunday evening and got an immediate to my question!That is customer service!!Thank you so much and I will use this seller again!,2019年6月3日 在美国审核,2
Note 9,"The phone was received in good condition, and works well at this stage. I am satisfied with the purchase.",2021年10月13日 在美国审核,2
Perfection,recieved my phone today and I am very Pleased to report it looks &amp; functions just like new! I will update if anything changes. It is factory unlocked as stated &amp; I had no issues putting my straighttalk sim card in.It came with a new samsung charger.,2019年1月5日 在美国审核,2
Battery saver.,When the battery is low you can put on battery saver until you can get back to a charger. Holds for over 1 1/2 hrs.Easy to use. love the note feature. Just pull out the pen and start writing. BT feature for my Dexcom diabetic CGM.,2020年3月6日 在美国审核,0
"2 unlocked phones, great condition!","Bought two phones for my partner and I, both in great condition, came with the same chargers, unlocked. I have Consumer Cemlular through ATT and partner has Verizon.Dropped multiple times by both of us before our cases arrived, back bottom corner was cracked when slipped out of pocket onto concrete- pretty durable but not perfect, especially with phones so big now.",2018年12月7日 在美国审核,0
Good Deal,"Got my order next day, was surprised. Phones are really nice. Wish getting service was so easy, but that's me not the phone. I'm too old and not too techie lol",2021年3月31日 在美国审核,2
I bought this phone not a single issue,The battery life on this phone is ungodly it is incredible I love this phone I literally had no issues with it its speed is incredible I'm almost certain there will be no issues with it the display to be honest had some very unnoticeable scratches,2019年12月19日 在美国审核,1
Mejor... imposible,"Este es el segundo note 9 reacondicionado que compro en Amazon y no tengo ninguna queja. El rendimiento y funcionalidad de este dispositivo es inmejorable. Después de varios meses usándolo, estoy más que satisfecha y feliz con mi teléfono.",2022年2月22日 在美国审核,2
Great phone,"Has the best battery life any phone I've ever had. No scratches, no damage. Really good phone for a great price.",2020年7月17日 在美国审核,2
Great Phone!!!!,If your buying in 2021 don't stress. Updates are amazing. Easy start up. Mine came carrier unlocked like said in description. Clean phone with no scratches. An awesome Bluetooth S Pen ready for you in the phone. Such a good buy.,2021年7月18日 在美国审核,1
Unlocked and compatible with Verizon,"I love this phone! So many features, storage and battery life. The only thing that I don't care for too much is the front camera. I had no issues switching to the phone from my iPhone just put in my sim card and followed prompts",2020年2月23日 在美国审核,0
Charger that came with got EXTREMELY hot,"I love almost everything! Lol. The charge on the battery doesn't last as long as my previous phone which was a Samsung S8 Active, and the charger that came with the phone got so hot in nearly burned my hand. Using a Samsung charger I already had and everything is working fine. Very VERY pleased with my purchase.",2021年3月30日 在美国审核,0
Unlocked like new,"I was really scare about buying a used phone but honestly best decision ever! And completely unlocked almost new, didn't have any scratches or damaged.Completely in love",2020年11月18日 在美国审核,2
Best phone I've ever owned,"High quality sound, picture and display. I firmly believe that the quality of the Note 9 has improved the quality of my Cricket phone service.I have fewer dead zones and faster internet service.",2019年8月8日 在美国审核,1
Great buy. Love it.,"There was no way to tell this phone was previously used. It was in perfect condition and so far, works perfectly.",2021年6月4日 在美国审核,2
La batería se descarga demasiado rapido,Todo lo demás funciona en perfectas condiciones.,2022年3月31日 在美国审核,2
Works and still works.,Came with ~90% health battery. Not bad.,2022年6月23日 在美国审核,2
Awesome purchase!,"Awesome purchase! Came unlocked, inserted my tmobile sim card to see if it would work and it works perfectly fine! Bought it for my wife and we went to metropcs to activate and open her an account and it was all a success! Read so many bad reviews but I guess majority of those people just need to read the descriptions more carefully!",2019年11月26日 在美国审核,2
"AT&amp;T Unlocked, NOT fully unlocked!","Great phone, tons of features,I'm sure I'll love it. Just not impressed that seller claimed its fully unlocked when it is an att phone.",2021年3月27日 在美国审核,1
Best phone I have ever owned,I love this phone battery life is amazing can truly last all day on a charge. May need two if you use it heavy. This phone will not disappoint.Make sure to buy it refurbished from hybrid IT. They send you excellent quality!,2020年6月26日 在美国审核,1
Flawless product even a year later :),Purchased over a year ago. Phone arrived with an Amazon charging block and cable. I Followed the instructions to activate my phone with Verizon and my new phone was easily activated. Cosmetically flawless back and front. The phone still holds a good charge and runs quickly when switching through apps. Fast charging still works with the fast charging blocks(something I've had trouble with Notes i have had in the past). Overall a good experience :),2021年1月15日 在美国审核,0
Phone was in mint condition.,"I bought this phone from CPRTX . It honestly looked like a brand new phone I could find no flaws at all. It also came with a Samsung fast charge plug and not some cheap generic which was nice. It didn'tcome with headphones, but that was expected. I have now used if for a few weeks and I am extremely happy with this purchase. I saved hundreds of dollars for basically a brand new phone.",2019年12月17日 在美国审核,2
Great Phone,Bought this to replace a galaxy Note 4.This was the right one to buy.Works great and I love the wireless charging feature.,2021年4月16日 在美国审核,1
Exactly like they advertised,"Note 9, replacement for my half broken screen.I love it, thank you!!",2021年12月31日 在美国审核,0
Easy activation and transfer.,I got this for my fiance for Christmas to replace his 6 year old phone. I had a Note 9 and figured it would be easy to help him learn to use it. Much better battery life than Note 8.I saw comments that people had trouble activating this phone but we had no problem at all with AT&amp;T setting it up. It took 10 minutes and his calls were already coming through on his new phone. It arrived well packed and on time. A good experience.,2020年2月4日 在美国审核,2
Best value for the phone,"When I purchased this, I was afraid when I see refurbished but when it came, it look new, no scratch on screen or corners. It's like someone open the box and said no and closs it up",2019年1月18日 在美国审核,2
Fabulous,"It came in early, and works perfectly with Straight Talk. Just put your sim card in and that is it.The device looks perfect just like new and work every well . I am very happy with my choice great device and price. ",2020年3月19日 在美国审核,2
Great cell phone and affordable,The phone has an iris recognition that is excellent.It's easy to activate.I love this phone. Lots of features and space on my phone. Switching data from old phone to current phone was a breeze. The picture quality is awesome too.,2020年5月20日 在美国审核,1
Works like new.,"So far so good. I am using it for 2 weeks now and the phone is in good conditions and works like new.I was a bit worried before ordering the phone but I contacted the seller before buying and got all my queries answered.This is a renewed phone, but still there were no scratches and battery life too is good. The phone is unlocked and I didn't require any tech support to get it working.I am satisfied with the purchase till now.",2019年12月16日 在美国审核,2
Phone is unlocked,Phone is unlocked / it came with Verizon logo on screen and some Verizon apps I took it to AT&amp;T they took my card in it did something on the computer and it worked it said not a Verizon card about six hours later I got a notice from AT&amp;T saying that all Verizon logo and apps are going to be erased and AT&amp;T logo and apps will be be installedSo apparently this is how an unlocked phone works,2019年5月19日 在美国审核,0
