Renewed/Refurbished is the way to go,"Verizon Customer. Phone works perfectly fine. Not a single flaw on it and for a fraction of the price. This is why I will always by refurbished/renewed phones. I'll never pay the outrageous prices of a full-price phone.As for the phone itself, if i could change one thing, it would be the location of the fingerprint reader. Just feels weird having it on the back (and next to the camera). I previously used a S7 prior so perhaps it's just an adjustment.",2019年7月20日 在美国审核,0
research SELLER when buying renewed device!,"Amazon Renewed might fulfill the order, but the seller is who you need to pay attention to if you want to buy a refurbished product. CR Daily Deals is the seller to buy from! Item as described from seller - it is CARRIER unlocked (T-Mobile) not factory unlocked, but it IS unlocked! I have had this refurbished phone for a couple of weeks and it works nearly like new! The only weird thing is it takes random screenshots occasionally, but so what? S-pen connects easily and works great. I would do business with CR Daily Deals again.",2020年1月14日 在美国审核,0
Will work with Boost Mobile,Will work with boost. Just call and give them the phone info and they will make it work for you.Took 10 mins,2020年9月15日 在美国审核,0
Missing and faulty accessories,"I received the Note 9 today.Faulty chargerNo headphonesNo wireless penThe only thing working is the phone itself.Is this what you're providing to your customers!!!! , faulty stuff and missing objects!!It's my first time to pay for a phone with no accessories,!!! this reseller is totally a fraud!!!!Do not buy from ""Breed""Totally not trusted",2020年2月4日 在美国审核,0
NOT A VERIZON PHONE. FRAUDULENT.,Fraudulent listing. Listed as Verizon but it is not a Verizon phone. Worked ok for 5 months now will constantly miss calls and drop calls even after replacing sim card.Verizon said they can't/won't do anything since it wasn't bought from them.Return window is only 90 days so Amazon has stuck me with a $400 phone without a known carrier.,2020年7月20日 在美国审核,0
It's amazing but stylus came cracked.,"I absolutely love this phone, it has an amazing fingerprint reader, an amazing display, everything works amazingly. I've had one issue, it came with a cracked stylus, it hasn't been that much of an issue been as how I don't use it much, but I would have been happy with a good stylus. Overall it is an amazing product, no issues with activation or sim card. I think it is one houndred percent worth the money if your looking for a new phone.",2020年6月3日 在美国审核,0
Galaxy Note 9 is one of the best purchases I've made,This item arrived more quickly than expected and was everything I wanted without the burden of a new price.This is a refurbished model but looks and performs like new.Battery life seems much better than my Galaxy 8 even with the larger and better screen.I read a lot of complaints that these didn't come with the SD/SIM card tool but mine did.I've only had it for a week but I'm loving everything about it.,2020年1月6日 在美国审核,0
garbage,"Phone is flashed and it sucks. Constantly freezing,buttons don't work unless press hard..compete garbage without spell check you would have problems even spelling.Better buy new these aren't worth buying",2020年9月22日 在美国审核,1
Nice phone!!,"Fast shipping!! Nice phone!! The only complaint i have is that I didn't get the s pen with it. It said t mobile on the box but it said Verizon when I turned on the phone,, popped in my sim card restarted it like it said and it works fine with at&amp;t.. thanks!!",2021年3月27日 在美国审核,0
Could not send pictures.,"I really liked this phone but could not get it to send pictures, I could receive them but not send them everything else worked fine. I contacted my phone carrier tried several things through them but still could not send pictures. Like a said a great looking phone but the main reason I got it was for the picture quality which I need for work.",2020年2月22日 在美国审核,1
crack in the screen,I was ready to start setting this phone and when I took off the plastic I notice a crack on the screen. I also turned on and it was T mobile not AT&amp;T as it said in the description. I'm returning this thing.,2019年12月10日 在美国审核,0
Purchased and then 8mons later can't hols a call,"Very disappointed. Bought this phone as a renewed product. 8 mons later I can't hold a call more than 2min. Nope, didn't purchase the warranty.Yes, I am sorry. Yes, I get all software upgrades automatically.",2021年8月7日 在美国审核,1
"So far so good, working good","So far so good, battery holds charge for a while,my Galaxy note 9 was used,but it doesn't show signs of used before it looks like new, package safe,fast delivery,the first time I turn it on the first screen show the Verizon logo,I thought it was not going to work with T-Mobile but so far it's been working just fine,I can't give 5 stars because nothing is perfect in this life",2020年6月2日 在美国审核,0
Great phone for the money,"Basically received a brand new Note 9. 20 Total battery cycles and phone looked perfect. For a bit over 400 dollars I cannot complain at all.Edit: Phone had been submerged now twice. Once in fresh water and once and salt water with no issues at all. I pretty much assumed being a secondhand phone this thing would have a replacement of some sort that would kill the water resistants, but thankfully that seemingly is not the case.Honestly. Thank you phone vendor. Best phone I have ever owned.",2019年12月20日 在美国审核,0
Great,"had it for 6 weeks now.LUV it !!it is a long way from the note 3 it replaced.Battery life is incredible.the fingerprint reader is wonderful, many of the apps i use also use the fingerprint reader.",2019年9月29日 在美国审核,0
Elegant,Really sexy phone..Note 9 with Verizon is best i ever had..,2021年12月20日 在美国审核,0
Pleasantly surprised,Pleasantly surprised. Looks great. Works great (granted it is only day 2). Only downside is picture with pen is misleading cause mine didn'tcome with one. But reading the description it doesn't mention that it does.Phone came and 5 minutes later I was up and running.Will order from seller again.Shipping was timely.,2020年12月9日 在美国审核,0
"Good phone, bad refurb","Worked well overall, great phone. The one I received had microphone issues that I didn't catch till after I switched it to my primary phone, caused major issues in the end. Bad refurbishment check.",2021年9月21日 在美国审核,1
Perfect not a single problem,"This phone is perfect (I'm using it to type this review btw), battery, condition, price,shipping just everything about my experience was flawless. It came in two days early and came with a fast charger(block and c cable) headphones and a sim tool. It's been about a week so I'm pretty confident I've checked it out enough and won't need to update this review fyi.",2020年1月13日 在美国审核,0
Great ! - EDGE CELLULAR's Note 9 is Renewed but "Almost New","EDGE CELLULAR and its Samsung Note 9 unlocked (in ""Renewed"" condition) are both EXCELLENT.The Note 9 I received appears NEW, except for a noticeable scratch on the rear (which my phone case obscures).I use VERIZON and the Note 9 works smoothly, with good battery life.I'm continuing to check that the phone's functions all work.So far so good.Edge Cellular deserves its Top Seller rating !",2019年12月6日 在美国审核,0
"Great Device, with two minus","So purchased this phone on 8/21/2020,Its a great upgrade from my S8+, better battery, camera, ram, processes, and already upgraded to android 10 and Samsung UI 2.0 right out of the box, and soon UI 2.5 when released ""Showing that Samsung will support the Note 9 and the S9 and 9+ for those that are wondering for one more upgrade.The one came with everything that was mention acharging cable and brick and a preinstalled screen protector.Cosmetically the phone back and front glass looks brand new, but the side aluminum railing looks worn especially near the charge port and one corner which made me think that maybe phone was dropped at one point previously ""Reason i am giving it a 4 starts a little worn in those charge ports and i would give a 5 but it has significant paint missing near the charge port""Phone was a UNLOCKED model which many people complained about, which a lot of people complained they did not receive make sure you choose fully unlocked not GSM, or any of the carrier and you wont have that issue that many gave a bad review on.i do wish that it did come with the needle extractor for the note pin ""because that is i believe an important feature to have ""another reason i gave it a 4 stars"" now it not coming with any headphones i am ok with because refurbished headphones sounds bad lol.Butall in all i do think its worth the 350-400$ price tag. i mean it is a refurbished phone through amazon after all. If you want refurbished that looks brand new and gets everything go to Samsung web page and pay the extra 120$ if you want, but for most people this is a good price to quality for what you are getting..i would recommend getting this but remember the cons i gave which is the aluminum rails can look worn like mine where the paint is missing ""mine is near the charge port and one of the corners and you do not get the Samsung extraction tool for the pin to remove the tip."" Other then that its a great phone to get in my opinion, those two minus are the reason i gave it 4 stars and not 5.",2020年8月24日 在美国审核,1
El celular  no es de Tmobile es de Sprint ,"Hola el teléfono llego ayer y esta en perfecta condiciones físicamentesi te fijas en lo que dice el celular verás que dice que es un celular de Tmobile pero desgraciadamenteno es este teléfono le pertenece a Sprint y no esta bloqueado pero tiene un cosa instalada que cuando resetea o apagas el celular te aparece no te deja registrar al 100 tu compaía hay que ir las configuraciones donde esta el apps y hacer un ajustes para quitarlo temporario porque no se puede quitar por completo eso me molesta mucho mucho nose que hacer porque este es un regalo de mis hijos para mi porque fue mi cumple de resto el teléfono esta en excelentes condiciones, nose que hacersi fuera de tmobeli sería perfecto!!",2020年4月26日 在美国审核,1
Great phone.,Everything was working fine except for the Bluetooth. It kept forgetting my Bluetooth devices that I paired. My entire day/week is dependent upon Bluetooth. I paid eight hundred bucks plus insurance from some company/such for this to not happen. I have begun the return process as of this review.,2019年7月14日 在美国审核,0
Very happy customer,This phone is awesome! I love it. One tiny scratch on corner can only be seen if looking hard.I have it in a case anyway. I have been having trouble with charging but I'm pretty sure it's there charger I was sent with the phone and not the actual phone.I'm going to buy a new one tomorrow will update if it's the phone that's there problem.,2020年4月10日 在美国审核,0
Overall OK,"Phone works fine. Screen had no scratches and arrived with a tempered glass screen protector on (thankfully because I dropped it the first day while waiting on my case and amazingly finally got to witness one doing what its supposed to and only cracked the screen protector and not the phone!) Shipping was almost three whole business days later than tracking was claiming it would be the entire time up until it showed up.Came missing the s pen which was disappointing,didn't get it until a full week later, but it was a brand new Samsung packaged s pen with the accessories which I was pleased with since those are like $60. there were major scratches that chipped all the paint off around the charging port, idk how or why they did that but I was worried whoever used to have this phone was really aggressive with their usage/care and it'd effect the functionality but other than that cosmetic flaw there's nothing wrong with the phone that I've noticed.. all the built in battery health tests pass very well.. says it had 90% of its battery capacity upon first scan. I still feel like for refurbished i paid too much for a used phone that originally was sent to me half missing and seemingly uninterested customer service but it is what it is. Im satisfied overall, I paid just under $300 after tax &amp; it was free to switch it to my active metropcs service in one phone call, also has no boatyard which I've never actually had on a phone before I love that part!If you're considering a refurbished phone at all might as well try it and save a few hundred bucks this way bc Amazon will at least make it better if its not what you were expecting",2021年7月9日 在美国审核,0
"Great price, 3 Day shipping even on Corona Virus times, Like New","Purchased on Sunday night received it on Wednesday 9am. Note 9 came in a white box similar to original with Samsung logo on box. The phone was in great conditions, only a small scratch on the rim of the phone but you really need to look at closely it to see it. The box contain charger box, usb adcapter and cable, which looked like the original. The box was missing headphones.The phone works like new and is responsive. The battery seems to drain pretty quick I am not sure if I abuse it too much the first day but I used up a full charge in half of day. Or I am not sure if I need to change some settings to make it last longer.",2020年4月16日 在美国审核,0
Hybrid IT Great Seller,"Ordered a Note 9 through the seller Hybrid IT. I was excited to get the phone and it was in great condition. You wouldn't have known this was refurbished in the first place. Unfortunately the part of the screen used in conjunction with the s-pen was faulty on the left side of the device. I then contacted Hybrid IT and I sent it back and they sent me a replacement. New one works perfectly!Pros- Great customer service- Speedy shipping- Pretty much brand new looking-~300 for a flagship from 3 years ago is music to my ears- Packaged quite wellCons- spen may be a clone that won't connect via Bluetooth- You play the lottery when buying refurbished, but it's a lottery you'll win everytime in the end with Hybrid IT",2021年9月7日 在美国审核,1
Make sure you actually look at all the options before you buy,"I'd been on the fence about grabbing one of these and jumping ship from apple back to android. Glad I did, but I've seen a lot of negative reviews for these about receiving the wrong product. People, make sure you get the right kind of phone for your provider. CDMA and GSM phones are not the same, and if you don't know what those terms mean, do yourself a favor and research them.",2020年10月9日 在美国审核,0
"Don't buy, phone has errors and scratches, not a real refurb","Well, it is not factory refurbished. Just cleaned up and shipped with low end cables and charger. The phone had minor scratches on it, and a tiny crack in glass on back corner. Probably the most annoying thing is that I get a OMADM error constantly. At least a few times an hour. Neither samsung or t-mobile will do anything to help. I have to buy a new phone. Be careful, this company is not selling working phones. :(",2020年6月30日 在美国审核,1
Heads up locked to TMobile,Phone came and is in like new condition. Have had it two months no issue. They are locked to TMobile. TMobile won't unlock it since it's third party and the unlock app doesn't work that TMobile builds in,2019年9月1日 在美国审核,0
My renewed Galaxy Note 9 is in almost perfect condition!,"Great phone for being renewed. When I got it, it had 1 tiny scratch, but you can only see it when the phone off so, it's fine.I checked the battery health with AccuBattery as soon as I got it and it is rated at 93% battery capacity, which is really great for a phone over a year old.In the package, it came with a Samsung Fast Charger and a generic USB C cable, which works just as well. Also, the S Pen is in fairly good shape too. No other accessories were included.Overall, it's a great price and is in almost perfect condition.",2020年2月26日 在美国审核,0
I love my new note!,"I received my (renwed) Galaxy Note 9 in the mail a few days ago and couldn't be happier.The phone is flawless. It looks brand new! There aren't any scratches or blemishes anywhere! I took the phone to Verizon and had it activated. The phone was unlocked for the Verizon network so i had no issues. So far the phone works great. I ordered a case, charging cords and a new wireless charger also. So far so good. I saved a bunch of money ordering a.renewed phone and it was definitely worth it.",2020年8月12日 在美国审核,0
Excellent phone,"The Galaxy Note 9 is an excellent phone, and there is little to criticize it for.I could barely tell that this particular phone was renewed as there were no scratches on the screen and only a minor scratch on the back which my current phone case covers anyway.The phone is fast, has an excellent battery life, and the biometrics are accurate most of the time. You may have to re-enter your fingerprints from time to time if you use the scanner on back.The facial recognition works most of the time provided lighting conditions are reasonable.I am very satisfied with this purchase!",2020年7月7日 在美国审核,0
Better than the Iphone to me.,I love this phone.Learning how to use it.I took it to T-mobile for them to transfer the information from my Iphone to this phone.Even though you can probably do it yourself.Make sure you buy a protective case.Paid less on Amazon than in the store.Please research for yourself.,2020年7月12日 在美国审核,0
Fake S-Pen,"Got the phone. It works really well, very responsive. I'm happy with my upgrade so far. However, it did not ship with a real S-pen. It doesn't have a button on the side and will not pair with the phone. This means that the phone will keep notifying and annoying you that it can't pair with the S-pen. You can either have a permanent notification of that on your screen, or you can shell out and buy an S-pen yourself, which is what I am doing. Kind of annoying.",2019年12月13日 在美国审核,1
Only worth it if you're sure you'll use the stylus,"Undoubtedly a good phone, but I'm disappointed with the battery life and rarely find myself using the stylus. Also, I find the camera interface clunky and inconvenient. Maybe I just haven't put the time into customizing it. The phone is quite bulky and weighs more than others. Overall I think I would have done better to just go with a standard flagship phone.",2020年3月8日 在美国审核,1
"Phone was defective, exchange keeps getting delayed","Phone was defective, they promised to exchange it for a new one and deliver it within 2 days.Been over a week still no phone I sent mine back.No way to track it other than 2 emails said saying sorry its delayed.",2021年8月11日 在美国审核,1
Not amazing!,"Product is said to look like new. There wasn't much new about mine. The one I got has a dent in the top, 3 scratches on screen and multiple scratches on the body of the phone. It is obvious there was no work done on this phone. I will rate it three stars due to fact the phone works correctly and it is not the worst I have seen. It was definitely not worth the asking price. I'm sure it's just luck of the draw on the condition you will recieve.",2020年7月23日 在美国审核,1
Customer Service is AMAZING,"I received a refurbished phone in a condition I couldn't accept. I reached out to the seller and Jason offered to look for an acceptable replacement. The seller was quick to reach out with a solution. Although the phone did not work out, the seller was courteous and looked to solve my problem quickly.",2022年4月13日 在美国审核,0
Very VERY happy customer!! Thanks!!,Awesome seller!! Awesome phone!! Best purchase I've made in a loonngggg time!! Very happy customer! Verizon overnighted me a brand new sim card to slide right in this phone... took less than 2 days to download all my apps and get used to it! Very VERY happy!! Thank you to the seller!!,2020年7月4日 在美国审核,0
A great phone . Happy customer,Only have had a week so far.Talked to seller through email and was assured that It was an unlocked T-mobile phone in very good condition.I was not disappointed.Phone looks like new and so far runs like new with no issues . I use Metropcs and the wifi calling feature works.Still learning new phone but so far I am happy with my purchase.,2019年11月16日 在美国审核,0
"Excellent buy, excellent condition!!!","Was a little skeptical about buying a used/renewed phone but I made the right choice. This phone was surprisingly clean and scratch free!!!! Looks brand new!!!!! Good price as opposed to spending $1000.00 for a note 10. Downloaded contacts and pics from my old note , popped in the sim and was up and running in less than 10 mintues!!!!! No problems with my TMobile note 9.",2020年3月16日 在美国审核,0
"""WATCH FOR THE SWITCH-A-ROO TRICK""",Ordered a T-MOBILE and it specifically stated only will work on AT&amp;T or T-MOBILE. I get my phone and it's Verizon. I'm am so tired of these sellers thinking people are stupid.<br>It's not your money! Give us what we pay for!</br>,2021年1月22日 在美国审核,0
Great Price!,My wife and I have been using our note9s for two months now and they are fantastic phones. These refurbished phones do have some dings and scratches but you should have a case on your phone anyways so its not a problem.,2020年5月4日 在美国审核,0
Was sold locked phone with scratched screen,Amazon product description stated that the phone being sold was GSM unlocked yet T-Mobile reps at 2 different stores say that the phone is indeed locked with Verizon VPN numbers. Plus there is a scratch deep enough for a fingernail to get caught on in the middle left of the screen. I will never again buy a renewed phone off of Amazon. A solid fail.,2020年4月3日 在美国审核,0
its not a scam im serious,"i honestly didnt have my hopes up i thought this was just a scam but it actually wasnt a scam the battery leaves a lot to be desired but thats fine the phone works great its fast its efficent and way better than my last phone, i honestly didnt see anything wrong with the device to be so cheap but im not complaining",2020年8月25日 在美国审核,0
Hybridit  great seller.,Hybridit is a great seller. My Samsunggalaxynote 9 arrived very fast. The screen was in perfect shape. The body had only one tiny scratch. The battery life was verygood. The phone camewith all the currentandroid10 softwareupdate.I wouldrecommendthis sellerand phone to anyonelooking for a great phone at a greatprice.,2020年7月19日 在美国审核,0
"Great phone condition, would buy another refurbished  phone","My phone arrived in great condition, no visual sign of wear, easy to transfer phone info from old phone to new one, fingerprint reader and face recognitionis easy and accurate, battery life lasts all day, sound is great. Screen is clear, and clean. Phone arrived a day early, I would purchase from this seller again",2021年1月25日 在美国审核,0
"Like a new Note 9, highly satisfied","I ordered note 9 purple 128G on March 15th and to the day I'm writing this review, the phone is working perfectly no problem at allAll biometrics, camera, social media are working perfectly, I also got fast original charger it takes one hour and 25 min to go from dead battery to fully charged phoneI recommend this phone and this seller",2020年5月10日 在美国审核,0
Just what I expected,"The phone arrived well packed, in good condition, and exactly as advertised. All I needed to do was charge it up, switch SIMS, and download the updates. It holds a charge much longer than my old Samsung Galaxy.",2020年3月3日 在美国审核,0
Excellent phone- don't be afraid to order,"Phone was unlocked. I just inserted sim card, did wireless transfer of data from old phone to new phone. Everything went great. I've only had phone for few hours, but everything working great so far.I will update review if I have any problems",2019年12月16日 在美国审核,0
Beautiful phone,"This phone is so beautiful.The picture is clear and the phone itself is very responsive.However,after about 5 minutes of playing with it, it started getting warm to the touch.It did not happen during charging or during the initial setup.I want to love this phone but I do not want to be burned by love either.",2020年3月12日 在美国审核,0
