A lengthy review of a refurbished galaxy note 9,"I did a lot of research before buying a phone, and was quite worried that I would get ripped off from purchasing one online. Additionally, I've had poor luck with several of Amazon's third party retailers. With this in mind, I was very skeptical about potential false reviews, false advertising, or a damaged product. However, for the price it was the best deal I could find on a galaxy note 9 outside of a carrier plan. So, after seeing that the item was returnable I gave it a shot. Luckily, it worked. I recieved a fully unlocked note 9 with a charger and instructions on how to activate it.I will say that many of the reviews I read prior to buying insisted otherwise, and they were likely correct. If you're purchasing from Amazon, you'll probably see several similar looking deals with identical display pictures (which isn't a good sign in my book). Even if it is a prime eligible deal be careful and read through the descriptions. Look at the seller information and read the return policies on refurbished phones. It should list something about being returned within 2 weeks of the original purchase. If it does not be skeptical. Also, It should be noted that anyone can make up a business name and description on amazon, then sell used items out of their basement if they wanted, so look carefully through the seller's ""company"" reviews.Furthermore, the charger that came with my purchase was not an original Samsung charger. It was a cheaper off brand model that charged slower by comparison. The phone itself had little to no scratches. These micro scratches are small and only visible after a very close inspection on my part. The battery life on my phone has been excellent! This came as quite a nice surprise. I've used it for several months now and it keeps a charge like new. I can go two full days with mild/moderate use off one charge. ( Mild/moderate meaning not using my phone constantly throughout the day to watch movies, play games, or scroll through social media posts. I may have watched short videos for class, read emails, texts, short calls, etc.)Overall, the phone has worked quite well and continues to do so. Last thing I'll say is I highly reccomend the galaxy note 9 for the specs to cost ratio (as of 2019). Its a good phone for the value, even though phones in general are expensive. Any additional information on the phone specs and relative market comparisons would require another lengthy review, so I won't drag this on any further lol.Hopefully this helped someone and thanks for reading!",2019年7月19日 在美国审核,2
False advertisement,False advertisement i will be filing a claim this is not FACTORY UNLOCKED this phone belongs to at&amp;t i want my money back,2019年3月14日 在美国审核,2
Phones are NOT unlocked!,Ordered an "unlocked" Note 9. Phone came and is very much locked to Sprint. I have a very upset child and a now useless $800 phone.,2018年11月21日 在美国审核,0
False advertisement,False advertisement it is said to be factory unlocked but it’s not when I tried to use it for my straight talk service on Verizon I was told it’s locked to at&amp;t and t mobile,2019年1月16日 在美国审核,0
LOCKED TO SPRINT,This phone from Axe Wireless isn't unlocked.It's locked to SPRINT.,2019年1月9日 在美国审核,2
Save up for something new...,"Just got the phone...seems to be working ok, but it came with a broken charger and that's it. No sim tool or guide (not that anyone still uses those). It definitely feels like a cheap refurb. Reccomend that you save up for a new one.",2018年11月23日 在美国审核,0
Second Time's A Charm!,"Someone wrote that when we reviewed it would be helpful to write who we purchased our phone from so other potential buyers know who to buy from and who to avoid, so I will share my experience with trying to buy a secondhand note 9.<br>I had originally purchased a note 9 from WIRELESS WAREHOUSE. The phone was ""Amazon Renewed"" so I figured it would be in better shape, but it wasn't the quality that I was expecting, especially with the amount of scratches on the screen and the worn-out S-pen.Also, although the phone was supposed to be factory unlocked, the phone was locked to Sprint so it wouldn't work correctly with my Tracfone sim. For this reason, I ended up having to send back the phone.Afterwards, I bought a 2nd note 9, this time from EDGE CELLULAR and it came in near perfect condition with the exception of two little nicks on two of the corners but other than that, the phone was flawless [although, I did pay about $50 more for this one (total $440) than the original one I bought]. One thing different about this purchase was that it came in a Samsung box with all the original accessories including some headphones.Also, the 2nd phone was truly factory unlocked, so when I put in my Tracfone sim, it worked automatically. I'm much happier with the 2nd purchase and I think I will be keeping this one as long as it remains working well. I'll give an update in about a month or so to be sure.Hope this helps y'all.UPDATE: though it's been longer than a month, I just thought I'd mention that the phone is still great even in 2020. I absolutely love this Note 9 and am glad I made the purchase. Everything still works great!</br>",2019年11月19日 在美国审核,2
Great phone,"Opted for a note 9 instead of the upcoming 10 due to budget restraints and it is by far an excellent choice. I really didn't need all the bells ND whistles of the 10.This one works excellently. It came in a white box with charger, cable, Sim tray pin. I took out my Sim and SD card from my note 8, popped them in, turned on Samsung Switch on both ND let it rip. Done in less than an hour, every single app, contact, song, password, account, keyboard, done! Calls are much clearer, louder.This was a renewed phone and it is flawless out of the box. Not one scratch or ding.",2019年7月14日 在美国审核,0
No WiFi calling on this model,"Love the Galaxy Note 9 but I had to return this phone because it does not have WiFi calling. It was compatible with Verizon like it advertised but apparently the model N960u1 is not compatible with WiFi calling. It was suggested that the model N960u would be compatible with WiFi calling but since I can't check it before I buy it, I won't be buying factory unlocked again. I checked the phone at the Verizon store and it does have WiFi calling and is model N960u, so maybe it is just a model problem instead of an unlocked problem. However, it was indicated by the technicians that flash firmware would have to be downloaded on unlocked phones.",2018年12月10日 在美国审核,0
The phone is amazing,"Honestly it looks exactly like in the picture the screen and the phone both look amazing and I can't believe I got away with it for 600$ super win. The phone hasn't been acting up yet and the fingerprint scanner detects every move, it has a very sensible screen, the pen works very well with the phone and the camera quality is mesmerizing will post examples. No complaints yet I'm not a professional photographer",2019年4月14日 在美国审核,1
Great phone!,So i get this phone for my wifes birthday and its supposed to be a unlocked tmobile phone.....give it to her turn it on and wham needs a network unlock code...super lame that its not unlocked like advertised. Im waiting to be contacted by the seller to fix problem. I will update all with what they do to make things right.Update: the customer service was awsome they fix my problem overnight. So i would order from them again. The phone i got was top notch,2019年11月21日 在美国审核,2
(Works Great)/ Does have Cosmetic Damage,"After Evaluation over some monthsLikes: Phone is fast. Battery life is great used for 3 days off one charge. All the ports work properly. S pen functional and work fine. Phone calls sound clear and mic works fine. Camera is Great. Phone was compatible for my (Sim Card) that I recieved from tmobile. Also It had Tmobile programmed in it but it is unlocked so I would assume any Sim should work...Dislikes: Phone has cosmetic damages. Minor scrapes along edges could be due to usage or previous maintenance. Screen is new however there was a very small indentation in it (No Scratches Though). ""Product is renewed so its not served in an original package with original accessories. Instead it has an off brand charger, used off brand headphones, and off brand charger base.""If you don't plan on buying a case and want a brand new phone for the look of a brand new phone I wouldn't recommend this, but if you are in need of a phone for a cheaper price, with great functionality, and plan on buying a case, I would recommend you checking this product out.",2019年11月18日 在美国审核,0
Just like new,"I know Amazon does not say which seller you bought from, so I'll say I bought my renewed Galaxy Note 9 from Re-Cell and I 1000% recommend to buy from them! I was very hesitant to buy a renewed phone, especially from Amazon where it's such a mixed bag. I'm glad to say I'm pleasantly surprised! I couldn't even tell the phone was ever used except for the fact that it was turned on in the box when I first opened it. The box itself was honestly impressive, it looked exactly like the galaxy note 9 box but with the seller's logo instead of Samsung's. I should also mention that it is listed as a Verizon unlocked phone, but came unlocked for all carriers!In terms of the phone, there were no scratches, dents or anything of the like. Everything is fully functional. The S-pen is the original Samsung one. No problems with call quality, wifi connectivity, etc. The charger isn't the original, but again looks like a replica of the original. I had a bit of an issue with getting the charger to fast charge the phone, every few minutes the screen would light up as it would stop and then start charging again. However, I have a few other fast charging adapters and cables, so this wasn't a big deal. The seller even included headphones! Nothing amazing, but enough to go above and beyond the Amazon listing.Again, I bought this phone from Re-Cell and can't verify the condition of the device you would get from another seller. But with the money back guarantee, I would recommend buying this phone and returning it if the condition is bad. You really can't beat the price.",2020年1月16日 在美国审核,2
Works like new to me.,My refurbished phone looks and works great. Like new to me. I saved so much off the price of a new phone. Comes with a 90 day money back guarantee. Can't beat all of that.,2018年11月26日 在美国审核,2
Nice phone only a few minor problems,"**UPDATE 3-16-2020**Phone recently updated to Android 10 and it has gone south. I can charge the battery to 100% and go to bed, when I wake up 8 hours later the battery will be drained 25% or more. I found that if I leave wifi OFF it will only drain 5% overnight. So for some reason wifi now causes the battery life to shorten considerably.With only a 90 day warranty on the ""renewed"" phones, I am out of luck for repair 10 months after purchasing the phone.**ORIGINAL 4 STAR REVIEW** I bought a ""Renewed"" phone from Seller CellGuru. It arrived before the date originally quoted on the order. All i got was a phone and a charger. The battery was at 18% upon arrival so I plugged it into the included charger and went out for the night. When I returned more than 5 hours later, the battery was at 24% so I was shocked. I messaged Amazon and after a little troubleshooting, it appears the charger is defective. They gave me a credit to buy a new charger on Amazon and all is good.The screen does have VERY minor scratches which are visible only at certain angles in sunlight, so it's not 100% renewed.I had to take the phone to Verizon to get a new sim card because I was upgrading from a Note 4 with a much larger sim card. They gave me a new sim card in minutes, plugged it in for me and it was good to go! The guy at Verizon told me they can also give me insurance on the phone but I passed.The only thing that scared me was before I got the sim card, I used the phone on wi-fi to transfer all of my apps and such over. I opened Google chrome and it went directly to a Sprint home page. So, after seeing that I was afraid it was going to be locked to Sprint but it wasn't. It must have been a Sprint phone before being unlocked.The only reason I took off a star was because of the little scratches on the screen and the shoddy charger.I will update my review if things turn south with the phone in my 90 warranty period.If you found this review helpful, please click the button below. Thanks!",2019年5月20日 在美国审核,0
Great for the price,"got this phone on Tuesday and haven't had any issues yet. the phone has no dents or scratches which is good. phone came in orginal box with orginal booklet, charger, cable, and tool to install mini SD card. reading some other reviews I was surprised I got some of the orginal stuff but that makes it even better. The phone was unlocked just as described and worked with my Verizon Sim card from my S8. Very nice phone.",2018年12月22日 在美国审核,2
"Charging port doesn't insert phone, not original type c charger, phone turns off at 14%","The phone wasn't in it's original box ""Samsung"", the charger wasn't the original one, it didn't come with the plastic new phones come to be protected from scratches, and the phone was also power on. The area you insert to charge the phone is a little off, in the sense of that the type C cable would not stay inside to charge the phone. You have to insert it very hard and even with that, the phone notifies me that it's not properly charging. I shouldn't have to insert the cable that roughly because no Samsung ever required that. The phone takes forever to charge, I put my phone to charge 12am it's 5:55am on a dec 6, 2019 and it has charged to 84%. The phone is nice and easy to maneuver but it has a flaw in the charging port area. The battery is also flaky because the phone turns off at 14%. This has been a huge disappointment and expensive mistake. I am returning the device.New update: I reached out to the third party selling this item for a refund. They never responded so I had to contact amazon and file a report with them. Amazon try reaching out to them and the third party didn’t comply. Amazon had to pay me back for the money that these people owed me. Do not buy anything from them.",2019年12月6日 在美国审核,0
Perfect,Perfect condition second time I ordered a refurbished phone. Im completely satisfied. It's been a week so far and I can clearly say that this phone is awesome. I'm so glad I decided to order this phone off of Amazon. To all the questionable people. Don't question yourself buy the phone,2019年11月14日 在美国审核,2
They dont check the phones before they "verify" them,Recieved phone but its locked and cant use it. Now I have to spend time returing this phone and awaiting my refund so I can purchase a new phone. Careless quality control from the seller.,2019年12月18日 在美国审核,2
Note 9 honest review,"I generally don't add reviews on products, but the reviews of others helped me make this purchase so I am paying it forward. First, I highly recommend you check the seller before buying and making sure they have a high rate of positive reviews and low rate/if any negative reviews. Also make sure they adhere to Amazons return policy, I saw a seller or two with additional hoops they add on top of the return policy, and I wasn't trying to bother with that noise. I purchased my Note 9 from CR Daily Deals. So far about 2 weeks after purchasing I am pretty satisfied with the phone. I previously had a Samsung Note 5 and the upgrade to the Note 9 was pretty nice. The biggest change between them being the battery life, the Note 9 lasts me from 6:30am to about 10pm and is about 50% battery life, its really nice not being tethered to a wall every few hours. I received only the Phone itself and a generic charger block and wire. No stylus nibs or extractor, biggest pain is no SIM card key, which also happens to be where the SD card is located. Thankfully 128gb is plenty for me for the foreseeable future of my use on this phone. Very easily got the phone activated on Verizon with a 5 minute store trip, and then using the Smart Switch app was able to move over literally everything from previous phone. At this point, putting both phones next to each other, you would only be able to notice a difference in the phone itself otherwise all my apps, photos, folders, etc. are exactly where they were on my previous phone. So far, no complaints on how the phone works (aside from small things I need to get used to), and no issues with the performance of the phone. The phone did also have a screen protector already installed on it, however it was almost 100% from previous owner not the seller and it does not cover the curvature of the screen. Literally just this morning I noticed there is a slight chipping to the edge of the protector, I highly recommend getting a protector that actually covers the entirety of the screen, that is my next purchase.<br>Overall, if you are somewhat hesitant to make the purchase, I will let you know so was I. Thankfully it ended up being a great purchase and I would recommend the seller CR Daily Deals or GoOverstock.com from the sellers I have seen. You are also covered by a solid return policy, but here's to hoping that will be unnecessary. Good luck out there!</br>",2019年8月27日 在美国审核,0
Great phone,"So far I have really enjoyed it. The videos as great. Much clearer than my previous phone. Same with photos. The voice to text/email is great although it doesn't always translate what I say correctly. The amount of memory is the best. I haven't run low on memory space, nor do I think I will anytime soon. Runs quickly too. Works just fine with mt Metro PCS account. Super easy to transfer my data and contacts as well. Came with a nice set of ear buds, something I wasn't expecting. Overall I'm very happy with the purchase.",2019年10月16日 在美国审核,0
NOT factory unlocked,"I received my phone and it flashed a Spectrum logo and asked for a network unlock code. This is not what the listing says, nor is it what I intended to purchase.",2019年4月4日 在美国审核,0
"No earphones, instructions, or retail packaging. But the phone was flawless. Totally worth it.","No wonder this is known to be the king of smartphones! I got a refurbished phone but it arrived absolutely flawless. Not a single flaw I could find and I actually looked! It arrived on the 2nd day I purchased it. It did not have the original packaging nor did it come with any paperwork or manuals, but it came with everything you need. No earphones either but that's not a necessity for me. If you want to save money (like more than a couple hundred) get the refurbished one... because the phone itself with show up brand new.",2019年2月6日 在美国审核,2
Works perfect with Metro PCS,"I have nothing but good things to say about my purchase. I got one for me and one for my wife. My carrier is MetroPcs, phones were unlocked and with all its parts included. Best buy of 2018. Phones are working perfectly so far.",2018年12月31日 在美国审核,2
Great phone but you may need to buy a couple,"**Update**<br>The phone would not not connect to Sprint 4G. Samsung acknowledged that there is a software problem due to the merger of Sprint and Tmobile and they are not compatible with Sprint at the moment. Had to file an A-to-Z claim with O'Crack because they never refunded me after returning the phone.I ended up buying a few of these phones and returning the one I didn't want. The first one I received from Digital Age USA and had a screen protector on it, and a small gash. It was obviously a pre-owned phone that they were trying to pawn off as a reconditioned phone. If you receive a phone with a screen protector remove it immediately and check the screen, most of the time they are trying to hide screen burn or scratches. The second phone I received was from O'Crack and was like night and day, it was like a brand new phone. I am so glad I purchased the second one because I was starting to think that that was the quality of phones from this listing. The return went seamlessly and I was refunded my money within about a week. The phone itself is amazing, I've used the phone all day and still cannot drain the battery completely. The camera is very impressive in low light settings. I'm very happy with my purchase and it would recommend it.</br>",2020年10月11日 在美国审核,2
Worked with Verizon SIM,Everything was perfect came with the Samsung genuine charger and the original S-Pen and worked great. Just inserted my already activated Verizon SIM card from my old phone and worked immediately. I bought the 128GB version and actually received the 512GB version instead.,2019年11月17日 在美国审核,1
"It's  awsome,galaxy note 9","I LIKE THE GALAXY NOTE 9, IT LOOKED BRAND NEW , WORKING GREAT, THANK YOU, THE ONLYISSUE I HAD WAS THE CHARGER WAS NO GOOD, BUT GOT A NEW CHARGER AND THE PHONE IS AWSOME, ITS WORTH 5 STARS. I AM A HAPPY CUSTOMER",2019年10月2日 在美国审核,2
Worth it!,I bought it when my samsung s8 plus went dead suddenly.I didnt want to spend more on phone but ad was already useing high end phone from samsung it was difficult for me to use a midrange phone with compromised quality.Then I saw on youtube its better to go for a old flagship model rather than buying current mid range.I searched and got this samsung note 9 option on amazon.you tube vloggers highly recommended this buying it from here. I was not sure but wanted to risk it as the price was low and there was 90 day return policy.its 1 and half month since i bought samsung note 9 (unlocked) phone.Its running super smoothly .The condition of phone wasnt bad atall.The stylus pen working excellent.Camera is awesome.Guys overall i am very satisfied.The only thing which is a little disappointing is that the protective tampered glass coverings that are available for this phone is awful .Their touch sensitivity is so bad literally you have to struggle to type a message.I just ripped it off from my phone and now its all good.,2020年11月19日 在美国审核,0
Phone definitely did not "look like new" as indicated in the product description,"I get it, it's a refurbished phone. I wasn't expecting it to be perfect. When mine arrived today, from ""Axe Wireless"", I looked at it, and roughly 30 seconds later I was sealing the box back up. It was badly scratched all along the left edge of the phone. The product description reads, ""...has been tested and certified to work and look like new, with minimal to no signs of wear."" This was DEFINITELY not the case. Very disappointed. Came with an HTC charger and zero other accessories. Not worth the savings.",2019年1月11日 在美国审核,0
I admit I was a bit hesitant - I do not regret this purchase.,"I will admit I was a little hesitant on picking up a ""Renewed"" phone, I wasn't sure what to expect. I purchased the Midnight Black Note 9 from DNCL-TECHZONE, INC and so far I could not be more happy.<br>The phone came secured in an unmarked white box inside the Amazon package with a charger brick and a cable, I already knew this from the description and previous comments/reviews so this was not a surprise, I have headphones and other chargers so this was not a factor.My first impression out of the box - cosmeticallythe phone is absolutely flawless, no scratches anywhere, screen is perfectly fine. It even had what appeared as a form fitting protective plastic film along the top protecting the SIM card tray and the bottom where the speaker, charging port and S-Pen is located. The phone booted up fast, it guided me through the setup just like a brand new phone. Since the battery was down to 18% I charged it, again no issues at all. Full charge to 100% took about 2 hours, 20 minutes, (I'll probably pick up a fast charger at a later date.)Now coming from iPhone/ iOS the Android system is completely new to me and a slight learning curve, but a fun one. It did need a software update, it looks like the update from Aug. 2019 that adds Night photo mode, new user interface, other new features to the Android system. The update installed without any problems. Opening multiple apps, working with split screen, playing with the S-Pen, the phone is super fast, no apps - or phone crashed.I was working initially via WiFi with downloading apps, connecting email accounts, etc. A slight concern that I had was - would my Verizon SIM card on my iPhone work on the Note 9? (I've seen some posts that SIM cards have slight issues when swapped) For me, it worked without a problem, the Note immediately showed the device as a Verizon connected phone. Some of my contacts both iPhone and Android users transferred from my iPhone over to the Note 9, not all of them though - not quite sure why, I just assume that's a Verizon setting perhaps, not a big deal. Text messages worked fine, phone call quality is great. Adding the 128GB Micro SD - same area where the SIM card is located - immediately bumping this to a 256GB phone is also a beautiful thing!So far so good. I'm very happy with this purchase. I do recommend this seller.</br>",2019年10月23日 在美国审核,0
Straight Talk Verizon works,"Note 9 looks great, no scratches or dents!Samsung Adaptive fast charger included.Supplied cord won't fast charge though.Used a different cord and the Note 9 fast charges.Put a Straight Talk Verizon SIM card in and it worked immediately.Will report back when I test the battery life.The phone shows 100% on battery status.No bloatware and boots to a Samsung screen instead of a network.Probably an unlocked version from Samsung.",2019年12月5日 在美国审核,0
